export function getDocumentacionData()
{
   const rawData = [
  {
    "@odata.etag": 'W/"3554668170"',
    "modifiedon@OData.Community.Display.V1.FormattedValue": "23/12/2025 13:31",
    modifiedon: "2025-12-23T12:31:10Z",
    osp_subcategoria: null,
    osp_documentacionid: "37ffd5c4-c025-f011-8c4d-000d3a22d7c3",
    "osp_validadocontratacion@OData.Community.Display.V1.FormattedValue": "No",
    osp_validadocontratacion: false,
    "createdon@OData.Community.Display.V1.FormattedValue": "30/04/2025 14:43",
    createdon: "2025-04-30T12:43:57Z",
    osp_nombre:
      "RE CAS-132998-M6D0M4_THE RED KIWI SOCIEDAD LIMITADA _300425.msg",
    _ownerid: "GONZALEZ DIEZ, MIRIAM",
    "_ownerid_value@Microsoft.Dynamics.CRM.associatednavigationproperty":
      "ownerid",
    "_ownerid_value@Microsoft.Dynamics.CRM.lookuplogicalname": "systemuser",
    _ownerid_value: "6f5078c2-a430-eb11-80fa-0050568345f9",
    "osp_validadoordering@OData.Community.Display.V1.FormattedValue": "No",
    osp_validadoordering: false,
    osp_registro:
      "CAS-152196-Q7G8J6 - CAS-124742-G6W5D2 - Portabilidad resto 90x",
    "_osp_oportunidad_value@OData.Community.Display.V1.FormattedValue":
      "OPP-0078401 - proyecto covergente",
    "_osp_oportunidad_value@Microsoft.Dynamics.CRM.associatednavigationproperty":
      "osp_oportunidad",
    "_osp_oportunidad_value@Microsoft.Dynamics.CRM.lookuplogicalname":
      "opportunity",
    _osp_oportunidad_value: "53fac40b-c952-4c3c-a12a-778df2689633",
    "osp_tipificacion@OData.Community.Display.V1.FormattedValue":
      "Requisitos Clientes",
    osp_tipificacion: 863920000,
    "osp_proyecto@OData.Community.Display.V1.FormattedValue": "No",
    osp_proyecto: false,
    osp_descripcion: "Requisitos cliente",
    osp_link:
      "https://ggccorange.sharepoint.com/Dynamics/opportunity/OPP-0078401 - proyecto covergente/CAS-152196-Q7G8J6 - CAS-124742-G6W5D2 - Portabilidad resto 90x/RE CAS-132998-M6D0M4_THE RED KIWI SOCIEDAD LIMITADA _300425.msg",
    "osp_categoria@OData.Community.Display.V1.FormattedValue":
      "Inventario de requisitos",
    osp_categoria: 18,
    _modifiedby: "CRM, Admin",
    "_modifiedby_value@Microsoft.Dynamics.CRM.lookuplogicalname": "systemuser",
    _modifiedby_value: "ac79a518-0950-e611-80c1-005056a03d45",
  },
  {
    "@odata.etag": 'W/"3554675025"',
    "modifiedon@OData.Community.Display.V1.FormattedValue": "23/12/2025 13:33",
    modifiedon: "2025-12-23T12:33:48Z",
    osp_subcategoria: null,
    osp_documentacionid: "cb7301b4-c90f-f011-998a-000d3a27bc60",
    "osp_validadocontratacion@OData.Community.Display.V1.FormattedValue": "No",
    osp_validadocontratacion: false,
    "createdon@OData.Community.Display.V1.FormattedValue": "02/04/2025 15:52",
    createdon: "2025-04-02T13:52:30Z",
    osp_nombre: "RV Cambio Cargo de Licencias.msg",
    _ownerid: "GONZALEZ DIEZ, MIRIAM",
    "_ownerid_value@Microsoft.Dynamics.CRM.associatednavigationproperty":
      "ownerid",
    "_ownerid_value@Microsoft.Dynamics.CRM.lookuplogicalname": "systemuser",
    _ownerid_value: "6f5078c2-a430-eb11-80fa-0050568345f9",
    "osp_validadoordering@OData.Community.Display.V1.FormattedValue": "No",
    osp_validadoordering: false,
    osp_registro:
      "CAS-149752-C0Q6P6 - CAS-124742-G6W5D2 - Cambio cargo licencias",
    "_osp_oportunidad_value@OData.Community.Display.V1.FormattedValue":
      "OPP-0078401 - proyecto covergente",
    "_osp_oportunidad_value@Microsoft.Dynamics.CRM.associatednavigationproperty":
      "osp_oportunidad",
    "_osp_oportunidad_value@Microsoft.Dynamics.CRM.lookuplogicalname":
      "opportunity",
    _osp_oportunidad_value: "53fac40b-c952-4c3c-a12a-778df2689633",
    "osp_tipificacion@OData.Community.Display.V1.FormattedValue":
      "Autorizaciones Internas",
    osp_tipificacion: 863920008,
    "osp_proyecto@OData.Community.Display.V1.FormattedValue": "No",
    osp_proyecto: false,
    osp_descripcion: "Requisitos KAM",
    osp_link:
      "https://ggccorange.sharepoint.com/Dynamics/opportunity/OPP-0078401 - proyecto covergente/CAS-149752-C0Q6P6 - CAS-124742-G6W5D2 - Cambio cargo licencias/RV Cambio Cargo de Licencias.msg",
    "osp_categoria@OData.Community.Display.V1.FormattedValue":
      "Autorizaciones internas KAM",
    osp_categoria: 6,
    _modifiedby: "CRM, Admin",
    "_modifiedby_value@Microsoft.Dynamics.CRM.lookuplogicalname": "systemuser",
    _modifiedby_value: "ac79a518-0950-e611-80c1-005056a03d45",
  },
  {
    "@odata.etag": 'W/"3554686415"',
    "modifiedon@OData.Community.Display.V1.FormattedValue": "23/12/2025 13:36",
    modifiedon: "2025-12-23T12:36:19Z",
    osp_subcategoria: null,
    osp_documentacionid: "fc47bcec-d603-f011-bae3-000d3a27bc60",
    "osp_validadocontratacion@OData.Community.Display.V1.FormattedValue": "No",
    osp_validadocontratacion: false,
    "createdon@OData.Community.Display.V1.FormattedValue": "18/03/2025 9:56",
    createdon: "2025-03-18T08:56:54Z",
    osp_nombre:
      "THE RED KIWI B06940415 Plantilla_Provision_Digital_Centrex.xlsx",
    _ownerid: "GONZALEZ DIEZ, MIRIAM",
    "_ownerid_value@Microsoft.Dynamics.CRM.associatednavigationproperty":
      "ownerid",
    "_ownerid_value@Microsoft.Dynamics.CRM.lookuplogicalname": "systemuser",
    _ownerid_value: "6f5078c2-a430-eb11-80fa-0050568345f9",
    "osp_validadoordering@OData.Community.Display.V1.FormattedValue": "No",
    osp_validadoordering: false,
    osp_registro:
      "CAS-147794-L7Z7M5 - CAS-124742-G6W5D2 - Migracion a CENTREX FILLEART-Girona",
    "_osp_oportunidad_value@OData.Community.Display.V1.FormattedValue":
      "OPP-0078401 - proyecto covergente",
    "_osp_oportunidad_value@Microsoft.Dynamics.CRM.associatednavigationproperty":
      "osp_oportunidad",
    "_osp_oportunidad_value@Microsoft.Dynamics.CRM.lookuplogicalname":
      "opportunity",
    _osp_oportunidad_value: "53fac40b-c952-4c3c-a12a-778df2689633",
    "osp_tipificacion@OData.Community.Display.V1.FormattedValue":
      "Documentacion de proyecto y provisi\u00f3n",
    osp_tipificacion: 863920012,
    "osp_proyecto@OData.Community.Display.V1.FormattedValue": "No",
    osp_proyecto: false,
    osp_descripcion: "Plantilla CENTREX",
    osp_link:
      "https://ggccorange.sharepoint.com/Dynamics/opportunity/OPP-0078401 - proyecto covergente/CAS-147794-L7Z7M5 - CAS-124742-G6W5D2 - Migracion a CENTREX FILLEART-Girona/THE RED KIWI B06940415 Plantilla_Provision_Digital_Centrex.xlsx",
    "osp_categoria@OData.Community.Display.V1.FormattedValue": "Centrex",
    osp_categoria: 8,
    _modifiedby: "CRM, Admin",
    "_modifiedby_value@Microsoft.Dynamics.CRM.lookuplogicalname": "systemuser",
    _modifiedby_value: "ac79a518-0950-e611-80c1-005056a03d45",
  },
  {
    "@odata.etag": 'W/"3554686521"',
    "modifiedon@OData.Community.Display.V1.FormattedValue": "23/12/2025 13:36",
    modifiedon: "2025-12-23T12:36:21Z",
    osp_subcategoria: null,
    osp_documentacionid: "aeb3c113-0b04-f011-bae3-000d3a27bc60",
    "osp_validadocontratacion@OData.Community.Display.V1.FormattedValue": "Yes",
    osp_validadocontratacion: true,
    "createdon@OData.Community.Display.V1.FormattedValue": "18/03/2025 16:10",
    createdon: "2025-03-18T15:10:09Z",
    osp_nombre: "Centralita ClinicasMarzo25.xlsx",
    _ownerid: "GONZALEZ DIEZ, MIRIAM",
    "_ownerid_value@Microsoft.Dynamics.CRM.associatednavigationproperty":
      "ownerid",
    "_ownerid_value@Microsoft.Dynamics.CRM.lookuplogicalname": "systemuser",
    _ownerid_value: "6f5078c2-a430-eb11-80fa-0050568345f9",
    "osp_validadoordering@OData.Community.Display.V1.FormattedValue": "No",
    osp_validadoordering: false,
    osp_registro:
      "CAS-148313-D2P9W5 - CAS-124742-G6W5D2 - Plantilla CENTREX San Sebastian, Hospital BCNy Huesca",
    "_osp_oportunidad_value@OData.Community.Display.V1.FormattedValue":
      "OPP-0078401 - proyecto covergente",
    "_osp_oportunidad_value@Microsoft.Dynamics.CRM.associatednavigationproperty":
      "osp_oportunidad",
    "_osp_oportunidad_value@Microsoft.Dynamics.CRM.lookuplogicalname":
      "opportunity",
    _osp_oportunidad_value: "53fac40b-c952-4c3c-a12a-778df2689633",
    "osp_tipificacion@OData.Community.Display.V1.FormattedValue":
      "Documentacion de proyecto y provisi\u00f3n",
    osp_tipificacion: 863920012,
    "osp_proyecto@OData.Community.Display.V1.FormattedValue": "No",
    osp_proyecto: false,
    osp_descripcion: "Plantilla CENTREX",
    osp_link:
      "https://ggccorange.sharepoint.com/Dynamics/opportunity/OPP-0078401 - proyecto covergente/CAS-148313-D2P9W5 - CAS-124742-G6W5D2 - Plantilla CENTREX San Sebastian, Hospital BCNy Huesca/Centralita ClinicasMarzo25.xlsx",
    "osp_categoria@OData.Community.Display.V1.FormattedValue": "Centrex",
    osp_categoria: 8,
    _modifiedby: "CRM, Admin",
    "_modifiedby_value@Microsoft.Dynamics.CRM.lookuplogicalname": "systemuser",
    _modifiedby_value: "ac79a518-0950-e611-80c1-005056a03d45",
  },
  {
    "@odata.etag": 'W/"3554687004"',
    "modifiedon@OData.Community.Display.V1.FormattedValue": "23/12/2025 13:36",
    modifiedon: "2025-12-23T12:36:35Z",
    osp_subcategoria: null,
    osp_documentacionid: "b9f48743-2c06-f011-bae3-000d3a27bc60",
    "osp_validadocontratacion@OData.Community.Display.V1.FormattedValue": "No",
    osp_validadocontratacion: false,
    "createdon@OData.Community.Display.V1.FormattedValue": "21/03/2025 9:12",
    createdon: "2025-03-21T08:12:45Z",
    osp_nombre:
      "THE RED KIWI 625890077   635306203  Plantilla_Provision_Digital_Centrex.xlsx",
    _ownerid: "LAGO RUIZ, JOSE",
    "_ownerid_value@Microsoft.Dynamics.CRM.associatednavigationproperty":
      "ownerid",
    "_ownerid_value@Microsoft.Dynamics.CRM.lookuplogicalname": "systemuser",
    _ownerid_value: "039f6c0f-aaba-ee11-a569-6045bd905b10",
    "osp_validadoordering@OData.Community.Display.V1.FormattedValue": "No",
    osp_validadoordering: false,
    osp_registro:
      "CAS-146416-F2V9M5 - Plantilla migracion a CENTREX sede VALLIRANA",
    "_osp_oportunidad_value@OData.Community.Display.V1.FormattedValue":
      "OPP-0078401 - proyecto covergente",
    "_osp_oportunidad_value@Microsoft.Dynamics.CRM.associatednavigationproperty":
      "osp_oportunidad",
    "_osp_oportunidad_value@Microsoft.Dynamics.CRM.lookuplogicalname":
      "opportunity",
    _osp_oportunidad_value: "53fac40b-c952-4c3c-a12a-778df2689633",
    "osp_tipificacion@OData.Community.Display.V1.FormattedValue":
      "Documentacion de proyecto y provisi\u00f3n",
    osp_tipificacion: 863920012,
    "osp_proyecto@OData.Community.Display.V1.FormattedValue": "No",
    osp_proyecto: false,
    osp_descripcion: "plantilla",
    osp_link:
      "https://ggccorange.sharepoint.com/Dynamics/opportunity/OPP-0078401 - proyecto covergente/CAS-146416-F2V9M5 - Plantilla migracion a CENTREX sede VALLIRANA/THE RED KIWI 625890077   635306203  Plantilla_Provision_Digital_Centrex.xlsx",
    "osp_categoria@OData.Community.Display.V1.FormattedValue": "Centrex",
    osp_categoria: 8,
    _modifiedby: "CRM, Admin",
    "_modifiedby_value@Microsoft.Dynamics.CRM.lookuplogicalname": "systemuser",
    _modifiedby_value: "ac79a518-0950-e611-80c1-005056a03d45",
  },
  {
    "@odata.etag": 'W/"3554687006"',
    "modifiedon@OData.Community.Display.V1.FormattedValue": "23/12/2025 13:36",
    modifiedon: "2025-12-23T12:36:35Z",
    osp_subcategoria: null,
    osp_documentacionid: "06378049-2c06-f011-bae3-000d3a27bc60",
    "osp_validadocontratacion@OData.Community.Display.V1.FormattedValue": "Yes",
    osp_validadocontratacion: true,
    "createdon@OData.Community.Display.V1.FormattedValue": "21/03/2025 9:13",
    createdon: "2025-03-21T08:13:01Z",
    osp_nombre: "THE RED KIWI 625890077   635306203  INVENTARIO ORANGE.xlsx",
    _ownerid: "LAGO RUIZ, JOSE",
    "_ownerid_value@Microsoft.Dynamics.CRM.associatednavigationproperty":
      "ownerid",
    "_ownerid_value@Microsoft.Dynamics.CRM.lookuplogicalname": "systemuser",
    _ownerid_value: "039f6c0f-aaba-ee11-a569-6045bd905b10",
    "osp_validadoordering@OData.Community.Display.V1.FormattedValue": "No",
    osp_validadoordering: false,
    osp_registro:
      "CAS-146416-F2V9M5 - Plantilla migracion a CENTREX sede VALLIRANA",
    "_osp_oportunidad_value@OData.Community.Display.V1.FormattedValue":
      "OPP-0078401 - proyecto covergente",
    "_osp_oportunidad_value@Microsoft.Dynamics.CRM.associatednavigationproperty":
      "osp_oportunidad",
    "_osp_oportunidad_value@Microsoft.Dynamics.CRM.lookuplogicalname":
      "opportunity",
    _osp_oportunidad_value: "53fac40b-c952-4c3c-a12a-778df2689633",
    "osp_tipificacion@OData.Community.Display.V1.FormattedValue":
      "Documentacion de proyecto y provisi\u00f3n",
    osp_tipificacion: 863920012,
    "osp_proyecto@OData.Community.Display.V1.FormattedValue": "No",
    osp_proyecto: false,
    osp_descripcion: "inventario",
    osp_link:
      "https://ggccorange.sharepoint.com/Dynamics/opportunity/OPP-0078401 - proyecto covergente/CAS-146416-F2V9M5 - Plantilla migracion a CENTREX sede VALLIRANA/THE RED KIWI 625890077   635306203  INVENTARIO ORANGE.xlsx",
    "osp_categoria@OData.Community.Display.V1.FormattedValue": "Centrex",
    osp_categoria: 8,
    _modifiedby: "CRM, Admin",
    "_modifiedby_value@Microsoft.Dynamics.CRM.lookuplogicalname": "systemuser",
    _modifiedby_value: "ac79a518-0950-e611-80c1-005056a03d45",
  },
  {
    "@odata.etag": 'W/"3554687025"',
    "modifiedon@OData.Community.Display.V1.FormattedValue": "23/12/2025 13:36",
    modifiedon: "2025-12-23T12:36:36Z",
    osp_subcategoria: null,
    osp_documentacionid: "1fa2a8e4-3006-f011-bae3-000d3a27bc60",
    "osp_validadocontratacion@OData.Community.Display.V1.FormattedValue": "No",
    osp_validadocontratacion: false,
    "createdon@OData.Community.Display.V1.FormattedValue": "21/03/2025 9:46",
    createdon: "2025-03-21T08:46:01Z",
    osp_nombre:
      "THE RED KIWI Donostia, Hospital BCN y Huesca  Plantilla_Provision_Digital_Centrex.xlsx",
    _ownerid: "LAGO RUIZ, JOSE",
    "_ownerid_value@Microsoft.Dynamics.CRM.associatednavigationproperty":
      "ownerid",
    "_ownerid_value@Microsoft.Dynamics.CRM.lookuplogicalname": "systemuser",
    _ownerid_value: "039f6c0f-aaba-ee11-a569-6045bd905b10",
    "osp_validadoordering@OData.Community.Display.V1.FormattedValue": "No",
    osp_validadoordering: false,
    osp_registro:
      "CAS-148313-D2P9W5 - CAS-124742-G6W5D2 - Plantilla CENTREX San Sebastian, Hospital BCNy Huesca",
    "_osp_oportunidad_value@OData.Community.Display.V1.FormattedValue":
      "OPP-0078401 - proyecto covergente",
    "_osp_oportunidad_value@Microsoft.Dynamics.CRM.associatednavigationproperty":
      "osp_oportunidad",
    "_osp_oportunidad_value@Microsoft.Dynamics.CRM.lookuplogicalname":
      "opportunity",
    _osp_oportunidad_value: "53fac40b-c952-4c3c-a12a-778df2689633",
    "osp_tipificacion@OData.Community.Display.V1.FormattedValue":
      "Documentacion de proyecto y provisi\u00f3n",
    osp_tipificacion: 863920012,
    "osp_proyecto@OData.Community.Display.V1.FormattedValue": "No",
    osp_proyecto: false,
    osp_descripcion: "plantilla",
    osp_link:
      "https://ggccorange.sharepoint.com/Dynamics/opportunity/OPP-0078401 - proyecto covergente/CAS-148313-D2P9W5 - CAS-124742-G6W5D2 - Plantilla CENTREX San Sebastian, Hospital BCNy Huesca/THE RED KIWI Donostia, Hospital BCN y Huesca  Plantilla_Provision_Digital_Centrex.xlsx",
    "osp_categoria@OData.Community.Display.V1.FormattedValue": "Centrex",
    osp_categoria: 8,
    _modifiedby: "CRM, Admin",
    "_modifiedby_value@Microsoft.Dynamics.CRM.lookuplogicalname": "systemuser",
    _modifiedby_value: "ac79a518-0950-e611-80c1-005056a03d45",
  },
  {
    "@odata.etag": 'W/"3554687029"',
    "modifiedon@OData.Community.Display.V1.FormattedValue": "23/12/2025 13:36",
    modifiedon: "2025-12-23T12:36:36Z",
    osp_subcategoria: null,
    osp_documentacionid: "61bca2f0-3006-f011-bae3-000d3a27bc60",
    "osp_validadocontratacion@OData.Community.Display.V1.FormattedValue": "Yes",
    osp_validadocontratacion: true,
    "createdon@OData.Community.Display.V1.FormattedValue": "21/03/2025 9:46",
    createdon: "2025-03-21T08:46:21Z",
    osp_nombre:
      "THE RED KIWI Donostia, Hospital BCN y Huesca  INVENTARIO ORANGE.xlsx",
    _ownerid: "LAGO RUIZ, JOSE",
    "_ownerid_value@Microsoft.Dynamics.CRM.associatednavigationproperty":
      "ownerid",
    "_ownerid_value@Microsoft.Dynamics.CRM.lookuplogicalname": "systemuser",
    _ownerid_value: "039f6c0f-aaba-ee11-a569-6045bd905b10",
    "osp_validadoordering@OData.Community.Display.V1.FormattedValue": "No",
    osp_validadoordering: false,
    osp_registro:
      "CAS-148313-D2P9W5 - CAS-124742-G6W5D2 - Plantilla CENTREX San Sebastian, Hospital BCNy Huesca",
    "_osp_oportunidad_value@OData.Community.Display.V1.FormattedValue":
      "OPP-0078401 - proyecto covergente",
    "_osp_oportunidad_value@Microsoft.Dynamics.CRM.associatednavigationproperty":
      "osp_oportunidad",
    "_osp_oportunidad_value@Microsoft.Dynamics.CRM.lookuplogicalname":
      "opportunity",
    _osp_oportunidad_value: "53fac40b-c952-4c3c-a12a-778df2689633",
    "osp_tipificacion@OData.Community.Display.V1.FormattedValue":
      "Documentacion de proyecto y provisi\u00f3n",
    osp_tipificacion: 863920012,
    "osp_proyecto@OData.Community.Display.V1.FormattedValue": "No",
    osp_proyecto: false,
    osp_descripcion: "inventario",
    osp_link:
      "https://ggccorange.sharepoint.com/Dynamics/opportunity/OPP-0078401 - proyecto covergente/CAS-148313-D2P9W5 - CAS-124742-G6W5D2 - Plantilla CENTREX San Sebastian, Hospital BCNy Huesca/THE RED KIWI Donostia, Hospital BCN y Huesca  INVENTARIO ORANGE.xlsx",
    "osp_categoria@OData.Community.Display.V1.FormattedValue": "Centrex",
    osp_categoria: 8,
    _modifiedby: "CRM, Admin",
    "_modifiedby_value@Microsoft.Dynamics.CRM.lookuplogicalname": "systemuser",
    _modifiedby_value: "ac79a518-0950-e611-80c1-005056a03d45",
  },
  {
    "@odata.etag": 'W/"3554687604"',
    "modifiedon@OData.Community.Display.V1.FormattedValue": "23/12/2025 13:37",
    modifiedon: "2025-12-23T12:37:00Z",
    osp_subcategoria: null,
    osp_documentacionid: "62e77218-340a-f011-bae3-000d3a27bc60",
    "osp_validadocontratacion@OData.Community.Display.V1.FormattedValue": "No",
    osp_validadocontratacion: false,
    "createdon@OData.Community.Display.V1.FormattedValue": "26/03/2025 12:18",
    createdon: "2025-03-26T11:18:59Z",
    osp_nombre: "RE DORSIA PEDIDO PORTATILES 24032025.msg",
    _ownerid: "GONZALEZ DIEZ, MIRIAM",
    "_ownerid_value@Microsoft.Dynamics.CRM.associatednavigationproperty":
      "ownerid",
    "_ownerid_value@Microsoft.Dynamics.CRM.lookuplogicalname": "systemuser",
    _ownerid_value: "6f5078c2-a430-eb11-80fa-0050568345f9",
    "osp_validadoordering@OData.Community.Display.V1.FormattedValue": "No",
    osp_validadoordering: false,
    osp_registro:
      "CAS-149034-V7P1Y2 - CAS-124742-G6W5D2 - Pedido portatiles 24-03-2025",
    "_osp_oportunidad_value@OData.Community.Display.V1.FormattedValue":
      "OPP-0078401 - proyecto covergente",
    "_osp_oportunidad_value@Microsoft.Dynamics.CRM.associatednavigationproperty":
      "osp_oportunidad",
    "_osp_oportunidad_value@Microsoft.Dynamics.CRM.lookuplogicalname":
      "opportunity",
    _osp_oportunidad_value: "53fac40b-c952-4c3c-a12a-778df2689633",
    "osp_tipificacion@OData.Community.Display.V1.FormattedValue":
      "Requisitos Clientes",
    osp_tipificacion: 863920000,
    "osp_proyecto@OData.Community.Display.V1.FormattedValue": "No",
    osp_proyecto: false,
    osp_descripcion: "Pedido portatiles",
    osp_link:
      "https://ggccorange.sharepoint.com/Dynamics/opportunity/OPP-0078401 - proyecto covergente/CAS-149034-V7P1Y2 - CAS-124742-G6W5D2 - Pedido portatiles 24-03-2025/RE DORSIA PEDIDO PORTATILES 24032025.msg",
    "osp_categoria@OData.Community.Display.V1.FormattedValue":
      "Inventario de requisitos",
    osp_categoria: 18,
    _modifiedby: "CRM, Admin",
    "_modifiedby_value@Microsoft.Dynamics.CRM.lookuplogicalname": "systemuser",
    _modifiedby_value: "ac79a518-0950-e611-80c1-005056a03d45",
  },
  {
    "@odata.etag": 'W/"3554702847"',
    "modifiedon@OData.Community.Display.V1.FormattedValue": "23/12/2025 13:42",
    modifiedon: "2025-12-23T12:42:03Z",
    osp_subcategoria: null,
    osp_documentacionid: "8bec1b5b-dc58-f011-877b-000d3a2c89f1",
    "osp_validadocontratacion@OData.Community.Display.V1.FormattedValue": "Yes",
    osp_validadocontratacion: true,
    "createdon@OData.Community.Display.V1.FormattedValue": "04/07/2025 15:39",
    createdon: "2025-07-04T13:39:50Z",
    osp_nombre: "NUEVA CLINICA DORSIA.msg",
    _ownerid: "GONZALEZ DIEZ, MIRIAM",
    "_ownerid_value@Microsoft.Dynamics.CRM.associatednavigationproperty":
      "ownerid",
    "_ownerid_value@Microsoft.Dynamics.CRM.lookuplogicalname": "systemuser",
    _ownerid_value: "6f5078c2-a430-eb11-80fa-0050568345f9",
    "osp_validadoordering@OData.Community.Display.V1.FormattedValue": "No",
    osp_validadoordering: false,
    osp_registro: "CAS-158867-T0X6Y4",
    "_osp_oportunidad_value@OData.Community.Display.V1.FormattedValue":
      "OPP-0078401 - proyecto covergente",
    "_osp_oportunidad_value@Microsoft.Dynamics.CRM.associatednavigationproperty":
      "osp_oportunidad",
    "_osp_oportunidad_value@Microsoft.Dynamics.CRM.lookuplogicalname":
      "opportunity",
    _osp_oportunidad_value: "53fac40b-c952-4c3c-a12a-778df2689633",
    "osp_tipificacion@OData.Community.Display.V1.FormattedValue":
      "Requisitos Clientes",
    osp_tipificacion: 863920000,
    "osp_proyecto@OData.Community.Display.V1.FormattedValue": "No",
    osp_proyecto: false,
    osp_descripcion: "Datos plantilla",
    osp_link:
      "https://ggccorange.sharepoint.com/Dynamics/opportunity/OPP-0078401 - proyecto covergente/CAS-158867-T0X6Y4/NUEVA CLINICA DORSIA.msg",
    "osp_categoria@OData.Community.Display.V1.FormattedValue":
      "Inventario de requisitos",
    osp_categoria: 18,
    _modifiedby: "CRM, Admin",
    "_modifiedby_value@Microsoft.Dynamics.CRM.lookuplogicalname": "systemuser",
    _modifiedby_value: "ac79a518-0950-e611-80c1-005056a03d45",
  },
  {
    "@odata.etag": 'W/"3554716973"',
    "modifiedon@OData.Community.Display.V1.FormattedValue": "23/12/2025 13:46",
    modifiedon: "2025-12-23T12:46:18Z",
    osp_subcategoria: null,
    osp_documentacionid: "93d88062-c3e3-ef11-a730-000d3a2c89f1",
    "osp_validadocontratacion@OData.Community.Display.V1.FormattedValue": "No",
    osp_validadocontratacion: false,
    "createdon@OData.Community.Display.V1.FormattedValue": "05/02/2025 14:16",
    createdon: "2025-02-05T13:16:29Z",
    osp_nombre: "Oferta CAS-121951-Z8V8G8 (1).xlsx",
    _ownerid: "CRM, Admin",
    "_ownerid_value@Microsoft.Dynamics.CRM.associatednavigationproperty":
      "ownerid",
    "_ownerid_value@Microsoft.Dynamics.CRM.lookuplogicalname": "systemuser",
    _ownerid_value: "ac79a518-0950-e611-80c1-005056a03d45",
    "osp_validadoordering@OData.Community.Display.V1.FormattedValue": "No",
    osp_validadoordering: false,
    osp_registro: "OPP-0078401 - WAOC-0052691 - Proyecto convergente",
    "_osp_oportunidad_value@OData.Community.Display.V1.FormattedValue":
      "OPP-0078401 - proyecto covergente",
    "_osp_oportunidad_value@Microsoft.Dynamics.CRM.associatednavigationproperty":
      "osp_oportunidad",
    "_osp_oportunidad_value@Microsoft.Dynamics.CRM.lookuplogicalname":
      "opportunity",
    _osp_oportunidad_value: "53fac40b-c952-4c3c-a12a-778df2689633",
    "osp_tipificacion@OData.Community.Display.V1.FormattedValue": "PdN",
    osp_tipificacion: 863920001,
    "osp_proyecto@OData.Community.Display.V1.FormattedValue": "No",
    osp_proyecto: false,
    osp_descripcion: null,
    osp_link:
      "https://ggccorange.sharepoint.com/Dynamics/elob_validation/OPP-0078401 - WAOC-0052691 - Proyecto convergente/Oferta%20CAS-121951-Z8V8G8%20%281%29.xlsx",
    osp_categoria: null,
    _modifiedby: "CRM, Admin",
    "_modifiedby_value@Microsoft.Dynamics.CRM.lookuplogicalname": "systemuser",
    _modifiedby_value: "ac79a518-0950-e611-80c1-005056a03d45",
  },
  {
    "@odata.etag": 'W/"3554740696"',
    "modifiedon@OData.Community.Display.V1.FormattedValue": "23/12/2025 13:53",
    modifiedon: "2025-12-23T12:53:40Z",
    osp_subcategoria: null,
    osp_documentacionid: "b68726c2-c53b-f011-b4cc-000d3a2c89f1",
    "osp_validadocontratacion@OData.Community.Display.V1.FormattedValue": "No",
    osp_validadocontratacion: false,
    "createdon@OData.Community.Display.V1.FormattedValue": "28/05/2025 15:15",
    createdon: "2025-05-28T13:15:10Z",
    osp_nombre: "Oferta Orange-Dorsia 7\u00aa ENTREGA V1.xlsx",
    _ownerid: "GONZALEZ DIEZ, MIRIAM",
    "_ownerid_value@Microsoft.Dynamics.CRM.associatednavigationproperty":
      "ownerid",
    "_ownerid_value@Microsoft.Dynamics.CRM.lookuplogicalname": "systemuser",
    _ownerid_value: "6f5078c2-a430-eb11-80fa-0050568345f9",
    "osp_validadoordering@OData.Community.Display.V1.FormattedValue": "No",
    osp_validadoordering: false,
    osp_registro:
      "CAS-154964-C4Q7N9 - CAS-124742-G6W5D2 - Pedido portatiles Espirinet 7\u00aaEntrega",
    "_osp_oportunidad_value@OData.Community.Display.V1.FormattedValue":
      "OPP-0078401 - proyecto covergente",
    "_osp_oportunidad_value@Microsoft.Dynamics.CRM.associatednavigationproperty":
      "osp_oportunidad",
    "_osp_oportunidad_value@Microsoft.Dynamics.CRM.lookuplogicalname":
      "opportunity",
    _osp_oportunidad_value: "53fac40b-c952-4c3c-a12a-778df2689633",
    "osp_tipificacion@OData.Community.Display.V1.FormattedValue":
      "Ofertas de terceros",
    osp_tipificacion: 863920007,
    "osp_proyecto@OData.Community.Display.V1.FormattedValue": "No",
    osp_proyecto: false,
    osp_descripcion: "Oferta Proveedor",
    osp_link:
      "https://ggccorange.sharepoint.com/Dynamics/opportunity/OPP-0078401 - proyecto covergente/CAS-154964-C4Q7N9 - CAS-124742-G6W5D2 - Pedido portatiles Espirinet 7\u00aaEntrega/Oferta Orange-Dorsia 7\u00aa ENTREGA V1.xlsx",
    "osp_categoria@OData.Community.Display.V1.FormattedValue":
      "Oferta de proveedores",
    osp_categoria: 20,
    _modifiedby: "CRM, Admin",
    "_modifiedby_value@Microsoft.Dynamics.CRM.lookuplogicalname": "systemuser",
    _modifiedby_value: "ac79a518-0950-e611-80c1-005056a03d45",
  },
  {
    "@odata.etag": 'W/"3554741391"',
    "modifiedon@OData.Community.Display.V1.FormattedValue": "23/12/2025 13:53",
    modifiedon: "2025-12-23T12:53:58Z",
    osp_subcategoria: null,
    osp_documentacionid: "125d165f-dd6d-f011-b4cc-000d3a2c89f1",
    "osp_validadocontratacion@OData.Community.Display.V1.FormattedValue": "No",
    osp_validadocontratacion: false,
    "createdon@OData.Community.Display.V1.FormattedValue": "31/07/2025 9:10",
    createdon: "2025-07-31T07:10:09Z",
    osp_nombre:
      "1PG_Westcon_Comstor_ORANGE ESPAGNE SAU_CLINICAS DORSIA_Quote-23825789_en.xls",
    _ownerid: "GONZALEZ DIEZ, MIRIAM",
    "_ownerid_value@Microsoft.Dynamics.CRM.associatednavigationproperty":
      "ownerid",
    "_ownerid_value@Microsoft.Dynamics.CRM.lookuplogicalname": "systemuser",
    _ownerid_value: "6f5078c2-a430-eb11-80fa-0050568345f9",
    "osp_validadoordering@OData.Community.Display.V1.FormattedValue": "No",
    osp_validadoordering: false,
    osp_registro: "CAS-160886-M6N0C8",
    "_osp_oportunidad_value@OData.Community.Display.V1.FormattedValue":
      "OPP-0078401 - proyecto covergente",
    "_osp_oportunidad_value@Microsoft.Dynamics.CRM.associatednavigationproperty":
      "osp_oportunidad",
    "_osp_oportunidad_value@Microsoft.Dynamics.CRM.lookuplogicalname":
      "opportunity",
    _osp_oportunidad_value: "53fac40b-c952-4c3c-a12a-778df2689633",
    "osp_tipificacion@OData.Community.Display.V1.FormattedValue":
      "Ofertas de terceros",
    osp_tipificacion: 863920007,
    "osp_proyecto@OData.Community.Display.V1.FormattedValue": "No",
    osp_proyecto: false,
    osp_descripcion: "Oferta proveedor",
    osp_link:
      "https://ggccorange.sharepoint.com/Dynamics/opportunity/OPP-0078401 - proyecto covergente/CAS-160886-M6N0C8/1PG_Westcon_Comstor_ORANGE ESPAGNE SAU_CLINICAS DORSIA_Quote-23825789_en.xls",
    "osp_categoria@OData.Community.Display.V1.FormattedValue":
      "Oferta de proveedores",
    osp_categoria: 20,
    _modifiedby: "CRM, Admin",
    "_modifiedby_value@Microsoft.Dynamics.CRM.lookuplogicalname": "systemuser",
    _modifiedby_value: "ac79a518-0950-e611-80c1-005056a03d45",
  },
  {
    "@odata.etag": 'W/"3554741423"',
    "modifiedon@OData.Community.Display.V1.FormattedValue": "23/12/2025 13:53",
    modifiedon: "2025-12-23T12:53:59Z",
    osp_subcategoria: null,
    osp_documentacionid: "f7eb7077-006e-f011-b4cc-000d3a2c89f1",
    "osp_validadocontratacion@OData.Community.Display.V1.FormattedValue": "No",
    osp_validadocontratacion: false,
    "createdon@OData.Community.Display.V1.FormattedValue": "31/07/2025 13:21",
    createdon: "2025-07-31T11:21:16Z",
    osp_nombre:
      "30072025 THE RED KIWI Mallorca Puerto Pi Plantilla_Provision_Digital_Centrex.xlsx",
    _ownerid: "GONZALEZ DIEZ, MIRIAM",
    "_ownerid_value@Microsoft.Dynamics.CRM.associatednavigationproperty":
      "ownerid",
    "_ownerid_value@Microsoft.Dynamics.CRM.lookuplogicalname": "systemuser",
    _ownerid_value: "6f5078c2-a430-eb11-80fa-0050568345f9",
    "osp_validadoordering@OData.Community.Display.V1.FormattedValue": "No",
    osp_validadoordering: false,
    osp_registro: "CAS-160735-Q4G8P3",
    "_osp_oportunidad_value@OData.Community.Display.V1.FormattedValue":
      "OPP-0078401 - proyecto covergente",
    "_osp_oportunidad_value@Microsoft.Dynamics.CRM.associatednavigationproperty":
      "osp_oportunidad",
    "_osp_oportunidad_value@Microsoft.Dynamics.CRM.lookuplogicalname":
      "opportunity",
    _osp_oportunidad_value: "53fac40b-c952-4c3c-a12a-778df2689633",
    "osp_tipificacion@OData.Community.Display.V1.FormattedValue":
      "Documentacion de proyecto y provisi\u00f3n",
    osp_tipificacion: 863920012,
    "osp_proyecto@OData.Community.Display.V1.FormattedValue": "No",
    osp_proyecto: false,
    osp_descripcion: "Plantilla CENTREX",
    osp_link:
      "https://ggccorange.sharepoint.com/Dynamics/opportunity/OPP-0078401 - proyecto covergente/CAS-160735-Q4G8P3/30072025 THE RED KIWI Mallorca Puerto Pi Plantilla_Provision_Digital_Centrex.xlsx",
    "osp_categoria@OData.Community.Display.V1.FormattedValue": "Centrex",
    osp_categoria: 8,
    _modifiedby: "CRM, Admin",
    "_modifiedby_value@Microsoft.Dynamics.CRM.lookuplogicalname": "systemuser",
    _modifiedby_value: "ac79a518-0950-e611-80c1-005056a03d45",
  },
  {
    "@odata.etag": 'W/"3554741465"',
    "modifiedon@OData.Community.Display.V1.FormattedValue": "23/12/2025 13:54",
    modifiedon: "2025-12-23T12:54:00Z",
    osp_subcategoria: null,
    osp_documentacionid: "38f3dcbc-1f6e-f011-b4cc-000d3a2c89f1",
    "osp_validadocontratacion@OData.Community.Display.V1.FormattedValue": "Yes",
    osp_validadocontratacion: true,
    "createdon@OData.Community.Display.V1.FormattedValue": "31/07/2025 17:05",
    createdon: "2025-07-31T15:05:07Z",
    osp_nombre: "Pedido Portatiles Fuerteventura 31072025.msg",
    _ownerid: "GONZALEZ DIEZ, MIRIAM",
    "_ownerid_value@Microsoft.Dynamics.CRM.associatednavigationproperty":
      "ownerid",
    "_ownerid_value@Microsoft.Dynamics.CRM.lookuplogicalname": "systemuser",
    _ownerid_value: "6f5078c2-a430-eb11-80fa-0050568345f9",
    "osp_validadoordering@OData.Community.Display.V1.FormattedValue": "No",
    osp_validadoordering: false,
    osp_registro: "CAS-160992-Y4V7D1",
    "_osp_oportunidad_value@OData.Community.Display.V1.FormattedValue":
      "OPP-0078401 - proyecto covergente",
    "_osp_oportunidad_value@Microsoft.Dynamics.CRM.associatednavigationproperty":
      "osp_oportunidad",
    "_osp_oportunidad_value@Microsoft.Dynamics.CRM.lookuplogicalname":
      "opportunity",
    _osp_oportunidad_value: "53fac40b-c952-4c3c-a12a-778df2689633",
    "osp_tipificacion@OData.Community.Display.V1.FormattedValue":
      "Autorizaciones Internas",
    osp_tipificacion: 863920008,
    "osp_proyecto@OData.Community.Display.V1.FormattedValue": "No",
    osp_proyecto: false,
    osp_descripcion: "Requisitos cliente",
    osp_link:
      "https://ggccorange.sharepoint.com/Dynamics/opportunity/OPP-0078401 - proyecto covergente/CAS-160992-Y4V7D1/Pedido Portatiles Fuerteventura 31072025.msg",
    "osp_categoria@OData.Community.Display.V1.FormattedValue":
      "Autorizaciones internas KAM",
    osp_categoria: 6,
    _modifiedby: "CRM, Admin",
    "_modifiedby_value@Microsoft.Dynamics.CRM.lookuplogicalname": "systemuser",
    _modifiedby_value: "ac79a518-0950-e611-80c1-005056a03d45",
  },
  {
    "@odata.etag": 'W/"3554751068"',
    "modifiedon@OData.Community.Display.V1.FormattedValue": "23/12/2025 13:57",
    modifiedon: "2025-12-23T12:57:27Z",
    osp_subcategoria: null,
    osp_documentacionid: "2c23b1ff-d80b-f011-bae3-000d3a2c89f1",
    "osp_validadocontratacion@OData.Community.Display.V1.FormattedValue": "No",
    osp_validadocontratacion: false,
    "createdon@OData.Community.Display.V1.FormattedValue": "28/03/2025 14:31",
    createdon: "2025-03-28T13:31:57Z",
    osp_nombre: "ELENAS financiera_elenas.xlsx",
    _ownerid: "GALAN ARANA, MARIA DOLORES",
    "_ownerid_value@Microsoft.Dynamics.CRM.associatednavigationproperty":
      "ownerid",
    "_ownerid_value@Microsoft.Dynamics.CRM.lookuplogicalname": "systemuser",
    _ownerid_value: "61165073-1603-eb11-80f2-0050568345f9",
    "osp_validadoordering@OData.Community.Display.V1.FormattedValue": "No",
    osp_validadoordering: false,
    osp_registro:
      "CAS-149189-M2N9C1 - CAS-124742-G6W5D2 - Financiacion equipso Orange 13 sedes",
    "_osp_oportunidad_value@OData.Community.Display.V1.FormattedValue":
      "OPP-0078401 - proyecto covergente",
    "_osp_oportunidad_value@Microsoft.Dynamics.CRM.associatednavigationproperty":
      "osp_oportunidad",
    "_osp_oportunidad_value@Microsoft.Dynamics.CRM.lookuplogicalname":
      "opportunity",
    _osp_oportunidad_value: "53fac40b-c952-4c3c-a12a-778df2689633",
    osp_tipificacion: null,
    "osp_proyecto@OData.Community.Display.V1.FormattedValue": "No",
    osp_proyecto: false,
    osp_descripcion: null,
    osp_link:
      "https://ggccorange.sharepoint.com/Dynamics/opportunity/OPP-0078401 - proyecto covergente/CAS-149189-M2N9C1 - CAS-124742-G6W5D2 - Financiacion equipso Orange 13 sedes/ELENAS financiera_elenas.xlsx",
    osp_categoria: null,
    _modifiedby: "CRM, Admin",
    "_modifiedby_value@Microsoft.Dynamics.CRM.lookuplogicalname": "systemuser",
    _modifiedby_value: "ac79a518-0950-e611-80c1-005056a03d45",
  },
  {
    "@odata.etag": 'W/"3554757855"',
    "modifiedon@OData.Community.Display.V1.FormattedValue": "23/12/2025 13:59",
    modifiedon: "2025-12-23T12:59:54Z",
    osp_subcategoria: null,
    osp_documentacionid: "31d25676-26f4-ef11-be20-000d3a2c89f1",
    "osp_validadocontratacion@OData.Community.Display.V1.FormattedValue": "No",
    osp_validadocontratacion: false,
    "createdon@OData.Community.Display.V1.FormattedValue": "26/02/2025 10:46",
    createdon: "2025-02-26T09:46:00Z",
    osp_nombre: "NUEVA CLINICA DORSIA EN MADIRD.msg",
    _ownerid: "GONZALEZ DIEZ, MIRIAM",
    "_ownerid_value@Microsoft.Dynamics.CRM.associatednavigationproperty":
      "ownerid",
    "_ownerid_value@Microsoft.Dynamics.CRM.lookuplogicalname": "systemuser",
    _ownerid_value: "6f5078c2-a430-eb11-80fa-0050568345f9",
    "osp_validadoordering@OData.Community.Display.V1.FormattedValue": "No",
    osp_validadoordering: false,
    osp_registro:
      "CAS-146052-R1T6G5 - Plantilla CENTREX - Huelva y Madrid-Alcal\u00e1 LOMA LINDA",
    "_osp_oportunidad_value@OData.Community.Display.V1.FormattedValue":
      "OPP-0078401 - proyecto covergente",
    "_osp_oportunidad_value@Microsoft.Dynamics.CRM.associatednavigationproperty":
      "osp_oportunidad",
    "_osp_oportunidad_value@Microsoft.Dynamics.CRM.lookuplogicalname":
      "opportunity",
    _osp_oportunidad_value: "53fac40b-c952-4c3c-a12a-778df2689633",
    "osp_tipificacion@OData.Community.Display.V1.FormattedValue":
      "Requisitos Clientes",
    osp_tipificacion: 863920000,
    "osp_proyecto@OData.Community.Display.V1.FormattedValue": "No",
    osp_proyecto: false,
    osp_descripcion: "Detalle numeraci\u00f3n ",
    osp_link:
      "https://ggccorange.sharepoint.com/Dynamics/opportunity/OPP-0078401 - proyecto covergente/CAS-146052-R1T6G5 - Plantilla CENTREX - Huelva y Madrid-Alcal\u00e1 LOMA LINDA/NUEVA CLINICA DORSIA EN MADIRD.msg",
    "osp_categoria@OData.Community.Display.V1.FormattedValue":
      "Inventario de requisitos",
    osp_categoria: 18,
    _modifiedby: "CRM, Admin",
    "_modifiedby_value@Microsoft.Dynamics.CRM.lookuplogicalname": "systemuser",
    _modifiedby_value: "ac79a518-0950-e611-80c1-005056a03d45",
  },
  {
    "@odata.etag": 'W/"3554757871"',
    "modifiedon@OData.Community.Display.V1.FormattedValue": "23/12/2025 13:59",
    modifiedon: "2025-12-23T12:59:54Z",
    osp_subcategoria: null,
    osp_documentacionid: "62835694-26f4-ef11-be20-000d3a2c89f1",
    "osp_validadocontratacion@OData.Community.Display.V1.FormattedValue": "Yes",
    osp_validadocontratacion: true,
    "createdon@OData.Community.Display.V1.FormattedValue": "26/02/2025 10:46",
    createdon: "2025-02-26T09:46:50Z",
    osp_nombre: "Nueva cl\u00ednica Dorsia en Huelva.msg",
    _ownerid: "GONZALEZ DIEZ, MIRIAM",
    "_ownerid_value@Microsoft.Dynamics.CRM.associatednavigationproperty":
      "ownerid",
    "_ownerid_value@Microsoft.Dynamics.CRM.lookuplogicalname": "systemuser",
    _ownerid_value: "6f5078c2-a430-eb11-80fa-0050568345f9",
    "osp_validadoordering@OData.Community.Display.V1.FormattedValue": "No",
    osp_validadoordering: false,
    osp_registro:
      "CAS-146052-R1T6G5 - Plantilla CENTREX - Huelva y Madrid-Alcal\u00e1 LOMA LINDA",
    "_osp_oportunidad_value@OData.Community.Display.V1.FormattedValue":
      "OPP-0078401 - proyecto covergente",
    "_osp_oportunidad_value@Microsoft.Dynamics.CRM.associatednavigationproperty":
      "osp_oportunidad",
    "_osp_oportunidad_value@Microsoft.Dynamics.CRM.lookuplogicalname":
      "opportunity",
    _osp_oportunidad_value: "53fac40b-c952-4c3c-a12a-778df2689633",
    "osp_tipificacion@OData.Community.Display.V1.FormattedValue":
      "Requisitos Clientes",
    osp_tipificacion: 863920000,
    "osp_proyecto@OData.Community.Display.V1.FormattedValue": "No",
    osp_proyecto: false,
    osp_descripcion: "Datos numeraci\u00f3n ",
    osp_link:
      "https://ggccorange.sharepoint.com/Dynamics/opportunity/OPP-0078401 - proyecto covergente/CAS-146052-R1T6G5 - Plantilla CENTREX - Huelva y Madrid-Alcal\u00e1 LOMA LINDA/Nueva cl\u00ednica Dorsia en Huelva.msg",
    "osp_categoria@OData.Community.Display.V1.FormattedValue":
      "Inventario de requisitos",
    osp_categoria: 18,
    _modifiedby: "CRM, Admin",
    "_modifiedby_value@Microsoft.Dynamics.CRM.lookuplogicalname": "systemuser",
    _modifiedby_value: "ac79a518-0950-e611-80c1-005056a03d45",
  },
  {
    "@odata.etag": 'W/"3554757887"',
    "modifiedon@OData.Community.Display.V1.FormattedValue": "23/12/2025 13:59",
    modifiedon: "2025-12-23T12:59:54Z",
    osp_subcategoria: null,
    osp_documentacionid: "1e97a9ad-28f4-ef11-be20-000d3a2c89f1",
    "osp_validadocontratacion@OData.Community.Display.V1.FormattedValue": "No",
    osp_validadocontratacion: false,
    "createdon@OData.Community.Display.V1.FormattedValue": "26/02/2025 11:01",
    createdon: "2025-02-26T10:01:50Z",
    osp_nombre: "RE Nueva cl\u00ednica Calle Alcala Madrid.msg",
    _ownerid: "GONZALEZ DIEZ, MIRIAM",
    "_ownerid_value@Microsoft.Dynamics.CRM.associatednavigationproperty":
      "ownerid",
    "_ownerid_value@Microsoft.Dynamics.CRM.lookuplogicalname": "systemuser",
    _ownerid_value: "6f5078c2-a430-eb11-80fa-0050568345f9",
    "osp_validadoordering@OData.Community.Display.V1.FormattedValue": "No",
    osp_validadoordering: false,
    osp_registro:
      "CAS-146056-K3Q4K3 - CAS-124742-G6W5D2 - Sede Madrid-Alcal\u00e1",
    "_osp_oportunidad_value@OData.Community.Display.V1.FormattedValue":
      "OPP-0078401 - proyecto covergente",
    "_osp_oportunidad_value@Microsoft.Dynamics.CRM.associatednavigationproperty":
      "osp_oportunidad",
    "_osp_oportunidad_value@Microsoft.Dynamics.CRM.lookuplogicalname":
      "opportunity",
    _osp_oportunidad_value: "53fac40b-c952-4c3c-a12a-778df2689633",
    "osp_tipificacion@OData.Community.Display.V1.FormattedValue":
      "Requisitos Clientes",
    osp_tipificacion: 863920000,
    "osp_proyecto@OData.Community.Display.V1.FormattedValue": "No",
    osp_proyecto: false,
    osp_descripcion: "Requisitos cliente",
    osp_link:
      "https://ggccorange.sharepoint.com/Dynamics/opportunity/OPP-0078401 - proyecto covergente/CAS-146056-K3Q4K3 - CAS-124742-G6W5D2 - Sede Madrid-Alcal\u00e1/RE Nueva cl\u00ednica Calle Alcala Madrid.msg",
    "osp_categoria@OData.Community.Display.V1.FormattedValue": "Otros",
    osp_categoria: 24,
    _modifiedby: "CRM, Admin",
    "_modifiedby_value@Microsoft.Dynamics.CRM.lookuplogicalname": "systemuser",
    _modifiedby_value: "ac79a518-0950-e611-80c1-005056a03d45",
  },
  {
    "@odata.etag": 'W/"3554758005"',
    "modifiedon@OData.Community.Display.V1.FormattedValue": "23/12/2025 13:59",
    modifiedon: "2025-12-23T12:59:56Z",
    osp_subcategoria: null,
    osp_documentacionid: "958c0987-46f4-ef11-be20-000d3a2c89f1",
    "osp_validadocontratacion@OData.Community.Display.V1.FormattedValue": "No",
    osp_validadocontratacion: false,
    "createdon@OData.Community.Display.V1.FormattedValue": "26/02/2025 14:35",
    createdon: "2025-02-26T13:35:29Z",
    osp_nombre:
      "THE RED KIWI SOCIEDAD LIMITADA LOMA LINDA, S.L Plantilla_Provision_Digital_Centrex.xlsx",
    _ownerid: "GONZALEZ DIEZ, MIRIAM",
    "_ownerid_value@Microsoft.Dynamics.CRM.associatednavigationproperty":
      "ownerid",
    "_ownerid_value@Microsoft.Dynamics.CRM.lookuplogicalname": "systemuser",
    _ownerid_value: "6f5078c2-a430-eb11-80fa-0050568345f9",
    "osp_validadoordering@OData.Community.Display.V1.FormattedValue": "No",
    osp_validadoordering: false,
    osp_registro:
      "CAS-146120-Y2J4Y3 - CAS-124742-G6W5D2 - CENTREX Loma Linda (Huelva y Mad-Alcala)",
    "_osp_oportunidad_value@OData.Community.Display.V1.FormattedValue":
      "OPP-0078401 - proyecto covergente",
    "_osp_oportunidad_value@Microsoft.Dynamics.CRM.associatednavigationproperty":
      "osp_oportunidad",
    "_osp_oportunidad_value@Microsoft.Dynamics.CRM.lookuplogicalname":
      "opportunity",
    _osp_oportunidad_value: "53fac40b-c952-4c3c-a12a-778df2689633",
    "osp_tipificacion@OData.Community.Display.V1.FormattedValue":
      "Documentacion de proyecto y provisi\u00f3n",
    osp_tipificacion: 863920012,
    "osp_proyecto@OData.Community.Display.V1.FormattedValue": "No",
    osp_proyecto: false,
    osp_descripcion: "Plantilla CENTREX",
    osp_link:
      "https://ggccorange.sharepoint.com/Dynamics/opportunity/OPP-0078401 - proyecto covergente/CAS-146120-Y2J4Y3 - CAS-124742-G6W5D2 - CENTREX Loma Linda (Huelva y Mad-Alcala)/THE RED KIWI SOCIEDAD LIMITADA LOMA LINDA, S.L Plantilla_Provision_Digital_Centrex.xlsx",
    "osp_categoria@OData.Community.Display.V1.FormattedValue": "Centrex",
    osp_categoria: 8,
    _modifiedby: "CRM, Admin",
    "_modifiedby_value@Microsoft.Dynamics.CRM.lookuplogicalname": "systemuser",
    _modifiedby_value: "ac79a518-0950-e611-80c1-005056a03d45",
  },
  {
    "@odata.etag": 'W/"3554763814"',
    "modifiedon@OData.Community.Display.V1.FormattedValue": "23/12/2025 14:01",
    modifiedon: "2025-12-23T13:01:58Z",
    osp_subcategoria: null,
    osp_documentacionid: "3ef60144-b81e-f011-998a-000d3a469e46",
    "osp_validadocontratacion@OData.Community.Display.V1.FormattedValue": "No",
    osp_validadocontratacion: false,
    "createdon@OData.Community.Display.V1.FormattedValue": "21/04/2025 15:55",
    createdon: "2025-04-21T13:55:28Z",
    osp_nombre:
      "THE RED KIWI B44691749 3 moviles  Plantilla_Provision_Digital_Centrex.xlsx",
    _ownerid: "LAGO RUIZ, JOSE",
    "_ownerid_value@Microsoft.Dynamics.CRM.associatednavigationproperty":
      "ownerid",
    "_ownerid_value@Microsoft.Dynamics.CRM.lookuplogicalname": "systemuser",
    _ownerid_value: "039f6c0f-aaba-ee11-a569-6045bd905b10",
    "osp_validadoordering@OData.Community.Display.V1.FormattedValue": "No",
    osp_validadoordering: false,
    osp_registro:
      "CAS-150647-K4T4W1 - Plantilla migracion a CENTREX sede Benidorm",
    "_osp_oportunidad_value@OData.Community.Display.V1.FormattedValue":
      "OPP-0078401 - proyecto covergente",
    "_osp_oportunidad_value@Microsoft.Dynamics.CRM.associatednavigationproperty":
      "osp_oportunidad",
    "_osp_oportunidad_value@Microsoft.Dynamics.CRM.lookuplogicalname":
      "opportunity",
    _osp_oportunidad_value: "53fac40b-c952-4c3c-a12a-778df2689633",
    "osp_tipificacion@OData.Community.Display.V1.FormattedValue":
      "Documentacion de proyecto y provisi\u00f3n",
    osp_tipificacion: 863920012,
    "osp_proyecto@OData.Community.Display.V1.FormattedValue": "No",
    osp_proyecto: false,
    osp_descripcion: "plantilla",
    osp_link:
      "https://ggccorange.sharepoint.com/Dynamics/opportunity/OPP-0078401 - proyecto covergente/CAS-150647-K4T4W1 - Plantilla migracion a CENTREX sede Benidorm/THE RED KIWI B44691749 3 moviles  Plantilla_Provision_Digital_Centrex.xlsx",
    "osp_categoria@OData.Community.Display.V1.FormattedValue": "Centrex",
    osp_categoria: 8,
    _modifiedby: "CRM, Admin",
    "_modifiedby_value@Microsoft.Dynamics.CRM.lookuplogicalname": "systemuser",
    _modifiedby_value: "ac79a518-0950-e611-80c1-005056a03d45",
  },
  {
    "@odata.etag": 'W/"3554763829"',
    "modifiedon@OData.Community.Display.V1.FormattedValue": "23/12/2025 14:01",
    modifiedon: "2025-12-23T13:01:59Z",
    osp_subcategoria: null,
    osp_documentacionid: "6f6e3e5c-bd1e-f011-998a-000d3a469e46",
    "osp_validadocontratacion@OData.Community.Display.V1.FormattedValue": "No",
    osp_validadocontratacion: false,
    "createdon@OData.Community.Display.V1.FormattedValue": "21/04/2025 16:31",
    createdon: "2025-04-21T14:31:58Z",
    osp_nombre:
      "THE RED KIWI La gran sensaci\u00f3n Apollo XIII Medical  Plantilla_Provision_Digital_Centrex.xlsx",
    _ownerid: "LAGO RUIZ, JOSE",
    "_ownerid_value@Microsoft.Dynamics.CRM.associatednavigationproperty":
      "ownerid",
    "_ownerid_value@Microsoft.Dynamics.CRM.lookuplogicalname": "systemuser",
    _ownerid_value: "039f6c0f-aaba-ee11-a569-6045bd905b10",
    "osp_validadoordering@OData.Community.Display.V1.FormattedValue": "No",
    osp_validadoordering: false,
    osp_registro: "CAS-151096-V5Z3Z5 - Plantilla CENTREX Torrejon movil",
    "_osp_oportunidad_value@OData.Community.Display.V1.FormattedValue":
      "OPP-0078401 - proyecto covergente",
    "_osp_oportunidad_value@Microsoft.Dynamics.CRM.associatednavigationproperty":
      "osp_oportunidad",
    "_osp_oportunidad_value@Microsoft.Dynamics.CRM.lookuplogicalname":
      "opportunity",
    _osp_oportunidad_value: "53fac40b-c952-4c3c-a12a-778df2689633",
    "osp_tipificacion@OData.Community.Display.V1.FormattedValue":
      "Documentacion de proyecto y provisi\u00f3n",
    osp_tipificacion: 863920012,
    "osp_proyecto@OData.Community.Display.V1.FormattedValue": "No",
    osp_proyecto: false,
    osp_descripcion: "plantilla",
    osp_link:
      "https://ggccorange.sharepoint.com/Dynamics/opportunity/OPP-0078401 - proyecto covergente/CAS-151096-V5Z3Z5 - Plantilla CENTREX Torrejon movil/THE RED KIWI La gran sensaci\u00f3n Apollo XIII Medical  Plantilla_Provision_Digital_Centrex.xlsx",
    "osp_categoria@OData.Community.Display.V1.FormattedValue": "Centrex",
    osp_categoria: 8,
    _modifiedby: "CRM, Admin",
    "_modifiedby_value@Microsoft.Dynamics.CRM.lookuplogicalname": "systemuser",
    _modifiedby_value: "ac79a518-0950-e611-80c1-005056a03d45",
  },
  {
    "@odata.etag": 'W/"3554763832"',
    "modifiedon@OData.Community.Display.V1.FormattedValue": "23/12/2025 14:01",
    modifiedon: "2025-12-23T13:01:59Z",
    osp_subcategoria: null,
    osp_documentacionid: "b1225568-bd1e-f011-998a-000d3a469e46",
    "osp_validadocontratacion@OData.Community.Display.V1.FormattedValue": "Yes",
    osp_validadocontratacion: true,
    "createdon@OData.Community.Display.V1.FormattedValue": "21/04/2025 16:32",
    createdon: "2025-04-21T14:32:12Z",
    osp_nombre:
      "THE RED KIWI La gran sensaci\u00f3n Apollo XIII Medical  INVENTARIO ORANGE.xlsx",
    _ownerid: "LAGO RUIZ, JOSE",
    "_ownerid_value@Microsoft.Dynamics.CRM.associatednavigationproperty":
      "ownerid",
    "_ownerid_value@Microsoft.Dynamics.CRM.lookuplogicalname": "systemuser",
    _ownerid_value: "039f6c0f-aaba-ee11-a569-6045bd905b10",
    "osp_validadoordering@OData.Community.Display.V1.FormattedValue": "No",
    osp_validadoordering: false,
    osp_registro: "CAS-151096-V5Z3Z5 - Plantilla CENTREX Torrejon movil",
    "_osp_oportunidad_value@OData.Community.Display.V1.FormattedValue":
      "OPP-0078401 - proyecto covergente",
    "_osp_oportunidad_value@Microsoft.Dynamics.CRM.associatednavigationproperty":
      "osp_oportunidad",
    "_osp_oportunidad_value@Microsoft.Dynamics.CRM.lookuplogicalname":
      "opportunity",
    _osp_oportunidad_value: "53fac40b-c952-4c3c-a12a-778df2689633",
    "osp_tipificacion@OData.Community.Display.V1.FormattedValue":
      "Documentacion de proyecto y provisi\u00f3n",
    osp_tipificacion: 863920012,
    "osp_proyecto@OData.Community.Display.V1.FormattedValue": "No",
    osp_proyecto: false,
    osp_descripcion: "inventario",
    osp_link:
      "https://ggccorange.sharepoint.com/Dynamics/opportunity/OPP-0078401 - proyecto covergente/CAS-151096-V5Z3Z5 - Plantilla CENTREX Torrejon movil/THE RED KIWI La gran sensaci\u00f3n Apollo XIII Medical  INVENTARIO ORANGE.xlsx",
    "osp_categoria@OData.Community.Display.V1.FormattedValue": "Centrex",
    osp_categoria: 8,
    _modifiedby: "CRM, Admin",
    "_modifiedby_value@Microsoft.Dynamics.CRM.lookuplogicalname": "systemuser",
    _modifiedby_value: "ac79a518-0950-e611-80c1-005056a03d45",
  },
  {
    "@odata.etag": 'W/"3554764018"',
    "modifiedon@OData.Community.Display.V1.FormattedValue": "23/12/2025 14:02",
    modifiedon: "2025-12-23T13:02:05Z",
    osp_subcategoria: null,
    osp_documentacionid: "c284cc22-0f8f-f011-b4cb-000d3a46a104",
    "osp_validadocontratacion@OData.Community.Display.V1.FormattedValue": "No",
    osp_validadocontratacion: false,
    "createdon@OData.Community.Display.V1.FormattedValue": "11/09/2025 14:59",
    createdon: "2025-09-11T12:59:30Z",
    osp_nombre: "Pedido Portatiles 11092025.msg",
    _ownerid: "GONZALEZ DIEZ, MIRIAM",
    "_ownerid_value@Microsoft.Dynamics.CRM.associatednavigationproperty":
      "ownerid",
    "_ownerid_value@Microsoft.Dynamics.CRM.lookuplogicalname": "systemuser",
    _ownerid_value: "6f5078c2-a430-eb11-80fa-0050568345f9",
    "osp_validadoordering@OData.Community.Display.V1.FormattedValue": "No",
    osp_validadoordering: false,
    osp_registro: "CAS-163334-T6B2P7",
    "_osp_oportunidad_value@OData.Community.Display.V1.FormattedValue":
      "OPP-0078401 - proyecto covergente",
    "_osp_oportunidad_value@Microsoft.Dynamics.CRM.associatednavigationproperty":
      "osp_oportunidad",
    "_osp_oportunidad_value@Microsoft.Dynamics.CRM.lookuplogicalname":
      "opportunity",
    _osp_oportunidad_value: "53fac40b-c952-4c3c-a12a-778df2689633",
    "osp_tipificacion@OData.Community.Display.V1.FormattedValue":
      "Requisitos Clientes",
    osp_tipificacion: 863920000,
    "osp_proyecto@OData.Community.Display.V1.FormattedValue": "No",
    osp_proyecto: false,
    osp_descripcion: "Pedido ",
    osp_link:
      "https://ggccorange.sharepoint.com/Dynamics/opportunity/OPP-0078401 - proyecto covergente/CAS-163334-T6B2P7/Pedido Portatiles 11092025.msg",
    "osp_categoria@OData.Community.Display.V1.FormattedValue": "Otros",
    osp_categoria: 24,
    _modifiedby: "CRM, Admin",
    "_modifiedby_value@Microsoft.Dynamics.CRM.lookuplogicalname": "systemuser",
    _modifiedby_value: "ac79a518-0950-e611-80c1-005056a03d45",
  },
  {
    "@odata.etag": 'W/"3554764025"',
    "modifiedon@OData.Community.Display.V1.FormattedValue": "23/12/2025 14:02",
    modifiedon: "2025-12-23T13:02:05Z",
    osp_subcategoria: null,
    osp_documentacionid: "49891d01-238f-f011-b4cb-000d3a46a104",
    "osp_validadocontratacion@OData.Community.Display.V1.FormattedValue": "No",
    osp_validadocontratacion: false,
    "createdon@OData.Community.Display.V1.FormattedValue": "11/09/2025 17:21",
    createdon: "2025-09-11T15:21:36Z",
    osp_nombre:
      "THE RED KIWI VALLIRANA Plantilla_Provision_Digital_Centrex.xlsx",
    _ownerid: "GONZALEZ DIEZ, MIRIAM",
    "_ownerid_value@Microsoft.Dynamics.CRM.associatednavigationproperty":
      "ownerid",
    "_ownerid_value@Microsoft.Dynamics.CRM.lookuplogicalname": "systemuser",
    _ownerid_value: "6f5078c2-a430-eb11-80fa-0050568345f9",
    "osp_validadoordering@OData.Community.Display.V1.FormattedValue": "No",
    osp_validadoordering: false,
    osp_registro: "CAS-163358-H2C5B0",
    "_osp_oportunidad_value@OData.Community.Display.V1.FormattedValue":
      "OPP-0078401 - proyecto covergente",
    "_osp_oportunidad_value@Microsoft.Dynamics.CRM.associatednavigationproperty":
      "osp_oportunidad",
    "_osp_oportunidad_value@Microsoft.Dynamics.CRM.lookuplogicalname":
      "opportunity",
    _osp_oportunidad_value: "53fac40b-c952-4c3c-a12a-778df2689633",
    "osp_tipificacion@OData.Community.Display.V1.FormattedValue":
      "Documentacion de proyecto y provisi\u00f3n",
    osp_tipificacion: 863920012,
    "osp_proyecto@OData.Community.Display.V1.FormattedValue": "No",
    osp_proyecto: false,
    osp_descripcion: "Plantilla VALLIRANA",
    osp_link:
      "https://ggccorange.sharepoint.com/Dynamics/opportunity/OPP-0078401 - proyecto covergente/CAS-163358-H2C5B0/THE RED KIWI VALLIRANA Plantilla_Provision_Digital_Centrex.xlsx",
    "osp_categoria@OData.Community.Display.V1.FormattedValue": "Centrex",
    osp_categoria: 8,
    _modifiedby: "CRM, Admin",
    "_modifiedby_value@Microsoft.Dynamics.CRM.lookuplogicalname": "systemuser",
    _modifiedby_value: "ac79a518-0950-e611-80c1-005056a03d45",
  },
  {
    "@odata.etag": 'W/"3554764033"',
    "modifiedon@OData.Community.Display.V1.FormattedValue": "23/12/2025 14:02",
    modifiedon: "2025-12-23T13:02:05Z",
    osp_subcategoria: null,
    osp_documentacionid: "9f1bc40d-238f-f011-b4cb-000d3a46a104",
    "osp_validadocontratacion@OData.Community.Display.V1.FormattedValue": "Yes",
    osp_validadocontratacion: true,
    "createdon@OData.Community.Display.V1.FormattedValue": "11/09/2025 17:22",
    createdon: "2025-09-11T15:22:01Z",
    osp_nombre: "THE RED KIWI VALLIRANA INVENTARIO ORANGE.xlsx",
    _ownerid: "GONZALEZ DIEZ, MIRIAM",
    "_ownerid_value@Microsoft.Dynamics.CRM.associatednavigationproperty":
      "ownerid",
    "_ownerid_value@Microsoft.Dynamics.CRM.lookuplogicalname": "systemuser",
    _ownerid_value: "6f5078c2-a430-eb11-80fa-0050568345f9",
    "osp_validadoordering@OData.Community.Display.V1.FormattedValue": "No",
    osp_validadoordering: false,
    osp_registro: "CAS-163358-H2C5B0",
    "_osp_oportunidad_value@OData.Community.Display.V1.FormattedValue":
      "OPP-0078401 - proyecto covergente",
    "_osp_oportunidad_value@Microsoft.Dynamics.CRM.associatednavigationproperty":
      "osp_oportunidad",
    "_osp_oportunidad_value@Microsoft.Dynamics.CRM.lookuplogicalname":
      "opportunity",
    _osp_oportunidad_value: "53fac40b-c952-4c3c-a12a-778df2689633",
    "osp_tipificacion@OData.Community.Display.V1.FormattedValue":
      "Documentacion de proyecto y provisi\u00f3n",
    osp_tipificacion: 863920012,
    "osp_proyecto@OData.Community.Display.V1.FormattedValue": "No",
    osp_proyecto: false,
    osp_descripcion: "Inventario VALLIRANA",
    osp_link:
      "https://ggccorange.sharepoint.com/Dynamics/opportunity/OPP-0078401 - proyecto covergente/CAS-163358-H2C5B0/THE RED KIWI VALLIRANA INVENTARIO ORANGE.xlsx",
    "osp_categoria@OData.Community.Display.V1.FormattedValue": "Centrex",
    osp_categoria: 8,
    _modifiedby: "CRM, Admin",
    "_modifiedby_value@Microsoft.Dynamics.CRM.lookuplogicalname": "systemuser",
    _modifiedby_value: "ac79a518-0950-e611-80c1-005056a03d45",
  },
  {
    "@odata.etag": 'W/"3554764043"',
    "modifiedon@OData.Community.Display.V1.FormattedValue": "23/12/2025 14:02",
    modifiedon: "2025-12-23T13:02:06Z",
    osp_subcategoria: null,
    osp_documentacionid: "7af1bc29-248f-f011-b4cb-000d3a46a104",
    "osp_validadocontratacion@OData.Community.Display.V1.FormattedValue": "No",
    osp_validadocontratacion: false,
    "createdon@OData.Community.Display.V1.FormattedValue": "11/09/2025 17:30",
    createdon: "2025-09-11T15:30:03Z",
    osp_nombre:
      "THE RED KIWI MARIA DE MOLINA Plantilla_Provision_Digital_Centrex.xlsx",
    _ownerid: "GONZALEZ DIEZ, MIRIAM",
    "_ownerid_value@Microsoft.Dynamics.CRM.associatednavigationproperty":
      "ownerid",
    "_ownerid_value@Microsoft.Dynamics.CRM.lookuplogicalname": "systemuser",
    _ownerid_value: "6f5078c2-a430-eb11-80fa-0050568345f9",
    "osp_validadoordering@OData.Community.Display.V1.FormattedValue": "No",
    osp_validadoordering: false,
    osp_registro: "CAS-163358-H2C5B0",
    "_osp_oportunidad_value@OData.Community.Display.V1.FormattedValue":
      "OPP-0078401 - proyecto covergente",
    "_osp_oportunidad_value@Microsoft.Dynamics.CRM.associatednavigationproperty":
      "osp_oportunidad",
    "_osp_oportunidad_value@Microsoft.Dynamics.CRM.lookuplogicalname":
      "opportunity",
    _osp_oportunidad_value: "53fac40b-c952-4c3c-a12a-778df2689633",
    "osp_tipificacion@OData.Community.Display.V1.FormattedValue":
      "Documentacion de proyecto y provisi\u00f3n",
    osp_tipificacion: 863920012,
    "osp_proyecto@OData.Community.Display.V1.FormattedValue": "No",
    osp_proyecto: false,
    osp_descripcion: "Plantilla Maria de Molina",
    osp_link:
      "https://ggccorange.sharepoint.com/Dynamics/opportunity/OPP-0078401 - proyecto covergente/CAS-163358-H2C5B0/THE RED KIWI MARIA DE MOLINA Plantilla_Provision_Digital_Centrex.xlsx",
    "osp_categoria@OData.Community.Display.V1.FormattedValue": "Centrex",
    osp_categoria: 8,
    _modifiedby: "CRM, Admin",
    "_modifiedby_value@Microsoft.Dynamics.CRM.lookuplogicalname": "systemuser",
    _modifiedby_value: "ac79a518-0950-e611-80c1-005056a03d45",
  },
  {
    "@odata.etag": 'W/"3554764048"',
    "modifiedon@OData.Community.Display.V1.FormattedValue": "23/12/2025 14:02",
    modifiedon: "2025-12-23T13:02:06Z",
    osp_subcategoria: null,
    osp_documentacionid: "e59d733c-248f-f011-b4cb-000d3a46a104",
    "osp_validadocontratacion@OData.Community.Display.V1.FormattedValue": "No",
    osp_validadocontratacion: false,
    "createdon@OData.Community.Display.V1.FormattedValue": "11/09/2025 17:30",
    createdon: "2025-09-11T15:30:31Z",
    osp_nombre: "THE RED KIWI MARIA DE MOLINA INVENTARIO ORANGE.xlsx",
    _ownerid: "GONZALEZ DIEZ, MIRIAM",
    "_ownerid_value@Microsoft.Dynamics.CRM.associatednavigationproperty":
      "ownerid",
    "_ownerid_value@Microsoft.Dynamics.CRM.lookuplogicalname": "systemuser",
    _ownerid_value: "6f5078c2-a430-eb11-80fa-0050568345f9",
    "osp_validadoordering@OData.Community.Display.V1.FormattedValue": "No",
    osp_validadoordering: false,
    osp_registro: "CAS-163358-H2C5B0",
    "_osp_oportunidad_value@OData.Community.Display.V1.FormattedValue":
      "OPP-0078401 - proyecto covergente",
    "_osp_oportunidad_value@Microsoft.Dynamics.CRM.associatednavigationproperty":
      "osp_oportunidad",
    "_osp_oportunidad_value@Microsoft.Dynamics.CRM.lookuplogicalname":
      "opportunity",
    _osp_oportunidad_value: "53fac40b-c952-4c3c-a12a-778df2689633",
    "osp_tipificacion@OData.Community.Display.V1.FormattedValue":
      "Documentacion de proyecto y provisi\u00f3n",
    osp_tipificacion: 863920012,
    "osp_proyecto@OData.Community.Display.V1.FormattedValue": "No",
    osp_proyecto: false,
    osp_descripcion: "Inventario Maria d eMolina",
    osp_link:
      "https://ggccorange.sharepoint.com/Dynamics/opportunity/OPP-0078401 - proyecto covergente/CAS-163358-H2C5B0/THE RED KIWI MARIA DE MOLINA INVENTARIO ORANGE.xlsx",
    "osp_categoria@OData.Community.Display.V1.FormattedValue": "Centrex",
    osp_categoria: 8,
    _modifiedby: "CRM, Admin",
    "_modifiedby_value@Microsoft.Dynamics.CRM.lookuplogicalname": "systemuser",
    _modifiedby_value: "ac79a518-0950-e611-80c1-005056a03d45",
  },
  {
    "@odata.etag": 'W/"3554768317"',
    "modifiedon@OData.Community.Display.V1.FormattedValue": "23/12/2025 14:03",
    modifiedon: "2025-12-23T13:03:46Z",
    "osp_subcategoria@OData.Community.Display.V1.FormattedValue":
      "Accesos Fijos",
    osp_subcategoria: 0,
    osp_documentacionid: "7f893119-f59a-f011-b4cc-000d3a48a52b",
    "osp_validadocontratacion@OData.Community.Display.V1.FormattedValue": "No",
    osp_validadocontratacion: false,
    "createdon@OData.Community.Display.V1.FormattedValue": "26/09/2025 18:23",
    createdon: "2025-09-26T16:23:14Z",
    osp_nombre:
      "Respuesta EV FTTH_CAS-164309-N9B3G9_THE RED KIWI SOCIEDAD LIMITADA .xlsx",
    _ownerid: "MOLINA PE\u00d1AFIEL, ARIEL",
    "_ownerid_value@Microsoft.Dynamics.CRM.associatednavigationproperty":
      "ownerid",
    "_ownerid_value@Microsoft.Dynamics.CRM.lookuplogicalname": "systemuser",
    _ownerid_value: "d56d4001-0bba-ee11-a569-6045bd9059cc",
    "osp_validadoordering@OData.Community.Display.V1.FormattedValue": "No",
    osp_validadoordering: false,
    osp_registro: "CAS-164309-N9B3G9",
    "_osp_oportunidad_value@OData.Community.Display.V1.FormattedValue":
      "OPP-0078401 - proyecto covergente",
    "_osp_oportunidad_value@Microsoft.Dynamics.CRM.associatednavigationproperty":
      "osp_oportunidad",
    "_osp_oportunidad_value@Microsoft.Dynamics.CRM.lookuplogicalname":
      "opportunity",
    _osp_oportunidad_value: "53fac40b-c952-4c3c-a12a-778df2689633",
    "osp_tipificacion@OData.Community.Display.V1.FormattedValue": "EVs",
    osp_tipificacion: 863920006,
    "osp_proyecto@OData.Community.Display.V1.FormattedValue": "No",
    osp_proyecto: false,
    osp_descripcion: null,
    osp_link:
      "https://ggccorange.sharepoint.com/Dynamics/opportunity/OPP-0078401 - proyecto covergente/CAS-164309-N9B3G9/Respuesta EV FTTH_CAS-164309-N9B3G9_THE RED KIWI SOCIEDAD LIMITADA .xlsx",
    "osp_categoria@OData.Community.Display.V1.FormattedValue": "Iniciales",
    osp_categoria: 17,
    _modifiedby: "CRM, Admin",
    "_modifiedby_value@Microsoft.Dynamics.CRM.lookuplogicalname": "systemuser",
    _modifiedby_value: "ac79a518-0950-e611-80c1-005056a03d45",
  },
  {
    "@odata.etag": 'W/"3554769551"',
    "modifiedon@OData.Community.Display.V1.FormattedValue": "23/12/2025 14:04",
    modifiedon: "2025-12-23T13:04:25Z",
    osp_subcategoria: null,
    osp_documentacionid: "3d55ea11-ab67-f011-bec2-000d3a48a52b",
    "osp_validadocontratacion@OData.Community.Display.V1.FormattedValue": "No",
    osp_validadocontratacion: false,
    "createdon@OData.Community.Display.V1.FormattedValue": "23/07/2025 11:54",
    createdon: "2025-07-23T09:54:53Z",
    osp_nombre: "RE_ Switch Oficina BCN.msg",
    _ownerid: "GONZALEZ DIEZ, MIRIAM",
    "_ownerid_value@Microsoft.Dynamics.CRM.associatednavigationproperty":
      "ownerid",
    "_ownerid_value@Microsoft.Dynamics.CRM.lookuplogicalname": "systemuser",
    _ownerid_value: "6f5078c2-a430-eb11-80fa-0050568345f9",
    "osp_validadoordering@OData.Community.Display.V1.FormattedValue": "No",
    osp_validadoordering: false,
    osp_registro: "CAS-160326-V4K3D9",
    "_osp_oportunidad_value@OData.Community.Display.V1.FormattedValue":
      "OPP-0078401 - proyecto covergente",
    "_osp_oportunidad_value@Microsoft.Dynamics.CRM.associatednavigationproperty":
      "osp_oportunidad",
    "_osp_oportunidad_value@Microsoft.Dynamics.CRM.lookuplogicalname":
      "opportunity",
    _osp_oportunidad_value: "53fac40b-c952-4c3c-a12a-778df2689633",
    "osp_tipificacion@OData.Community.Display.V1.FormattedValue":
      "Requisitos Clientes",
    osp_tipificacion: 863920000,
    "osp_proyecto@OData.Community.Display.V1.FormattedValue": "No",
    osp_proyecto: false,
    osp_descripcion: "Autorizacion KAM cliente",
    osp_link:
      "https://ggccorange.sharepoint.com/Dynamics/opportunity/OPP-0078401 - proyecto covergente/CAS-160326-V4K3D9/RE_ Switch Oficina BCN.msg",
    "osp_categoria@OData.Community.Display.V1.FormattedValue": "Otros",
    osp_categoria: 24,
    _modifiedby: "CRM, Admin",
    "_modifiedby_value@Microsoft.Dynamics.CRM.lookuplogicalname": "systemuser",
    _modifiedby_value: "ac79a518-0950-e611-80c1-005056a03d45",
  },
  {
    "@odata.etag": 'W/"3554769558"',
    "modifiedon@OData.Community.Display.V1.FormattedValue": "23/12/2025 14:04",
    modifiedon: "2025-12-23T13:04:26Z",
    osp_subcategoria: null,
    osp_documentacionid: "45e1092a-ab67-f011-bec2-000d3a48a52b",
    "osp_validadocontratacion@OData.Community.Display.V1.FormattedValue": "No",
    osp_validadocontratacion: false,
    "createdon@OData.Community.Display.V1.FormattedValue": "23/07/2025 11:55",
    createdon: "2025-07-23T09:55:38Z",
    osp_nombre:
      "1PG_Westcon_Comstor_ORANGE ESPAGNE SAU_CLINICAS DORSIA_Quote-23531105_Rev-7_en_1.xls",
    _ownerid: "GONZALEZ DIEZ, MIRIAM",
    "_ownerid_value@Microsoft.Dynamics.CRM.associatednavigationproperty":
      "ownerid",
    "_ownerid_value@Microsoft.Dynamics.CRM.lookuplogicalname": "systemuser",
    _ownerid_value: "6f5078c2-a430-eb11-80fa-0050568345f9",
    "osp_validadoordering@OData.Community.Display.V1.FormattedValue": "No",
    osp_validadoordering: false,
    osp_registro: "CAS-160326-V4K3D9",
    "_osp_oportunidad_value@OData.Community.Display.V1.FormattedValue":
      "OPP-0078401 - proyecto covergente",
    "_osp_oportunidad_value@Microsoft.Dynamics.CRM.associatednavigationproperty":
      "osp_oportunidad",
    "_osp_oportunidad_value@Microsoft.Dynamics.CRM.lookuplogicalname":
      "opportunity",
    _osp_oportunidad_value: "53fac40b-c952-4c3c-a12a-778df2689633",
    "osp_tipificacion@OData.Community.Display.V1.FormattedValue":
      "Ofertas de terceros",
    osp_tipificacion: 863920007,
    "osp_proyecto@OData.Community.Display.V1.FormattedValue": "No",
    osp_proyecto: false,
    osp_descripcion: "Oferta proveedor",
    osp_link:
      "https://ggccorange.sharepoint.com/Dynamics/opportunity/OPP-0078401 - proyecto covergente/CAS-160326-V4K3D9/1PG_Westcon_Comstor_ORANGE ESPAGNE SAU_CLINICAS DORSIA_Quote-23531105_Rev-7_en_1.xls",
    "osp_categoria@OData.Community.Display.V1.FormattedValue":
      "Oferta de proveedores",
    osp_categoria: 20,
    _modifiedby: "CRM, Admin",
    "_modifiedby_value@Microsoft.Dynamics.CRM.lookuplogicalname": "systemuser",
    _modifiedby_value: "ac79a518-0950-e611-80c1-005056a03d45",
  },
  {
    "@odata.etag": 'W/"3554775008"',
    "modifiedon@OData.Community.Display.V1.FormattedValue": "23/12/2025 14:06",
    modifiedon: "2025-12-23T13:06:09Z",
    osp_subcategoria: null,
    osp_documentacionid: "26b0eec6-4b2b-f011-8c4e-000d3a490dd2",
    "osp_validadocontratacion@OData.Community.Display.V1.FormattedValue": "No",
    osp_validadocontratacion: false,
    "createdon@OData.Community.Display.V1.FormattedValue": "07/05/2025 16:01",
    createdon: "2025-05-07T14:01:34Z",
    osp_nombre: "20240322_094409_Pricing_Tool_Movil_v8_4_03_2_ARQ-2.xlsb",
    _ownerid: "CRM, Admin",
    "_ownerid_value@Microsoft.Dynamics.CRM.associatednavigationproperty":
      "ownerid",
    "_ownerid_value@Microsoft.Dynamics.CRM.lookuplogicalname": "systemuser",
    _ownerid_value: "ac79a518-0950-e611-80c1-005056a03d45",
    "osp_validadoordering@OData.Community.Display.V1.FormattedValue": "No",
    osp_validadoordering: false,
    osp_registro: "OPP-0078401 - WAOC-0052691 - Proyecto convergente",
    "_osp_oportunidad_value@OData.Community.Display.V1.FormattedValue":
      "OPP-0078401 - proyecto covergente",
    "_osp_oportunidad_value@Microsoft.Dynamics.CRM.associatednavigationproperty":
      "osp_oportunidad",
    "_osp_oportunidad_value@Microsoft.Dynamics.CRM.lookuplogicalname":
      "opportunity",
    _osp_oportunidad_value: "53fac40b-c952-4c3c-a12a-778df2689633",
    "osp_tipificacion@OData.Community.Display.V1.FormattedValue": "PdN",
    osp_tipificacion: 863920001,
    "osp_proyecto@OData.Community.Display.V1.FormattedValue": "No",
    osp_proyecto: false,
    osp_descripcion: null,
    osp_link:
      "https://ggccorange.sharepoint.com/Dynamics/opportunity/OPP-0078401 - proyecto covergente/OPP-0078401 - WAOC-0052691 - Proyecto convergente/20240322_094409_Pricing_Tool_Movil_v8_4_03_2_ARQ-2.xlsb",
    "osp_categoria@OData.Community.Display.V1.FormattedValue": "PT M\u00f3vil",
    osp_categoria: 34,
    _modifiedby: "CRM, Admin",
    "_modifiedby_value@Microsoft.Dynamics.CRM.lookuplogicalname": "systemuser",
    _modifiedby_value: "ac79a518-0950-e611-80c1-005056a03d45",
  },
  {
    "@odata.etag": 'W/"2847856003"',
    "modifiedon@OData.Community.Display.V1.FormattedValue": "22/04/2025 12:47",
    modifiedon: "2025-04-22T10:47:12Z",
    osp_subcategoria: null,
    osp_documentacionid: "2d068222-671f-f011-9989-000d3a4bcf5d",
    "osp_validadocontratacion@OData.Community.Display.V1.FormattedValue": "No",
    osp_validadocontratacion: false,
    "createdon@OData.Community.Display.V1.FormattedValue": "22/04/2025 12:47",
    createdon: "2025-04-22T10:47:12Z",
    osp_nombre:
      "THE RED KIWI La gran sensaci\u00f3n Apollo XIII Medical Plantilla_Provision_Digital_Centrex.xlsx",
    _ownerid: "GONZALEZ DIEZ, MIRIAM",
    "_ownerid_value@Microsoft.Dynamics.CRM.associatednavigationproperty":
      "ownerid",
    "_ownerid_value@Microsoft.Dynamics.CRM.lookuplogicalname": "systemuser",
    _ownerid_value: "6f5078c2-a430-eb11-80fa-0050568345f9",
    "osp_validadoordering@OData.Community.Display.V1.FormattedValue": "No",
    osp_validadoordering: false,
    osp_registro:
      "CAS-151423-D2G6Z1 - CAS-124742-G6W5D2 - CENTREX solo m\u00f3vil Torrejon y Tarragona",
    "_osp_oportunidad_value@OData.Community.Display.V1.FormattedValue":
      "OPP-0078401 - proyecto covergente",
    "_osp_oportunidad_value@Microsoft.Dynamics.CRM.associatednavigationproperty":
      "osp_oportunidad",
    "_osp_oportunidad_value@Microsoft.Dynamics.CRM.lookuplogicalname":
      "opportunity",
    _osp_oportunidad_value: "53fac40b-c952-4c3c-a12a-778df2689633",
    "osp_tipificacion@OData.Community.Display.V1.FormattedValue":
      "Documentacion de proyecto y provisi\u00f3n",
    osp_tipificacion: 863920012,
    "osp_proyecto@OData.Community.Display.V1.FormattedValue": "No",
    osp_proyecto: false,
    osp_descripcion: "Plantilla CENTREX",
    osp_link:
      "https://ggccorange.sharepoint.com/Dynamics/opportunity/OPP-0078401 - proyecto covergente/CAS-151423-D2G6Z1 - CAS-124742-G6W5D2 - CENTREX solo m\u00f3vil Torrejon y Tarragona/THE RED KIWI La gran sensaci\u00f3n Apollo XIII Medical Plantilla_Provision_Digital_Centrex.xlsx",
    "osp_categoria@OData.Community.Display.V1.FormattedValue": "Centrex",
    osp_categoria: 8,
    _modifiedby: "GONZALEZ DIEZ, MIRIAM",
    "_modifiedby_value@Microsoft.Dynamics.CRM.lookuplogicalname": "systemuser",
    _modifiedby_value: "6f5078c2-a430-eb11-80fa-0050568345f9",
  },
  {
    "@odata.etag": 'W/"2847858405"',
    "modifiedon@OData.Community.Display.V1.FormattedValue": "22/04/2025 12:47",
    modifiedon: "2025-04-22T10:47:42Z",
    osp_subcategoria: null,
    osp_documentacionid: "ba049634-671f-f011-9989-000d3a4bcf5d",
    "osp_validadocontratacion@OData.Community.Display.V1.FormattedValue": "No",
    osp_validadocontratacion: false,
    "createdon@OData.Community.Display.V1.FormattedValue": "22/04/2025 12:47",
    createdon: "2025-04-22T10:47:42Z",
    osp_nombre:
      "THE RED KIWI La gran sensaci\u00f3n Apollo XIII Medical INVENTARIO ORANGE.xlsx",
    _ownerid: "GONZALEZ DIEZ, MIRIAM",
    "_ownerid_value@Microsoft.Dynamics.CRM.associatednavigationproperty":
      "ownerid",
    "_ownerid_value@Microsoft.Dynamics.CRM.lookuplogicalname": "systemuser",
    _ownerid_value: "6f5078c2-a430-eb11-80fa-0050568345f9",
    "osp_validadoordering@OData.Community.Display.V1.FormattedValue": "No",
    osp_validadoordering: false,
    osp_registro:
      "CAS-151423-D2G6Z1 - CAS-124742-G6W5D2 - CENTREX solo m\u00f3vil Torrejon y Tarragona",
    "_osp_oportunidad_value@OData.Community.Display.V1.FormattedValue":
      "OPP-0078401 - proyecto covergente",
    "_osp_oportunidad_value@Microsoft.Dynamics.CRM.associatednavigationproperty":
      "osp_oportunidad",
    "_osp_oportunidad_value@Microsoft.Dynamics.CRM.lookuplogicalname":
      "opportunity",
    _osp_oportunidad_value: "53fac40b-c952-4c3c-a12a-778df2689633",
    "osp_tipificacion@OData.Community.Display.V1.FormattedValue":
      "Documentacion de proyecto y provisi\u00f3n",
    osp_tipificacion: 863920012,
    "osp_proyecto@OData.Community.Display.V1.FormattedValue": "No",
    osp_proyecto: false,
    osp_descripcion: "INVENTARIO movil",
    osp_link:
      "https://ggccorange.sharepoint.com/Dynamics/opportunity/OPP-0078401 - proyecto covergente/CAS-151423-D2G6Z1 - CAS-124742-G6W5D2 - CENTREX solo m\u00f3vil Torrejon y Tarragona/THE RED KIWI La gran sensaci\u00f3n Apollo XIII Medical INVENTARIO ORANGE.xlsx",
    "osp_categoria@OData.Community.Display.V1.FormattedValue": "Centrex",
    osp_categoria: 8,
    _modifiedby: "GONZALEZ DIEZ, MIRIAM",
    "_modifiedby_value@Microsoft.Dynamics.CRM.lookuplogicalname": "systemuser",
    _modifiedby_value: "6f5078c2-a430-eb11-80fa-0050568345f9",
  },
  {
    "@odata.etag": 'W/"3372551891"',
    "modifiedon@OData.Community.Display.V1.FormattedValue": "05/11/2025 12:03",
    modifiedon: "2025-11-05T11:03:26Z",
    osp_subcategoria: null,
    osp_documentacionid: "46dc020d-37ba-f011-bbd2-000d3aae4002",
    "osp_validadocontratacion@OData.Community.Display.V1.FormattedValue": "No",
    osp_validadocontratacion: false,
    "createdon@OData.Community.Display.V1.FormattedValue": "05/11/2025 12:03",
    createdon: "2025-11-05T11:03:26Z",
    osp_nombre:
      "Copy of 1PG_Group_Westcon_Comstor_ORANGE ESPAGNE SAU_CLINICAS DORSIA_Quote-24266741_Rev-1_Quote I.xls",
    _ownerid: "GONZALEZ DIEZ, MIRIAM",
    "_ownerid_value@Microsoft.Dynamics.CRM.associatednavigationproperty":
      "ownerid",
    "_ownerid_value@Microsoft.Dynamics.CRM.lookuplogicalname": "systemuser",
    _ownerid_value: "6f5078c2-a430-eb11-80fa-0050568345f9",
    "osp_validadoordering@OData.Community.Display.V1.FormattedValue": "No",
    osp_validadoordering: false,
    osp_registro: "CAS-168368-R7F9B7",
    "_osp_oportunidad_value@OData.Community.Display.V1.FormattedValue":
      "OPP-0078401 - proyecto covergente",
    "_osp_oportunidad_value@Microsoft.Dynamics.CRM.associatednavigationproperty":
      "osp_oportunidad",
    "_osp_oportunidad_value@Microsoft.Dynamics.CRM.lookuplogicalname":
      "opportunity",
    _osp_oportunidad_value: "53fac40b-c952-4c3c-a12a-778df2689633",
    "osp_tipificacion@OData.Community.Display.V1.FormattedValue":
      "Ofertas de terceros",
    osp_tipificacion: 863920007,
    "osp_proyecto@OData.Community.Display.V1.FormattedValue": "No",
    osp_proyecto: false,
    osp_descripcion: "Oferta proveedor 1",
    osp_link:
      "https://ggccorange.sharepoint.com/Dynamics/opportunity/OPP-0078401 - proyecto covergente/CAS-168368-R7F9B7/Copy of 1PG_Group_Westcon_Comstor_ORANGE ESPAGNE SAU_CLINICAS DORSIA_Quote-24266741_Rev-1_Quote I.xls",
    "osp_categoria@OData.Community.Display.V1.FormattedValue":
      "Oferta de proveedores",
    osp_categoria: 20,
    _modifiedby: "GONZALEZ DIEZ, MIRIAM",
    "_modifiedby_value@Microsoft.Dynamics.CRM.lookuplogicalname": "systemuser",
    _modifiedby_value: "6f5078c2-a430-eb11-80fa-0050568345f9",
  },
  {
    "@odata.etag": 'W/"3372553902"',
    "modifiedon@OData.Community.Display.V1.FormattedValue": "05/11/2025 12:04",
    modifiedon: "2025-11-05T11:04:35Z",
    osp_subcategoria: null,
    osp_documentacionid: "f76eee30-37ba-f011-bbd2-000d3aae4002",
    "osp_validadocontratacion@OData.Community.Display.V1.FormattedValue": "No",
    osp_validadocontratacion: false,
    "createdon@OData.Community.Display.V1.FormattedValue": "05/11/2025 12:04",
    createdon: "2025-11-05T11:04:35Z",
    osp_nombre:
      "Copy of 1PG_Group_Westcon_Comstor_ORANGE ESPAGNE SAU_CLINICAS DORSIA_Quote-24266741_Rev-1_Quote 2.xls",
    _ownerid: "GONZALEZ DIEZ, MIRIAM",
    "_ownerid_value@Microsoft.Dynamics.CRM.associatednavigationproperty":
      "ownerid",
    "_ownerid_value@Microsoft.Dynamics.CRM.lookuplogicalname": "systemuser",
    _ownerid_value: "6f5078c2-a430-eb11-80fa-0050568345f9",
    "osp_validadoordering@OData.Community.Display.V1.FormattedValue": "No",
    osp_validadoordering: false,
    osp_registro: "CAS-168368-R7F9B7",
    "_osp_oportunidad_value@OData.Community.Display.V1.FormattedValue":
      "OPP-0078401 - proyecto covergente",
    "_osp_oportunidad_value@Microsoft.Dynamics.CRM.associatednavigationproperty":
      "osp_oportunidad",
    "_osp_oportunidad_value@Microsoft.Dynamics.CRM.lookuplogicalname":
      "opportunity",
    _osp_oportunidad_value: "53fac40b-c952-4c3c-a12a-778df2689633",
    "osp_tipificacion@OData.Community.Display.V1.FormattedValue":
      "Ofertas de terceros",
    osp_tipificacion: 863920007,
    "osp_proyecto@OData.Community.Display.V1.FormattedValue": "No",
    osp_proyecto: false,
    osp_descripcion: "Oferta proveedor 2",
    osp_link:
      "https://ggccorange.sharepoint.com/Dynamics/opportunity/OPP-0078401 - proyecto covergente/CAS-168368-R7F9B7/Copy of 1PG_Group_Westcon_Comstor_ORANGE ESPAGNE SAU_CLINICAS DORSIA_Quote-24266741_Rev-1_Quote 2.xls",
    "osp_categoria@OData.Community.Display.V1.FormattedValue":
      "Oferta de proveedores",
    osp_categoria: 20,
    _modifiedby: "GONZALEZ DIEZ, MIRIAM",
    "_modifiedby_value@Microsoft.Dynamics.CRM.lookuplogicalname": "systemuser",
    _modifiedby_value: "6f5078c2-a430-eb11-80fa-0050568345f9",
  },
  {
    "@odata.etag": 'W/"3621904258"',
    "modifiedon@OData.Community.Display.V1.FormattedValue": "13/01/2026 14:32",
    modifiedon: "2026-01-13T13:32:13Z",
    "osp_subcategoria@OData.Community.Display.V1.FormattedValue":
      "Accesos Fijos",
    osp_subcategoria: 0,
    osp_documentacionid: "a7c78e40-84f0-f011-8406-00224882d880",
    "osp_validadocontratacion@OData.Community.Display.V1.FormattedValue": "No",
    osp_validadocontratacion: false,
    "createdon@OData.Community.Display.V1.FormattedValue": "13/01/2026 14:32",
    createdon: "2026-01-13T13:32:13Z",
    osp_nombre:
      "Respuesta EV FTTH_CAS-173364-Y2V0K1_THE RED KIWI SOCIEDAD LIMITADA.xlsx",
    _ownerid: "MOLINA PE\u00d1AFIEL, ARIEL",
    "_ownerid_value@Microsoft.Dynamics.CRM.associatednavigationproperty":
      "ownerid",
    "_ownerid_value@Microsoft.Dynamics.CRM.lookuplogicalname": "systemuser",
    _ownerid_value: "d56d4001-0bba-ee11-a569-6045bd9059cc",
    "osp_validadoordering@OData.Community.Display.V1.FormattedValue": "No",
    osp_validadoordering: false,
    osp_registro: "CAS-173364-Y2V0K1",
    "_osp_oportunidad_value@OData.Community.Display.V1.FormattedValue":
      "OPP-0078401 - proyecto covergente",
    "_osp_oportunidad_value@Microsoft.Dynamics.CRM.associatednavigationproperty":
      "osp_oportunidad",
    "_osp_oportunidad_value@Microsoft.Dynamics.CRM.lookuplogicalname":
      "opportunity",
    _osp_oportunidad_value: "53fac40b-c952-4c3c-a12a-778df2689633",
    "osp_tipificacion@OData.Community.Display.V1.FormattedValue": "EVs",
    osp_tipificacion: 863920006,
    "osp_proyecto@OData.Community.Display.V1.FormattedValue": "No",
    osp_proyecto: false,
    osp_descripcion: null,
    osp_link:
      "https://ggccorange.sharepoint.com/Dynamics/opportunity/OPP-0078401 - proyecto covergente/CAS-173364-Y2V0K1/Respuesta EV FTTH_CAS-173364-Y2V0K1_THE RED KIWI SOCIEDAD LIMITADA.xlsx",
    "osp_categoria@OData.Community.Display.V1.FormattedValue": "Iniciales",
    osp_categoria: 17,
    _modifiedby: "MOLINA PE\u00d1AFIEL, ARIEL",
    "_modifiedby_value@Microsoft.Dynamics.CRM.lookuplogicalname": "systemuser",
    _modifiedby_value: "d56d4001-0bba-ee11-a569-6045bd9059cc",
  },
  {
    "@odata.etag": 'W/"3621786978"',
    "modifiedon@OData.Community.Display.V1.FormattedValue": "13/01/2026 13:50",
    modifiedon: "2026-01-13T12:50:08Z",
    "osp_subcategoria@OData.Community.Display.V1.FormattedValue":
      "Accesos Fijos",
    osp_subcategoria: 0,
    osp_documentacionid: "48ab1b60-7ef0-f011-8406-00224882db94",
    "osp_validadocontratacion@OData.Community.Display.V1.FormattedValue": "No",
    osp_validadocontratacion: false,
    "createdon@OData.Community.Display.V1.FormattedValue": "13/01/2026 13:50",
    createdon: "2026-01-13T12:50:08Z",
    osp_nombre:
      "Respuesta EV FTTH_CAS-173191-C0H8V6_THE RED KIWI SOCIEDAD LIMITADA.xlsx",
    _ownerid: "MOLINA PE\u00d1AFIEL, ARIEL",
    "_ownerid_value@Microsoft.Dynamics.CRM.associatednavigationproperty":
      "ownerid",
    "_ownerid_value@Microsoft.Dynamics.CRM.lookuplogicalname": "systemuser",
    _ownerid_value: "d56d4001-0bba-ee11-a569-6045bd9059cc",
    "osp_validadoordering@OData.Community.Display.V1.FormattedValue": "No",
    osp_validadoordering: false,
    osp_registro: "CAS-173191-C0H8V6",
    "_osp_oportunidad_value@OData.Community.Display.V1.FormattedValue":
      "OPP-0078401 - proyecto covergente",
    "_osp_oportunidad_value@Microsoft.Dynamics.CRM.associatednavigationproperty":
      "osp_oportunidad",
    "_osp_oportunidad_value@Microsoft.Dynamics.CRM.lookuplogicalname":
      "opportunity",
    _osp_oportunidad_value: "53fac40b-c952-4c3c-a12a-778df2689633",
    "osp_tipificacion@OData.Community.Display.V1.FormattedValue": "EVs",
    osp_tipificacion: 863920006,
    "osp_proyecto@OData.Community.Display.V1.FormattedValue": "No",
    osp_proyecto: false,
    osp_descripcion: null,
    osp_link:
      "https://ggccorange.sharepoint.com/Dynamics/opportunity/OPP-0078401 - proyecto covergente/CAS-173191-C0H8V6/Respuesta EV FTTH_CAS-173191-C0H8V6_THE RED KIWI SOCIEDAD LIMITADA.xlsx",
    "osp_categoria@OData.Community.Display.V1.FormattedValue": "Iniciales",
    osp_categoria: 17,
    _modifiedby: "MOLINA PE\u00d1AFIEL, ARIEL",
    "_modifiedby_value@Microsoft.Dynamics.CRM.lookuplogicalname": "systemuser",
    _modifiedby_value: "d56d4001-0bba-ee11-a569-6045bd9059cc",
  },
  {
    "@odata.etag": 'W/"3172631119"',
    "modifiedon@OData.Community.Display.V1.FormattedValue": "05/09/2025 18:43",
    modifiedon: "2025-09-05T16:43:45Z",
    "osp_subcategoria@OData.Community.Display.V1.FormattedValue":
      "Accesos Fijos",
    osp_subcategoria: 0,
    osp_documentacionid: "94aa4e7c-778a-f011-b4cb-002248831650",
    "osp_validadocontratacion@OData.Community.Display.V1.FormattedValue": "No",
    osp_validadocontratacion: false,
    "createdon@OData.Community.Display.V1.FormattedValue": "05/09/2025 18:43",
    createdon: "2025-09-05T16:43:45Z",
    osp_nombre:
      "Respuesta EV FTTH_CAS-162662-X3D8H8_THE RED KIWI SOCIEDAD LIMITADA.xlsx",
    _ownerid: "MOLINA PE\u00d1AFIEL, ARIEL",
    "_ownerid_value@Microsoft.Dynamics.CRM.associatednavigationproperty":
      "ownerid",
    "_ownerid_value@Microsoft.Dynamics.CRM.lookuplogicalname": "systemuser",
    _ownerid_value: "d56d4001-0bba-ee11-a569-6045bd9059cc",
    "osp_validadoordering@OData.Community.Display.V1.FormattedValue": "No",
    osp_validadoordering: false,
    osp_registro: "CAS-162662-X3D8H8",
    "_osp_oportunidad_value@OData.Community.Display.V1.FormattedValue":
      "OPP-0078401 - proyecto covergente",
    "_osp_oportunidad_value@Microsoft.Dynamics.CRM.associatednavigationproperty":
      "osp_oportunidad",
    "_osp_oportunidad_value@Microsoft.Dynamics.CRM.lookuplogicalname":
      "opportunity",
    _osp_oportunidad_value: "53fac40b-c952-4c3c-a12a-778df2689633",
    "osp_tipificacion@OData.Community.Display.V1.FormattedValue": "EVs",
    osp_tipificacion: 863920006,
    "osp_proyecto@OData.Community.Display.V1.FormattedValue": "No",
    osp_proyecto: false,
    osp_descripcion: null,
    osp_link:
      "https://ggccorange.sharepoint.com/Dynamics/opportunity/OPP-0078401 - proyecto covergente/CAS-162662-X3D8H8/Respuesta EV FTTH_CAS-162662-X3D8H8_THE RED KIWI SOCIEDAD LIMITADA.xlsx",
    "osp_categoria@OData.Community.Display.V1.FormattedValue": "Iniciales",
    osp_categoria: 17,
    _modifiedby: "MOLINA PE\u00d1AFIEL, ARIEL",
    "_modifiedby_value@Microsoft.Dynamics.CRM.lookuplogicalname": "systemuser",
    _modifiedby_value: "d56d4001-0bba-ee11-a569-6045bd9059cc",
  },
  {
    "@odata.etag": 'W/"2644825009"',
    "modifiedon@OData.Community.Display.V1.FormattedValue": "05/02/2025 14:16",
    modifiedon: "2025-02-05T13:16:28Z",
    osp_subcategoria: null,
    osp_documentacionid: "ea565c67-c3e3-ef11-be20-0022488371d2",
    "osp_validadocontratacion@OData.Community.Display.V1.FormattedValue": "No",
    osp_validadocontratacion: false,
    "createdon@OData.Community.Display.V1.FormattedValue": "05/02/2025 14:16",
    createdon: "2025-02-05T13:16:28Z",
    osp_nombre:
      "1PG_Group_Westcon_Comstor_ORANGE ESPAGNE SAU_CLINICAS DORSIA_Quote#21528839_en50.xls",
    _ownerid: "CRM, Admin",
    "_ownerid_value@Microsoft.Dynamics.CRM.associatednavigationproperty":
      "ownerid",
    "_ownerid_value@Microsoft.Dynamics.CRM.lookuplogicalname": "systemuser",
    _ownerid_value: "ac79a518-0950-e611-80c1-005056a03d45",
    "osp_validadoordering@OData.Community.Display.V1.FormattedValue": "No",
    osp_validadoordering: false,
    osp_registro: "OPP-0078401 - WAOC-0052691 - Proyecto convergente",
    "_osp_oportunidad_value@OData.Community.Display.V1.FormattedValue":
      "OPP-0078401 - proyecto covergente",
    "_osp_oportunidad_value@Microsoft.Dynamics.CRM.associatednavigationproperty":
      "osp_oportunidad",
    "_osp_oportunidad_value@Microsoft.Dynamics.CRM.lookuplogicalname":
      "opportunity",
    _osp_oportunidad_value: "53fac40b-c952-4c3c-a12a-778df2689633",
    "osp_tipificacion@OData.Community.Display.V1.FormattedValue": "PdN",
    osp_tipificacion: 863920001,
    "osp_proyecto@OData.Community.Display.V1.FormattedValue": "No",
    osp_proyecto: false,
    osp_descripcion: null,
    osp_link:
      "https://ggccorange.sharepoint.com/Dynamics/elob_validation/OPP-0078401 - WAOC-0052691 - Proyecto convergente/1PG_Group_Westcon_Comstor_ORANGE%20ESPAGNE%20SAU_CLINICAS%20DORSIA_Quote%2321528839_en50.xls",
    osp_categoria: null,
    _modifiedby: "CRM, Admin",
    "_modifiedby_value@Microsoft.Dynamics.CRM.lookuplogicalname": "systemuser",
    _modifiedby_value: "ac79a518-0950-e611-80c1-005056a03d45",
  },
  {
    "@odata.etag": 'W/"3533966202"',
    "modifiedon@OData.Community.Display.V1.FormattedValue": "18/12/2025 10:42",
    modifiedon: "2025-12-18T09:42:50Z",
    osp_subcategoria: null,
    osp_documentacionid: "b419db67-c3e3-ef11-a731-6045bd895ed0",
    "osp_validadocontratacion@OData.Community.Display.V1.FormattedValue": "No",
    osp_validadocontratacion: false,
    "createdon@OData.Community.Display.V1.FormattedValue": "05/02/2025 14:16",
    createdon: "2025-02-05T13:16:28Z",
    osp_nombre: "20240425_104432_Pricing_Tool_Fijo_v177_5_25_1 1_ssv.xlsb",
    _ownerid: "CRM, Admin",
    "_ownerid_value@Microsoft.Dynamics.CRM.associatednavigationproperty":
      "ownerid",
    "_ownerid_value@Microsoft.Dynamics.CRM.lookuplogicalname": "systemuser",
    _ownerid_value: "ac79a518-0950-e611-80c1-005056a03d45",
    "osp_validadoordering@OData.Community.Display.V1.FormattedValue": "No",
    osp_validadoordering: false,
    osp_registro: "OPP-0078401 - WAOC-0052691 - Proyecto convergente",
    "_osp_oportunidad_value@OData.Community.Display.V1.FormattedValue":
      "OPP-0078401 - proyecto covergente",
    "_osp_oportunidad_value@Microsoft.Dynamics.CRM.associatednavigationproperty":
      "osp_oportunidad",
    "_osp_oportunidad_value@Microsoft.Dynamics.CRM.lookuplogicalname":
      "opportunity",
    _osp_oportunidad_value: "53fac40b-c952-4c3c-a12a-778df2689633",
    "osp_tipificacion@OData.Community.Display.V1.FormattedValue": "PdN",
    osp_tipificacion: 863920001,
    "osp_proyecto@OData.Community.Display.V1.FormattedValue": "No",
    osp_proyecto: false,
    osp_descripcion: null,
    osp_link:
      "https://ggccorange.sharepoint.com/Dynamics/opportunity/OPP-0078401 - proyecto covergente/OPP-0078401 - WAOC-0052691 - Proyecto convergente/20240425_104432_Pricing_Tool_Fijo_v177_5_25_1 1_ssv.xlsb",
    osp_categoria: null,
    _modifiedby: "CAMARERO IZQUIERDO, MIGUEL ANGEL",
    "_modifiedby_value@Microsoft.Dynamics.CRM.lookuplogicalname": "systemuser",
    _modifiedby_value: "9f4f93a3-e53d-ea11-80d9-0050568345f9",
  },
  {
    "@odata.etag": 'W/"2752047644"',
    "modifiedon@OData.Community.Display.V1.FormattedValue": "20/03/2025 16:16",
    modifiedon: "2025-03-20T15:16:00Z",
    osp_subcategoria: null,
    osp_documentacionid: "ea074aed-c0ea-ef11-be21-6045bd895ed0",
    "osp_validadocontratacion@OData.Community.Display.V1.FormattedValue": "No",
    osp_validadocontratacion: false,
    "createdon@OData.Community.Display.V1.FormattedValue": "14/02/2025 11:46",
    createdon: "2025-02-14T10:46:22Z",
    osp_nombre: "ELENAS financiera.xlsx",
    _ownerid: "GONZALEZ DIEZ, MIRIAM",
    "_ownerid_value@Microsoft.Dynamics.CRM.associatednavigationproperty":
      "ownerid",
    "_ownerid_value@Microsoft.Dynamics.CRM.lookuplogicalname": "systemuser",
    _ownerid_value: "6f5078c2-a430-eb11-80fa-0050568345f9",
    "osp_validadoordering@OData.Community.Display.V1.FormattedValue": "No",
    osp_validadoordering: false,
    osp_registro:
      "CAS-145005-J2Z5D8 - CAS-124742-G6W5D2 - Financiera 29 sedes Fase 1 Propias",
    "_osp_oportunidad_value@OData.Community.Display.V1.FormattedValue":
      "OPP-0078401 - proyecto covergente",
    "_osp_oportunidad_value@Microsoft.Dynamics.CRM.associatednavigationproperty":
      "osp_oportunidad",
    "_osp_oportunidad_value@Microsoft.Dynamics.CRM.lookuplogicalname":
      "opportunity",
    _osp_oportunidad_value: "53fac40b-c952-4c3c-a12a-778df2689633",
    "osp_tipificacion@OData.Community.Display.V1.FormattedValue":
      "Documentacion de proyecto y provisi\u00f3n",
    osp_tipificacion: 863920012,
    "osp_proyecto@OData.Community.Display.V1.FormattedValue": "No",
    osp_proyecto: false,
    osp_descripcion: "Excel sedes",
    osp_link:
      "https://ggccorange.sharepoint.com/Dynamics/opportunity/OPP-0078401 - proyecto covergente/CAS-145005-J2Z5D8 - CAS-124742-G6W5D2 - Financiera 29 sedes Fase 1 Propias/ELENAS financiera.xlsx",
    "osp_categoria@OData.Community.Display.V1.FormattedValue":
      "lantilla Datos administrativos",
    osp_categoria: 19,
    _modifiedby: "CRM, Admin",
    "_modifiedby_value@Microsoft.Dynamics.CRM.lookuplogicalname": "systemuser",
    _modifiedby_value: "ac79a518-0950-e611-80c1-005056a03d45",
  },
  {
    "@odata.etag": 'W/"2752047757"',
    "modifiedon@OData.Community.Display.V1.FormattedValue": "20/03/2025 16:16",
    modifiedon: "2025-03-20T15:16:02Z",
    osp_subcategoria: null,
    osp_documentacionid: "21a5d67e-ceea-ef11-be21-6045bd895ed0",
    "osp_validadocontratacion@OData.Community.Display.V1.FormattedValue": "No",
    osp_validadocontratacion: false,
    "createdon@OData.Community.Display.V1.FormattedValue": "14/02/2025 13:23",
    createdon: "2025-02-14T12:23:36Z",
    osp_nombre: "Factura a DLL de 4 instalaciones.msg",
    _ownerid: "GONZALEZ DIEZ, MIRIAM",
    "_ownerid_value@Microsoft.Dynamics.CRM.associatednavigationproperty":
      "ownerid",
    "_ownerid_value@Microsoft.Dynamics.CRM.lookuplogicalname": "systemuser",
    _ownerid_value: "6f5078c2-a430-eb11-80fa-0050568345f9",
    "osp_validadoordering@OData.Community.Display.V1.FormattedValue": "No",
    osp_validadoordering: false,
    osp_registro:
      "CAS-145023-D7T4J1 - CAS-124742-G6W5D2 - Financiera 4 sedes (Canarias)",
    "_osp_oportunidad_value@OData.Community.Display.V1.FormattedValue":
      "OPP-0078401 - proyecto covergente",
    "_osp_oportunidad_value@Microsoft.Dynamics.CRM.associatednavigationproperty":
      "osp_oportunidad",
    "_osp_oportunidad_value@Microsoft.Dynamics.CRM.lookuplogicalname":
      "opportunity",
    _osp_oportunidad_value: "53fac40b-c952-4c3c-a12a-778df2689633",
    "osp_tipificacion@OData.Community.Display.V1.FormattedValue":
      "Autorizaciones Internas",
    osp_tipificacion: 863920008,
    "osp_proyecto@OData.Community.Display.V1.FormattedValue": "No",
    osp_proyecto: false,
    osp_descripcion: "Email KAM",
    osp_link:
      "https://ggccorange.sharepoint.com/Dynamics/opportunity/OPP-0078401 - proyecto covergente/CAS-145023-D7T4J1 - CAS-124742-G6W5D2 - Financiera 4 sedes (Canarias)/Factura a DLL de 4 instalaciones.msg",
    "osp_categoria@OData.Community.Display.V1.FormattedValue":
      "Autorizaciones internas KAM",
    osp_categoria: 6,
    _modifiedby: "CRM, Admin",
    "_modifiedby_value@Microsoft.Dynamics.CRM.lookuplogicalname": "systemuser",
    _modifiedby_value: "ac79a518-0950-e611-80c1-005056a03d45",
  },
  {
    "@odata.etag": 'W/"2752048146"',
    "modifiedon@OData.Community.Display.V1.FormattedValue": "20/03/2025 16:16",
    modifiedon: "2025-03-20T15:16:16Z",
    osp_subcategoria: null,
    osp_documentacionid: "c35458f4-46ff-ef11-bae2-6045bd8b5d9e",
    "osp_validadocontratacion@OData.Community.Display.V1.FormattedValue": "No",
    osp_validadocontratacion: false,
    "createdon@OData.Community.Display.V1.FormattedValue": "12/03/2025 14:36",
    createdon: "2025-03-12T13:36:17Z",
    osp_nombre:
      "THE RED KIWI SOCIEDAD LIMITADA LOMA LINDA, S.L Rivas-Vaciamadrid Plantilla_Provision_Digital_Centrex.xlsx",
    _ownerid: "GONZALEZ DIEZ, MIRIAM",
    "_ownerid_value@Microsoft.Dynamics.CRM.associatednavigationproperty":
      "ownerid",
    "_ownerid_value@Microsoft.Dynamics.CRM.lookuplogicalname": "systemuser",
    _ownerid_value: "6f5078c2-a430-eb11-80fa-0050568345f9",
    "osp_validadoordering@OData.Community.Display.V1.FormattedValue": "No",
    osp_validadoordering: false,
    osp_registro:
      "CAS-147796-H9M3L7 - CAS-124742-G6W5D2 - CENTREX Rivas Vaciamadrid",
    "_osp_oportunidad_value@OData.Community.Display.V1.FormattedValue":
      "OPP-0078401 - proyecto covergente",
    "_osp_oportunidad_value@Microsoft.Dynamics.CRM.associatednavigationproperty":
      "osp_oportunidad",
    "_osp_oportunidad_value@Microsoft.Dynamics.CRM.lookuplogicalname":
      "opportunity",
    _osp_oportunidad_value: "53fac40b-c952-4c3c-a12a-778df2689633",
    "osp_tipificacion@OData.Community.Display.V1.FormattedValue":
      "Documentacion de proyecto y provisi\u00f3n",
    osp_tipificacion: 863920012,
    "osp_proyecto@OData.Community.Display.V1.FormattedValue": "No",
    osp_proyecto: false,
    osp_descripcion: "Plantilla CENTREX",
    osp_link:
      "https://ggccorange.sharepoint.com/Dynamics/opportunity/OPP-0078401 - proyecto covergente/CAS-147796-H9M3L7 - CAS-124742-G6W5D2 - CENTREX Rivas Vaciamadrid/THE RED KIWI SOCIEDAD LIMITADA LOMA LINDA, S.L Rivas-Vaciamadrid Plantilla_Provision_Digital_Centrex.xlsx",
    "osp_categoria@OData.Community.Display.V1.FormattedValue": "Centrex",
    osp_categoria: 8,
    _modifiedby: "CRM, Admin",
    "_modifiedby_value@Microsoft.Dynamics.CRM.lookuplogicalname": "systemuser",
    _modifiedby_value: "ac79a518-0950-e611-80c1-005056a03d45",
  },
  {
    "@odata.etag": 'W/"2752048205"',
    "modifiedon@OData.Community.Display.V1.FormattedValue": "20/03/2025 16:16",
    modifiedon: "2025-03-20T15:16:16Z",
    osp_subcategoria: null,
    osp_documentacionid: "d8eeca0c-47ff-ef11-bae2-6045bd8b5d9e",
    "osp_validadocontratacion@OData.Community.Display.V1.FormattedValue": "No",
    osp_validadocontratacion: false,
    "createdon@OData.Community.Display.V1.FormattedValue": "12/03/2025 14:36",
    createdon: "2025-03-12T13:36:51Z",
    osp_nombre:
      "THE RED KIWI loma linda Rivas-Vaciamadrid INVENTARIO ORANGE.xlsx",
    _ownerid: "GONZALEZ DIEZ, MIRIAM",
    "_ownerid_value@Microsoft.Dynamics.CRM.associatednavigationproperty":
      "ownerid",
    "_ownerid_value@Microsoft.Dynamics.CRM.lookuplogicalname": "systemuser",
    _ownerid_value: "6f5078c2-a430-eb11-80fa-0050568345f9",
    "osp_validadoordering@OData.Community.Display.V1.FormattedValue": "No",
    osp_validadoordering: false,
    osp_registro:
      "CAS-147796-H9M3L7 - CAS-124742-G6W5D2 - CENTREX Rivas Vaciamadrid",
    "_osp_oportunidad_value@OData.Community.Display.V1.FormattedValue":
      "OPP-0078401 - proyecto covergente",
    "_osp_oportunidad_value@Microsoft.Dynamics.CRM.associatednavigationproperty":
      "osp_oportunidad",
    "_osp_oportunidad_value@Microsoft.Dynamics.CRM.lookuplogicalname":
      "opportunity",
    _osp_oportunidad_value: "53fac40b-c952-4c3c-a12a-778df2689633",
    "osp_tipificacion@OData.Community.Display.V1.FormattedValue":
      "Documentacion de proyecto y provisi\u00f3n",
    osp_tipificacion: 863920012,
    "osp_proyecto@OData.Community.Display.V1.FormattedValue": "No",
    osp_proyecto: false,
    osp_descripcion: "Inventario movil",
    osp_link:
      "https://ggccorange.sharepoint.com/Dynamics/opportunity/OPP-0078401 - proyecto covergente/CAS-147796-H9M3L7 - CAS-124742-G6W5D2 - CENTREX Rivas Vaciamadrid/THE RED KIWI loma linda Rivas-Vaciamadrid INVENTARIO ORANGE.xlsx",
    "osp_categoria@OData.Community.Display.V1.FormattedValue": "Centrex",
    osp_categoria: 8,
    _modifiedby: "CRM, Admin",
    "_modifiedby_value@Microsoft.Dynamics.CRM.lookuplogicalname": "systemuser",
    _modifiedby_value: "ac79a518-0950-e611-80c1-005056a03d45",
  },
  {
    "@odata.etag": 'W/"2937289101"',
    "modifiedon@OData.Community.Display.V1.FormattedValue": "06/06/2025 9:53",
    modifiedon: "2025-06-06T07:53:00Z",
    osp_subcategoria: null,
    osp_documentacionid: "1ed5a641-ab42-f011-877a-6045bd95c298",
    "osp_validadocontratacion@OData.Community.Display.V1.FormattedValue": "No",
    osp_validadocontratacion: false,
    "createdon@OData.Community.Display.V1.FormattedValue": "06/06/2025 9:53",
    createdon: "2025-06-06T07:53:00Z",
    osp_nombre: "Oferta Orange-Dorsia 8\u00aa ENTREGA V1.xlsx",
    _ownerid: "ORTEGA MOCHON, ANA",
    "_ownerid_value@Microsoft.Dynamics.CRM.associatednavigationproperty":
      "ownerid",
    "_ownerid_value@Microsoft.Dynamics.CRM.lookuplogicalname": "systemuser",
    _ownerid_value: "370d2a1e-9ca5-e611-80c7-005056b95048",
    "osp_validadoordering@OData.Community.Display.V1.FormattedValue": "No",
    osp_validadoordering: false,
    osp_registro: "OPP-0078401 - WAOC-0052691 - Proyecto convergente",
    "_osp_oportunidad_value@OData.Community.Display.V1.FormattedValue":
      "OPP-0078401 - proyecto covergente",
    "_osp_oportunidad_value@Microsoft.Dynamics.CRM.associatednavigationproperty":
      "osp_oportunidad",
    "_osp_oportunidad_value@Microsoft.Dynamics.CRM.lookuplogicalname":
      "opportunity",
    _osp_oportunidad_value: "53fac40b-c952-4c3c-a12a-778df2689633",
    "osp_tipificacion@OData.Community.Display.V1.FormattedValue": "PdN",
    osp_tipificacion: 863920001,
    "osp_proyecto@OData.Community.Display.V1.FormattedValue": "No",
    osp_proyecto: false,
    osp_descripcion: "Oferta Espirinet Junio2025",
    osp_link:
      "https://ggccorange.sharepoint.com/Dynamics/opportunity/OPP-0078401 - proyecto covergente/OPP-0078401 - WAOC-0052691 - Proyecto convergente/Oferta Orange-Dorsia 8\u00aa ENTREGA V1.xlsx",
    osp_categoria: null,
    _modifiedby: "ORTEGA MOCHON, ANA",
    "_modifiedby_value@Microsoft.Dynamics.CRM.lookuplogicalname": "systemuser",
    _modifiedby_value: "370d2a1e-9ca5-e611-80c7-005056b95048",
  },
  {
    "@odata.etag": 'W/"2967502605"',
    "modifiedon@OData.Community.Display.V1.FormattedValue": "13/06/2025 12:34",
    modifiedon: "2025-06-13T10:34:24Z",
    osp_subcategoria: null,
    osp_documentacionid: "f13502f6-4148-f011-877a-6045bd95c298",
    "osp_validadocontratacion@OData.Community.Display.V1.FormattedValue": "No",
    osp_validadocontratacion: false,
    "createdon@OData.Community.Display.V1.FormattedValue": "13/06/2025 12:34",
    createdon: "2025-06-13T10:34:24Z",
    osp_nombre: "Pedido Portatiles 12062025.msg",
    _ownerid: "GONZALEZ DIEZ, MIRIAM",
    "_ownerid_value@Microsoft.Dynamics.CRM.associatednavigationproperty":
      "ownerid",
    "_ownerid_value@Microsoft.Dynamics.CRM.lookuplogicalname": "systemuser",
    _ownerid_value: "6f5078c2-a430-eb11-80fa-0050568345f9",
    "osp_validadoordering@OData.Community.Display.V1.FormattedValue": "No",
    osp_validadoordering: false,
    osp_registro: "CAS-157065-B4Q4D6",
    "_osp_oportunidad_value@OData.Community.Display.V1.FormattedValue":
      "OPP-0078401 - proyecto covergente",
    "_osp_oportunidad_value@Microsoft.Dynamics.CRM.associatednavigationproperty":
      "osp_oportunidad",
    "_osp_oportunidad_value@Microsoft.Dynamics.CRM.lookuplogicalname":
      "opportunity",
    _osp_oportunidad_value: "53fac40b-c952-4c3c-a12a-778df2689633",
    "osp_tipificacion@OData.Community.Display.V1.FormattedValue":
      "Requisitos Clientes",
    osp_tipificacion: 863920000,
    "osp_proyecto@OData.Community.Display.V1.FormattedValue": "No",
    osp_proyecto: false,
    osp_descripcion: "Requisitos cliente",
    osp_link:
      "https://ggccorange.sharepoint.com/Dynamics/opportunity/OPP-0078401 - proyecto covergente/CAS-157065-B4Q4D6/Pedido Portatiles 12062025.msg",
    "osp_categoria@OData.Community.Display.V1.FormattedValue":
      "Inventario de requisitos",
    osp_categoria: 18,
    _modifiedby: "GONZALEZ DIEZ, MIRIAM",
    "_modifiedby_value@Microsoft.Dynamics.CRM.lookuplogicalname": "systemuser",
    _modifiedby_value: "6f5078c2-a430-eb11-80fa-0050568345f9",
  },
  {
    "@odata.etag": 'W/"2967518044"',
    "modifiedon@OData.Community.Display.V1.FormattedValue": "13/06/2025 12:40",
    modifiedon: "2025-06-13T10:40:34Z",
    osp_subcategoria: null,
    osp_documentacionid: "a5b522d0-4248-f011-877a-6045bd95c298",
    "osp_validadocontratacion@OData.Community.Display.V1.FormattedValue": "No",
    osp_validadocontratacion: false,
    "createdon@OData.Community.Display.V1.FormattedValue": "13/06/2025 12:40",
    createdon: "2025-06-13T10:40:34Z",
    osp_nombre: "Oferta Orange-Dorsia 8\u00aa ENTREGA V1.xlsx",
    _ownerid: "GONZALEZ DIEZ, MIRIAM",
    "_ownerid_value@Microsoft.Dynamics.CRM.associatednavigationproperty":
      "ownerid",
    "_ownerid_value@Microsoft.Dynamics.CRM.lookuplogicalname": "systemuser",
    _ownerid_value: "6f5078c2-a430-eb11-80fa-0050568345f9",
    "osp_validadoordering@OData.Community.Display.V1.FormattedValue": "No",
    osp_validadoordering: false,
    osp_registro: "CAS-157067-V6M4H8",
    "_osp_oportunidad_value@OData.Community.Display.V1.FormattedValue":
      "OPP-0078401 - proyecto covergente",
    "_osp_oportunidad_value@Microsoft.Dynamics.CRM.associatednavigationproperty":
      "osp_oportunidad",
    "_osp_oportunidad_value@Microsoft.Dynamics.CRM.lookuplogicalname":
      "opportunity",
    _osp_oportunidad_value: "53fac40b-c952-4c3c-a12a-778df2689633",
    "osp_tipificacion@OData.Community.Display.V1.FormattedValue":
      "Ofertas de terceros",
    osp_tipificacion: 863920007,
    "osp_proyecto@OData.Community.Display.V1.FormattedValue": "No",
    osp_proyecto: false,
    osp_descripcion: "Pedido proveedor",
    osp_link:
      "https://ggccorange.sharepoint.com/Dynamics/opportunity/OPP-0078401 - proyecto covergente/CAS-157067-V6M4H8/Oferta Orange-Dorsia 8\u00aa ENTREGA V1.xlsx",
    "osp_categoria@OData.Community.Display.V1.FormattedValue":
      "Oferta de proveedores",
    osp_categoria: 20,
    _modifiedby: "GONZALEZ DIEZ, MIRIAM",
    "_modifiedby_value@Microsoft.Dynamics.CRM.lookuplogicalname": "systemuser",
    _modifiedby_value: "6f5078c2-a430-eb11-80fa-0050568345f9",
  },
  {
    "@odata.etag": 'W/"3004934359"',
    "modifiedon@OData.Community.Display.V1.FormattedValue": "30/06/2025 12:44",
    modifiedon: "2025-06-30T10:44:56Z",
    osp_subcategoria: null,
    osp_documentacionid: "2a66e741-9f55-f011-877b-6045bd95c298",
    "osp_validadocontratacion@OData.Community.Display.V1.FormattedValue": "No",
    osp_validadocontratacion: false,
    "createdon@OData.Community.Display.V1.FormattedValue": "30/06/2025 12:44",
    createdon: "2025-06-30T10:44:56Z",
    osp_nombre: "RE_ Nuevo 800 para THE RED KIWI.msg",
    _ownerid: "GONZALEZ DIEZ, MIRIAM",
    "_ownerid_value@Microsoft.Dynamics.CRM.associatednavigationproperty":
      "ownerid",
    "_ownerid_value@Microsoft.Dynamics.CRM.lookuplogicalname": "systemuser",
    _ownerid_value: "6f5078c2-a430-eb11-80fa-0050568345f9",
    "osp_validadoordering@OData.Community.Display.V1.FormattedValue": "No",
    osp_validadoordering: false,
    osp_registro: "CAS-158349-V5Y9V6",
    "_osp_oportunidad_value@OData.Community.Display.V1.FormattedValue":
      "OPP-0078401 - proyecto covergente",
    "_osp_oportunidad_value@Microsoft.Dynamics.CRM.associatednavigationproperty":
      "osp_oportunidad",
    "_osp_oportunidad_value@Microsoft.Dynamics.CRM.lookuplogicalname":
      "opportunity",
    _osp_oportunidad_value: "53fac40b-c952-4c3c-a12a-778df2689633",
    "osp_tipificacion@OData.Community.Display.V1.FormattedValue":
      "Autorizaciones Internas",
    osp_tipificacion: 863920008,
    "osp_proyecto@OData.Community.Display.V1.FormattedValue": "No",
    osp_proyecto: false,
    osp_descripcion: "Solicitud KAM",
    osp_link:
      "https://ggccorange.sharepoint.com/Dynamics/opportunity/OPP-0078401 - proyecto covergente/CAS-158349-V5Y9V6/RE_ Nuevo 800 para THE RED KIWI.msg",
    "osp_categoria@OData.Community.Display.V1.FormattedValue":
      "Autorizaciones internas KAM",
    osp_categoria: 6,
    _modifiedby: "GONZALEZ DIEZ, MIRIAM",
    "_modifiedby_value@Microsoft.Dynamics.CRM.lookuplogicalname": "systemuser",
    _modifiedby_value: "6f5078c2-a430-eb11-80fa-0050568345f9",
  },
  {
    "@odata.etag": 'W/"2874199011"',
    "modifiedon@OData.Community.Display.V1.FormattedValue": "07/05/2025 13:16",
    modifiedon: "2025-05-07T11:16:51Z",
    osp_subcategoria: null,
    osp_documentacionid: "b0846dc1-342b-f011-8c4d-6045bd95c298",
    "osp_validadocontratacion@OData.Community.Display.V1.FormattedValue": "No",
    osp_validadocontratacion: false,
    "createdon@OData.Community.Display.V1.FormattedValue": "07/05/2025 13:16",
    createdon: "2025-05-07T11:16:51Z",
    osp_nombre: "Oferta Orange-Dorsia 6\u00aa ENTREGA V1.xlsx",
    _ownerid: "ORTEGA MOCHON, ANA",
    "_ownerid_value@Microsoft.Dynamics.CRM.associatednavigationproperty":
      "ownerid",
    "_ownerid_value@Microsoft.Dynamics.CRM.lookuplogicalname": "systemuser",
    _ownerid_value: "370d2a1e-9ca5-e611-80c7-005056b95048",
    "osp_validadoordering@OData.Community.Display.V1.FormattedValue": "No",
    osp_validadoordering: false,
    osp_registro: "OPP-0078401 - WAOC-0052691 - Proyecto convergente",
    "_osp_oportunidad_value@OData.Community.Display.V1.FormattedValue":
      "OPP-0078401 - proyecto covergente",
    "_osp_oportunidad_value@Microsoft.Dynamics.CRM.associatednavigationproperty":
      "osp_oportunidad",
    "_osp_oportunidad_value@Microsoft.Dynamics.CRM.lookuplogicalname":
      "opportunity",
    _osp_oportunidad_value: "53fac40b-c952-4c3c-a12a-778df2689633",
    "osp_tipificacion@OData.Community.Display.V1.FormattedValue": "PdN",
    osp_tipificacion: 863920001,
    "osp_proyecto@OData.Community.Display.V1.FormattedValue": "No",
    osp_proyecto: false,
    osp_descripcion: "Oferta Espirinet Abril 25",
    osp_link:
      "https://ggccorange.sharepoint.com/Dynamics/opportunity/OPP-0078401 - proyecto covergente/OPP-0078401 - WAOC-0052691 - Proyecto convergente/Oferta Orange-Dorsia 6\u00aa ENTREGA V1.xlsx",
    osp_categoria: null,
    _modifiedby: "ORTEGA MOCHON, ANA",
    "_modifiedby_value@Microsoft.Dynamics.CRM.lookuplogicalname": "systemuser",
    _modifiedby_value: "370d2a1e-9ca5-e611-80c7-005056b95048",
  },
  {
    "@odata.etag": 'W/"2890676158"',
    "modifiedon@OData.Community.Display.V1.FormattedValue": "14/05/2025 14:02",
    modifiedon: "2025-05-14T12:02:49Z",
    osp_subcategoria: null,
    osp_documentacionid: "dae55f56-bb30-f011-8c4d-6045bd95c298",
    "osp_validadocontratacion@OData.Community.Display.V1.FormattedValue": "No",
    osp_validadocontratacion: false,
    "createdon@OData.Community.Display.V1.FormattedValue": "14/05/2025 14:02",
    createdon: "2025-05-14T12:02:49Z",
    osp_nombre: "Centralita ClinicasMayo25.xlsx",
    _ownerid: "GONZALEZ DIEZ, MIRIAM",
    "_ownerid_value@Microsoft.Dynamics.CRM.associatednavigationproperty":
      "ownerid",
    "_ownerid_value@Microsoft.Dynamics.CRM.lookuplogicalname": "systemuser",
    _ownerid_value: "6f5078c2-a430-eb11-80fa-0050568345f9",
    "osp_validadoordering@OData.Community.Display.V1.FormattedValue": "No",
    osp_validadoordering: false,
    osp_registro:
      "CAS-153433-R4W6P6 - Plantilla CENTREX Oviedo, Lerida y Valladolid",
    "_osp_oportunidad_value@OData.Community.Display.V1.FormattedValue":
      "OPP-0078401 - proyecto covergente",
    "_osp_oportunidad_value@Microsoft.Dynamics.CRM.associatednavigationproperty":
      "osp_oportunidad",
    "_osp_oportunidad_value@Microsoft.Dynamics.CRM.lookuplogicalname":
      "opportunity",
    _osp_oportunidad_value: "53fac40b-c952-4c3c-a12a-778df2689633",
    "osp_tipificacion@OData.Community.Display.V1.FormattedValue":
      "Requisitos Clientes",
    osp_tipificacion: 863920000,
    "osp_proyecto@OData.Community.Display.V1.FormattedValue": "No",
    osp_proyecto: false,
    osp_descripcion: "Requisitos cliente",
    osp_link:
      "https://ggccorange.sharepoint.com/Dynamics/opportunity/OPP-0078401 - proyecto covergente/CAS-153433-R4W6P6 - Plantilla CENTREX Oviedo, Lerida y Valladolid/Centralita ClinicasMayo25.xlsx",
    "osp_categoria@OData.Community.Display.V1.FormattedValue":
      "Inventario de requisitos",
    osp_categoria: 18,
    _modifiedby: "GONZALEZ DIEZ, MIRIAM",
    "_modifiedby_value@Microsoft.Dynamics.CRM.lookuplogicalname": "systemuser",
    _modifiedby_value: "6f5078c2-a430-eb11-80fa-0050568345f9",
  },
  {
    "@odata.etag": 'W/"2752052355"',
    "modifiedon@OData.Community.Display.V1.FormattedValue": "20/03/2025 16:17",
    modifiedon: "2025-03-20T15:17:56Z",
    osp_subcategoria: null,
    osp_documentacionid: "6783e440-6efa-ef11-bae3-6045bd95c298",
    "osp_validadocontratacion@OData.Community.Display.V1.FormattedValue": "No",
    osp_validadocontratacion: false,
    "createdon@OData.Community.Display.V1.FormattedValue": "06/03/2025 10:35",
    createdon: "2025-03-06T09:35:01Z",
    osp_nombre: "plantilla centrex B06940415 FILLEART SL.xls",
    _ownerid: "GONZALEZ MILLAN, DOMINGO",
    "_ownerid_value@Microsoft.Dynamics.CRM.associatednavigationproperty":
      "ownerid",
    "_ownerid_value@Microsoft.Dynamics.CRM.lookuplogicalname": "systemuser",
    _ownerid_value: "9b801e69-d756-ee11-be6e-6045bd905982",
    "osp_validadoordering@OData.Community.Display.V1.FormattedValue": "No",
    osp_validadoordering: false,
    osp_registro:
      "CAS-146780-X5H9C1 - Plantilla migracion a CENTREX  FILLEART - Girona",
    "_osp_oportunidad_value@OData.Community.Display.V1.FormattedValue":
      "OPP-0078401 - proyecto covergente",
    "_osp_oportunidad_value@Microsoft.Dynamics.CRM.associatednavigationproperty":
      "osp_oportunidad",
    "_osp_oportunidad_value@Microsoft.Dynamics.CRM.lookuplogicalname":
      "opportunity",
    _osp_oportunidad_value: "53fac40b-c952-4c3c-a12a-778df2689633",
    "osp_tipificacion@OData.Community.Display.V1.FormattedValue":
      "Documentacion de proyecto y provisi\u00f3n",
    osp_tipificacion: 863920012,
    "osp_proyecto@OData.Community.Display.V1.FormattedValue": "No",
    osp_proyecto: false,
    osp_descripcion: "PLANTILLA CENTREX",
    osp_link:
      "https://ggccorange.sharepoint.com/Dynamics/opportunity/OPP-0078401 - proyecto covergente/CAS-146780-X5H9C1 - Plantilla migracion a CENTREX  FILLEART - Girona/plantilla centrex B06940415 FILLEART SL.xls",
    osp_categoria: null,
    _modifiedby: "CRM, Admin",
    "_modifiedby_value@Microsoft.Dynamics.CRM.lookuplogicalname": "systemuser",
    _modifiedby_value: "ac79a518-0950-e611-80c1-005056a03d45",
  },
  {
    "@odata.etag": 'W/"2781309437"',
    "modifiedon@OData.Community.Display.V1.FormattedValue": "27/03/2025 16:22",
    modifiedon: "2025-03-27T15:22:06Z",
    osp_subcategoria: null,
    osp_documentacionid: "13e35d3b-1f0b-f011-bae3-6045bd95c298",
    "osp_validadocontratacion@OData.Community.Display.V1.FormattedValue": "No",
    osp_validadocontratacion: false,
    "createdon@OData.Community.Display.V1.FormattedValue": "27/03/2025 16:22",
    createdon: "2025-03-27T15:22:06Z",
    osp_nombre:
      "27032025 THE RED KIWI Donostia, Hospital BCN y Huesca Plantilla_Provision_Digital_Centrex.xlsx",
    _ownerid: "LAGO RUIZ, JOSE",
    "_ownerid_value@Microsoft.Dynamics.CRM.associatednavigationproperty":
      "ownerid",
    "_ownerid_value@Microsoft.Dynamics.CRM.lookuplogicalname": "systemuser",
    _ownerid_value: "039f6c0f-aaba-ee11-a569-6045bd905b10",
    "osp_validadoordering@OData.Community.Display.V1.FormattedValue": "No",
    osp_validadoordering: false,
    osp_registro:
      "CAS-148313-D2P9W5 - CAS-124742-G6W5D2 - Plantilla CENTREX San Sebastian, Hospital BCNy Huesca",
    "_osp_oportunidad_value@OData.Community.Display.V1.FormattedValue":
      "OPP-0078401 - proyecto covergente",
    "_osp_oportunidad_value@Microsoft.Dynamics.CRM.associatednavigationproperty":
      "osp_oportunidad",
    "_osp_oportunidad_value@Microsoft.Dynamics.CRM.lookuplogicalname":
      "opportunity",
    _osp_oportunidad_value: "53fac40b-c952-4c3c-a12a-778df2689633",
    "osp_tipificacion@OData.Community.Display.V1.FormattedValue":
      "Documentacion de proyecto y provisi\u00f3n",
    osp_tipificacion: 863920012,
    "osp_proyecto@OData.Community.Display.V1.FormattedValue": "No",
    osp_proyecto: false,
    osp_descripcion: null,
    osp_link:
      "https://ggccorange.sharepoint.com/Dynamics/opportunity/OPP-0078401 - proyecto covergente/CAS-148313-D2P9W5 - CAS-124742-G6W5D2 - Plantilla CENTREX San Sebastian, Hospital BCNy Huesca/27032025 THE RED KIWI Donostia, Hospital BCN y Huesca Plantilla_Provision_Digital_Centrex.xlsx",
    osp_categoria: null,
    _modifiedby: "LAGO RUIZ, JOSE",
    "_modifiedby_value@Microsoft.Dynamics.CRM.lookuplogicalname": "systemuser",
    _modifiedby_value: "039f6c0f-aaba-ee11-a569-6045bd905b10",
  },
  {
    "@odata.etag": 'W/"2752060497"',
    "modifiedon@OData.Community.Display.V1.FormattedValue": "20/03/2025 16:21",
    modifiedon: "2025-03-20T15:21:16Z",
    osp_subcategoria: null,
    osp_documentacionid: "4de93f6a-41e9-ef11-be20-6045bd9690a1",
    "osp_validadocontratacion@OData.Community.Display.V1.FormattedValue": "No",
    osp_validadocontratacion: false,
    "createdon@OData.Community.Display.V1.FormattedValue": "12/02/2025 14:01",
    createdon: "2025-02-12T13:01:14Z",
    osp_nombre: "RE DORSIA PEDIDO PORTATILES 12022025.msg",
    _ownerid: "GONZALEZ DIEZ, MIRIAM",
    "_ownerid_value@Microsoft.Dynamics.CRM.associatednavigationproperty":
      "ownerid",
    "_ownerid_value@Microsoft.Dynamics.CRM.lookuplogicalname": "systemuser",
    _ownerid_value: "6f5078c2-a430-eb11-80fa-0050568345f9",
    "osp_validadoordering@OData.Community.Display.V1.FormattedValue": "No",
    osp_validadoordering: false,
    osp_registro:
      "CAS-144792-C7Z6L7 - CAS-124742-G6W5D2 - 4\u00ba pedido portatiles ",
    "_osp_oportunidad_value@OData.Community.Display.V1.FormattedValue":
      "OPP-0078401 - proyecto covergente",
    "_osp_oportunidad_value@Microsoft.Dynamics.CRM.associatednavigationproperty":
      "osp_oportunidad",
    "_osp_oportunidad_value@Microsoft.Dynamics.CRM.lookuplogicalname":
      "opportunity",
    _osp_oportunidad_value: "53fac40b-c952-4c3c-a12a-778df2689633",
    "osp_tipificacion@OData.Community.Display.V1.FormattedValue":
      "Informaci\u00f3n adicional",
    osp_tipificacion: 863920013,
    "osp_proyecto@OData.Community.Display.V1.FormattedValue": "No",
    osp_proyecto: false,
    osp_descripcion: "Email KAM",
    osp_link:
      "https://ggccorange.sharepoint.com/Dynamics/opportunity/OPP-0078401 - proyecto covergente/CAS-144792-C7Z6L7 - CAS-124742-G6W5D2 - 4\u00ba pedido portatiles/RE DORSIA PEDIDO PORTATILES 12022025.msg",
    osp_categoria: null,
    _modifiedby: "CRM, Admin",
    "_modifiedby_value@Microsoft.Dynamics.CRM.lookuplogicalname": "systemuser",
    _modifiedby_value: "ac79a518-0950-e611-80c1-005056a03d45",
  },
  {
    "@odata.etag": 'W/"2991224731"',
    "modifiedon@OData.Community.Display.V1.FormattedValue": "23/06/2025 15:54",
    modifiedon: "2025-06-23T13:54:51Z",
    osp_subcategoria: null,
    osp_documentacionid: "070f8f9f-3950-f011-877b-6045bd9cd8c6",
    "osp_validadocontratacion@OData.Community.Display.V1.FormattedValue": "No",
    osp_validadocontratacion: false,
    "createdon@OData.Community.Display.V1.FormattedValue": "23/06/2025 15:54",
    createdon: "2025-06-23T13:54:51Z",
    osp_nombre:
      "THE RED KIWI MARIA DE MOLINA Plantilla_Provision_Digital_Centrex.xlsx",
    _ownerid: "LAGO RUIZ, JOSE",
    "_ownerid_value@Microsoft.Dynamics.CRM.associatednavigationproperty":
      "ownerid",
    "_ownerid_value@Microsoft.Dynamics.CRM.lookuplogicalname": "systemuser",
    _ownerid_value: "039f6c0f-aaba-ee11-a569-6045bd905b10",
    "osp_validadoordering@OData.Community.Display.V1.FormattedValue": "No",
    osp_validadoordering: false,
    osp_registro: "CAS-152223-M7P6F0",
    "_osp_oportunidad_value@OData.Community.Display.V1.FormattedValue":
      "OPP-0078401 - proyecto covergente",
    "_osp_oportunidad_value@Microsoft.Dynamics.CRM.associatednavigationproperty":
      "osp_oportunidad",
    "_osp_oportunidad_value@Microsoft.Dynamics.CRM.lookuplogicalname":
      "opportunity",
    _osp_oportunidad_value: "53fac40b-c952-4c3c-a12a-778df2689633",
    "osp_tipificacion@OData.Community.Display.V1.FormattedValue":
      "Documentacion de proyecto y provisi\u00f3n",
    osp_tipificacion: 863920012,
    "osp_proyecto@OData.Community.Display.V1.FormattedValue": "No",
    osp_proyecto: false,
    osp_descripcion: null,
    osp_link:
      "https://ggccorange.sharepoint.com/Dynamics/opportunity/OPP-0078401 - proyecto covergente/CAS-152223-M7P6F0/THE RED KIWI MARIA DE MOLINA Plantilla_Provision_Digital_Centrex.xlsx",
    osp_categoria: null,
    _modifiedby: "LAGO RUIZ, JOSE",
    "_modifiedby_value@Microsoft.Dynamics.CRM.lookuplogicalname": "systemuser",
    _modifiedby_value: "039f6c0f-aaba-ee11-a569-6045bd905b10",
  },
  {
    "@odata.etag": 'W/"2991225748"',
    "modifiedon@OData.Community.Display.V1.FormattedValue": "23/06/2025 15:55",
    modifiedon: "2025-06-23T13:55:02Z",
    osp_subcategoria: null,
    osp_documentacionid: "388c8ea5-3950-f011-877b-6045bd9cd8c6",
    "osp_validadocontratacion@OData.Community.Display.V1.FormattedValue": "No",
    osp_validadocontratacion: false,
    "createdon@OData.Community.Display.V1.FormattedValue": "23/06/2025 15:55",
    createdon: "2025-06-23T13:55:02Z",
    osp_nombre: "THE RED KIWI MARIA DE MOLINA  INVENTARIO ORANGE.xlsx",
    _ownerid: "LAGO RUIZ, JOSE",
    "_ownerid_value@Microsoft.Dynamics.CRM.associatednavigationproperty":
      "ownerid",
    "_ownerid_value@Microsoft.Dynamics.CRM.lookuplogicalname": "systemuser",
    _ownerid_value: "039f6c0f-aaba-ee11-a569-6045bd905b10",
    "osp_validadoordering@OData.Community.Display.V1.FormattedValue": "No",
    osp_validadoordering: false,
    osp_registro: "CAS-152223-M7P6F0",
    "_osp_oportunidad_value@OData.Community.Display.V1.FormattedValue":
      "OPP-0078401 - proyecto covergente",
    "_osp_oportunidad_value@Microsoft.Dynamics.CRM.associatednavigationproperty":
      "osp_oportunidad",
    "_osp_oportunidad_value@Microsoft.Dynamics.CRM.lookuplogicalname":
      "opportunity",
    _osp_oportunidad_value: "53fac40b-c952-4c3c-a12a-778df2689633",
    "osp_tipificacion@OData.Community.Display.V1.FormattedValue":
      "Documentacion de proyecto y provisi\u00f3n",
    osp_tipificacion: 863920012,
    "osp_proyecto@OData.Community.Display.V1.FormattedValue": "No",
    osp_proyecto: false,
    osp_descripcion: null,
    osp_link:
      "https://ggccorange.sharepoint.com/Dynamics/opportunity/OPP-0078401 - proyecto covergente/CAS-152223-M7P6F0/THE RED KIWI MARIA DE MOLINA  INVENTARIO ORANGE.xlsx",
    osp_categoria: null,
    _modifiedby: "LAGO RUIZ, JOSE",
    "_modifiedby_value@Microsoft.Dynamics.CRM.lookuplogicalname": "systemuser",
    _modifiedby_value: "039f6c0f-aaba-ee11-a569-6045bd905b10",
  },
  {
    "@odata.etag": 'W/"2991227469"',
    "modifiedon@OData.Community.Display.V1.FormattedValue": "23/06/2025 15:55",
    modifiedon: "2025-06-23T13:55:31Z",
    osp_subcategoria: null,
    osp_documentacionid: "941486b7-3950-f011-877b-6045bd9cd8c6",
    "osp_validadocontratacion@OData.Community.Display.V1.FormattedValue": "No",
    osp_validadocontratacion: false,
    "createdon@OData.Community.Display.V1.FormattedValue": "23/06/2025 15:55",
    createdon: "2025-06-23T13:55:31Z",
    osp_nombre:
      "THE RED KIWI VALLIRANA  Plantilla_Provision_Digital_Centrex.xlsx",
    _ownerid: "LAGO RUIZ, JOSE",
    "_ownerid_value@Microsoft.Dynamics.CRM.associatednavigationproperty":
      "ownerid",
    "_ownerid_value@Microsoft.Dynamics.CRM.lookuplogicalname": "systemuser",
    _ownerid_value: "039f6c0f-aaba-ee11-a569-6045bd905b10",
    "osp_validadoordering@OData.Community.Display.V1.FormattedValue": "No",
    osp_validadoordering: false,
    osp_registro: "CAS-146416-F2V9M5",
    "_osp_oportunidad_value@OData.Community.Display.V1.FormattedValue":
      "OPP-0078401 - proyecto covergente",
    "_osp_oportunidad_value@Microsoft.Dynamics.CRM.associatednavigationproperty":
      "osp_oportunidad",
    "_osp_oportunidad_value@Microsoft.Dynamics.CRM.lookuplogicalname":
      "opportunity",
    _osp_oportunidad_value: "53fac40b-c952-4c3c-a12a-778df2689633",
    "osp_tipificacion@OData.Community.Display.V1.FormattedValue":
      "Documentacion de proyecto y provisi\u00f3n",
    osp_tipificacion: 863920012,
    "osp_proyecto@OData.Community.Display.V1.FormattedValue": "No",
    osp_proyecto: false,
    osp_descripcion: null,
    osp_link:
      "https://ggccorange.sharepoint.com/Dynamics/opportunity/OPP-0078401 - proyecto covergente/CAS-146416-F2V9M5/THE RED KIWI VALLIRANA  Plantilla_Provision_Digital_Centrex.xlsx",
    osp_categoria: null,
    _modifiedby: "LAGO RUIZ, JOSE",
    "_modifiedby_value@Microsoft.Dynamics.CRM.lookuplogicalname": "systemuser",
    _modifiedby_value: "039f6c0f-aaba-ee11-a569-6045bd905b10",
  },
  {
    "@odata.etag": 'W/"2991228073"',
    "modifiedon@OData.Community.Display.V1.FormattedValue": "23/06/2025 15:55",
    modifiedon: "2025-06-23T13:55:44Z",
    osp_subcategoria: null,
    osp_documentacionid: "5c8d85bd-3950-f011-877b-6045bd9cd8c6",
    "osp_validadocontratacion@OData.Community.Display.V1.FormattedValue": "No",
    osp_validadocontratacion: false,
    "createdon@OData.Community.Display.V1.FormattedValue": "23/06/2025 15:55",
    createdon: "2025-06-23T13:55:44Z",
    osp_nombre: "THE RED KIWI VALLIRANA  INVENTARIO ORANGE.xlsx",
    _ownerid: "LAGO RUIZ, JOSE",
    "_ownerid_value@Microsoft.Dynamics.CRM.associatednavigationproperty":
      "ownerid",
    "_ownerid_value@Microsoft.Dynamics.CRM.lookuplogicalname": "systemuser",
    _ownerid_value: "039f6c0f-aaba-ee11-a569-6045bd905b10",
    "osp_validadoordering@OData.Community.Display.V1.FormattedValue": "No",
    osp_validadoordering: false,
    osp_registro: "CAS-146416-F2V9M5",
    "_osp_oportunidad_value@OData.Community.Display.V1.FormattedValue":
      "OPP-0078401 - proyecto covergente",
    "_osp_oportunidad_value@Microsoft.Dynamics.CRM.associatednavigationproperty":
      "osp_oportunidad",
    "_osp_oportunidad_value@Microsoft.Dynamics.CRM.lookuplogicalname":
      "opportunity",
    _osp_oportunidad_value: "53fac40b-c952-4c3c-a12a-778df2689633",
    "osp_tipificacion@OData.Community.Display.V1.FormattedValue":
      "Documentacion de proyecto y provisi\u00f3n",
    osp_tipificacion: 863920012,
    "osp_proyecto@OData.Community.Display.V1.FormattedValue": "No",
    osp_proyecto: false,
    osp_descripcion: null,
    osp_link:
      "https://ggccorange.sharepoint.com/Dynamics/opportunity/OPP-0078401 - proyecto covergente/CAS-146416-F2V9M5/THE RED KIWI VALLIRANA  INVENTARIO ORANGE.xlsx",
    osp_categoria: null,
    _modifiedby: "LAGO RUIZ, JOSE",
    "_modifiedby_value@Microsoft.Dynamics.CRM.lookuplogicalname": "systemuser",
    _modifiedby_value: "039f6c0f-aaba-ee11-a569-6045bd905b10",
  },
  {
    "@odata.etag": 'W/"2857438943"',
    "modifiedon@OData.Community.Display.V1.FormattedValue": "28/04/2025 11:22",
    modifiedon: "2025-04-28T09:22:01Z",
    osp_subcategoria: null,
    osp_documentacionid: "965ee23b-1224-f011-8c4e-6045bd9cd8c6",
    "osp_validadocontratacion@OData.Community.Display.V1.FormattedValue": "No",
    osp_validadocontratacion: false,
    "createdon@OData.Community.Display.V1.FormattedValue": "28/04/2025 11:22",
    createdon: "2025-04-28T09:22:01Z",
    osp_nombre: "Re CAS-132998-M6D0M4_THE RED KIWI SOCIEDAD LIMITADA .msg",
    _ownerid: "GONZALEZ DIEZ, MIRIAM",
    "_ownerid_value@Microsoft.Dynamics.CRM.associatednavigationproperty":
      "ownerid",
    "_ownerid_value@Microsoft.Dynamics.CRM.lookuplogicalname": "systemuser",
    _ownerid_value: "6f5078c2-a430-eb11-80fa-0050568345f9",
    "osp_validadoordering@OData.Community.Display.V1.FormattedValue": "No",
    osp_validadoordering: false,
    osp_registro: "CAS-151895-X2R7W4 - CAS-124742-G6W5D2 - Portabilidad 90x",
    "_osp_oportunidad_value@OData.Community.Display.V1.FormattedValue":
      "OPP-0078401 - proyecto covergente",
    "_osp_oportunidad_value@Microsoft.Dynamics.CRM.associatednavigationproperty":
      "osp_oportunidad",
    "_osp_oportunidad_value@Microsoft.Dynamics.CRM.lookuplogicalname":
      "opportunity",
    _osp_oportunidad_value: "53fac40b-c952-4c3c-a12a-778df2689633",
    "osp_tipificacion@OData.Community.Display.V1.FormattedValue":
      "Requisitos Clientes",
    osp_tipificacion: 863920000,
    "osp_proyecto@OData.Community.Display.V1.FormattedValue": "No",
    osp_proyecto: false,
    osp_descripcion: "Requisitos cliente",
    osp_link:
      "https://ggccorange.sharepoint.com/Dynamics/opportunity/OPP-0078401 - proyecto covergente/CAS-151895-X2R7W4 - CAS-124742-G6W5D2 - Portabilidad 90x/Re CAS-132998-M6D0M4_THE RED KIWI SOCIEDAD LIMITADA .msg",
    "osp_categoria@OData.Community.Display.V1.FormattedValue":
      "Inventario de requisitos",
    osp_categoria: 18,
    _modifiedby: "GONZALEZ DIEZ, MIRIAM",
    "_modifiedby_value@Microsoft.Dynamics.CRM.lookuplogicalname": "systemuser",
    _modifiedby_value: "6f5078c2-a430-eb11-80fa-0050568345f9",
  },
  {
    "@odata.etag": 'W/"2873725527"',
    "modifiedon@OData.Community.Display.V1.FormattedValue": "07/05/2025 11:01",
    modifiedon: "2025-05-07T09:01:57Z",
    osp_subcategoria: null,
    osp_documentacionid: "078513e9-212b-f011-8c4e-6045bd9cd8c6",
    "osp_validadocontratacion@OData.Community.Display.V1.FormattedValue": "No",
    osp_validadocontratacion: false,
    "createdon@OData.Community.Display.V1.FormattedValue": "07/05/2025 11:01",
    createdon: "2025-05-07T09:01:57Z",
    osp_nombre:
      "1PG_Group_Westcon_Comstor_ORANGE ESPAGNE SAU_CLINICAS DORSIA_Quote-23326317_Rev-1_update.xls",
    _ownerid: "GONZALEZ DIEZ, MIRIAM",
    "_ownerid_value@Microsoft.Dynamics.CRM.associatednavigationproperty":
      "ownerid",
    "_ownerid_value@Microsoft.Dynamics.CRM.lookuplogicalname": "systemuser",
    _ownerid_value: "6f5078c2-a430-eb11-80fa-0050568345f9",
    "osp_validadoordering@OData.Community.Display.V1.FormattedValue": "No",
    osp_validadoordering: false,
    osp_registro:
      "CAS-152673-S2M1B1 - CAS-124742-G6W5D2 - Pedido ABRIL 20 sedes SDWAN + SW Alcala + AP Hospital",
    "_osp_oportunidad_value@OData.Community.Display.V1.FormattedValue":
      "OPP-0078401 - proyecto covergente",
    "_osp_oportunidad_value@Microsoft.Dynamics.CRM.associatednavigationproperty":
      "osp_oportunidad",
    "_osp_oportunidad_value@Microsoft.Dynamics.CRM.lookuplogicalname":
      "opportunity",
    _osp_oportunidad_value: "53fac40b-c952-4c3c-a12a-778df2689633",
    "osp_tipificacion@OData.Community.Display.V1.FormattedValue":
      "Ofertas de terceros",
    osp_tipificacion: 863920007,
    "osp_proyecto@OData.Community.Display.V1.FormattedValue": "No",
    osp_proyecto: false,
    osp_descripcion: "Ofertas proveedores",
    osp_link:
      "https://ggccorange.sharepoint.com/Dynamics/opportunity/OPP-0078401 - proyecto covergente/CAS-152673-S2M1B1 - CAS-124742-G6W5D2 - Pedido ABRIL 20 sedes SDWAN + SW Alcala + AP Hospital/1PG_Group_Westcon_Comstor_ORANGE ESPAGNE SAU_CLINICAS DORSIA_Quote-23326317_Rev-1_update.xls",
    "osp_categoria@OData.Community.Display.V1.FormattedValue":
      "Oferta de proveedores",
    osp_categoria: 20,
    _modifiedby: "GONZALEZ DIEZ, MIRIAM",
    "_modifiedby_value@Microsoft.Dynamics.CRM.lookuplogicalname": "systemuser",
    _modifiedby_value: "6f5078c2-a430-eb11-80fa-0050568345f9",
  },
  {
    "@odata.etag": 'W/"2873728951"',
    "modifiedon@OData.Community.Display.V1.FormattedValue": "07/05/2025 11:02",
    modifiedon: "2025-05-07T09:02:33Z",
    osp_subcategoria: null,
    osp_documentacionid: "78f4bc01-222b-f011-8c4e-6045bd9cd8c6",
    "osp_validadocontratacion@OData.Community.Display.V1.FormattedValue": "No",
    osp_validadocontratacion: false,
    "createdon@OData.Community.Display.V1.FormattedValue": "07/05/2025 11:02",
    createdon: "2025-05-07T09:02:33Z",
    osp_nombre:
      "1PG_Group_Westcon_Comstor_ORANGE ESPAGNE SAU_CLINICAS DORSIA_Quote-23351783_.xls",
    _ownerid: "GONZALEZ DIEZ, MIRIAM",
    "_ownerid_value@Microsoft.Dynamics.CRM.associatednavigationproperty":
      "ownerid",
    "_ownerid_value@Microsoft.Dynamics.CRM.lookuplogicalname": "systemuser",
    _ownerid_value: "6f5078c2-a430-eb11-80fa-0050568345f9",
    "osp_validadoordering@OData.Community.Display.V1.FormattedValue": "No",
    osp_validadoordering: false,
    osp_registro:
      "CAS-152673-S2M1B1 - CAS-124742-G6W5D2 - Pedido ABRIL 20 sedes SDWAN + SW Alcala + AP Hospital",
    "_osp_oportunidad_value@OData.Community.Display.V1.FormattedValue":
      "OPP-0078401 - proyecto covergente",
    "_osp_oportunidad_value@Microsoft.Dynamics.CRM.associatednavigationproperty":
      "osp_oportunidad",
    "_osp_oportunidad_value@Microsoft.Dynamics.CRM.lookuplogicalname":
      "opportunity",
    _osp_oportunidad_value: "53fac40b-c952-4c3c-a12a-778df2689633",
    "osp_tipificacion@OData.Community.Display.V1.FormattedValue":
      "Ofertas de terceros",
    osp_tipificacion: 863920007,
    "osp_proyecto@OData.Community.Display.V1.FormattedValue": "No",
    osp_proyecto: false,
    osp_descripcion: "Oferta proveedor",
    osp_link:
      "https://ggccorange.sharepoint.com/Dynamics/opportunity/OPP-0078401 - proyecto covergente/CAS-152673-S2M1B1 - CAS-124742-G6W5D2 - Pedido ABRIL 20 sedes SDWAN + SW Alcala + AP Hospital/1PG_Group_Westcon_Comstor_ORANGE ESPAGNE SAU_CLINICAS DORSIA_Quote-23351783_.xls",
    "osp_categoria@OData.Community.Display.V1.FormattedValue":
      "Oferta de proveedores",
    osp_categoria: 20,
    _modifiedby: "GONZALEZ DIEZ, MIRIAM",
    "_modifiedby_value@Microsoft.Dynamics.CRM.lookuplogicalname": "systemuser",
    _modifiedby_value: "6f5078c2-a430-eb11-80fa-0050568345f9",
  },
  {
    "@odata.etag": 'W/"2875330712"',
    "modifiedon@OData.Community.Display.V1.FormattedValue": "07/05/2025 18:54",
    modifiedon: "2025-05-07T16:54:06Z",
    osp_subcategoria: null,
    osp_documentacionid: "8e0277e1-632b-f011-8c4e-6045bd9cd8c6",
    "osp_validadocontratacion@OData.Community.Display.V1.FormattedValue": "No",
    osp_validadocontratacion: false,
    "createdon@OData.Community.Display.V1.FormattedValue": "07/05/2025 18:54",
    createdon: "2025-05-07T16:54:06Z",
    osp_nombre: "Oferta economica-Oferta III.pdf",
    _ownerid: "GONZALEZ DIEZ, MIRIAM",
    "_ownerid_value@Microsoft.Dynamics.CRM.associatednavigationproperty":
      "ownerid",
    "_ownerid_value@Microsoft.Dynamics.CRM.lookuplogicalname": "systemuser",
    _ownerid_value: "6f5078c2-a430-eb11-80fa-0050568345f9",
    "osp_validadoordering@OData.Community.Display.V1.FormattedValue": "No",
    osp_validadoordering: false,
    osp_registro: "CAS-152804-S3Q3W4 - CAS-124742-G6W5D2 - SSPP ITESA FASE III",
    "_osp_oportunidad_value@OData.Community.Display.V1.FormattedValue":
      "OPP-0078401 - proyecto covergente",
    "_osp_oportunidad_value@Microsoft.Dynamics.CRM.associatednavigationproperty":
      "osp_oportunidad",
    "_osp_oportunidad_value@Microsoft.Dynamics.CRM.lookuplogicalname":
      "opportunity",
    _osp_oportunidad_value: "53fac40b-c952-4c3c-a12a-778df2689633",
    "osp_tipificacion@OData.Community.Display.V1.FormattedValue":
      "Ofertas de terceros",
    osp_tipificacion: 863920007,
    "osp_proyecto@OData.Community.Display.V1.FormattedValue": "No",
    osp_proyecto: false,
    osp_descripcion: "Oferat proveedor",
    osp_link:
      "https://ggccorange.sharepoint.com/Dynamics/opportunity/OPP-0078401 - proyecto covergente/CAS-152804-S3Q3W4 - CAS-124742-G6W5D2 - SSPP ITESA FASE III/Oferta economica-Oferta III.pdf",
    "osp_categoria@OData.Community.Display.V1.FormattedValue":
      "Oferta de proveedores",
    osp_categoria: 20,
    _modifiedby: "GONZALEZ DIEZ, MIRIAM",
    "_modifiedby_value@Microsoft.Dynamics.CRM.lookuplogicalname": "systemuser",
    _modifiedby_value: "6f5078c2-a430-eb11-80fa-0050568345f9",
  },
  {
    "@odata.etag": 'W/"2888649720"',
    "modifiedon@OData.Community.Display.V1.FormattedValue": "13/05/2025 16:26",
    modifiedon: "2025-05-13T14:26:52Z",
    osp_subcategoria: null,
    osp_documentacionid: "bae8e74a-0630-f011-8c4e-6045bd9cd8c6",
    "osp_validadocontratacion@OData.Community.Display.V1.FormattedValue": "No",
    osp_validadocontratacion: false,
    "createdon@OData.Community.Display.V1.FormattedValue": "13/05/2025 16:26",
    createdon: "2025-05-13T14:26:52Z",
    osp_nombre: "THE RED KIWI B16741944 madrid INVENTARIO ORANGE.xlsx",
    _ownerid: "LAGO RUIZ, JOSE",
    "_ownerid_value@Microsoft.Dynamics.CRM.associatednavigationproperty":
      "ownerid",
    "_ownerid_value@Microsoft.Dynamics.CRM.lookuplogicalname": "systemuser",
    _ownerid_value: "039f6c0f-aaba-ee11-a569-6045bd905b10",
    "osp_validadoordering@OData.Community.Display.V1.FormattedValue": "No",
    osp_validadoordering: false,
    osp_registro:
      "CAS-152223-M7P6F0 - Plantilla migracion a CENTREX Maria de Molina",
    "_osp_oportunidad_value@OData.Community.Display.V1.FormattedValue":
      "OPP-0078401 - proyecto covergente",
    "_osp_oportunidad_value@Microsoft.Dynamics.CRM.associatednavigationproperty":
      "osp_oportunidad",
    "_osp_oportunidad_value@Microsoft.Dynamics.CRM.lookuplogicalname":
      "opportunity",
    _osp_oportunidad_value: "53fac40b-c952-4c3c-a12a-778df2689633",
    "osp_tipificacion@OData.Community.Display.V1.FormattedValue":
      "Documentacion de proyecto y provisi\u00f3n",
    osp_tipificacion: 863920012,
    "osp_proyecto@OData.Community.Display.V1.FormattedValue": "No",
    osp_proyecto: false,
    osp_descripcion: null,
    osp_link:
      "https://ggccorange.sharepoint.com/Dynamics/opportunity/OPP-0078401 - proyecto covergente/CAS-152223-M7P6F0 - Plantilla migracion a CENTREX Maria de Molina/THE RED KIWI B16741944 madrid INVENTARIO ORANGE.xlsx",
    osp_categoria: null,
    _modifiedby: "LAGO RUIZ, JOSE",
    "_modifiedby_value@Microsoft.Dynamics.CRM.lookuplogicalname": "systemuser",
    _modifiedby_value: "039f6c0f-aaba-ee11-a569-6045bd905b10",
  },
  {
    "@odata.etag": 'W/"2888650490"',
    "modifiedon@OData.Community.Display.V1.FormattedValue": "13/05/2025 16:27",
    modifiedon: "2025-05-13T14:27:05Z",
    osp_subcategoria: null,
    osp_documentacionid: "b8ec4a57-0630-f011-8c4e-6045bd9cd8c6",
    "osp_validadocontratacion@OData.Community.Display.V1.FormattedValue": "No",
    osp_validadocontratacion: false,
    "createdon@OData.Community.Display.V1.FormattedValue": "13/05/2025 16:27",
    createdon: "2025-05-13T14:27:05Z",
    osp_nombre:
      "THE RED KIWI B16741944 madrid Plantilla_Provision_Digital_Centrex.xlsx",
    _ownerid: "LAGO RUIZ, JOSE",
    "_ownerid_value@Microsoft.Dynamics.CRM.associatednavigationproperty":
      "ownerid",
    "_ownerid_value@Microsoft.Dynamics.CRM.lookuplogicalname": "systemuser",
    _ownerid_value: "039f6c0f-aaba-ee11-a569-6045bd905b10",
    "osp_validadoordering@OData.Community.Display.V1.FormattedValue": "No",
    osp_validadoordering: false,
    osp_registro:
      "CAS-152223-M7P6F0 - Plantilla migracion a CENTREX Maria de Molina",
    "_osp_oportunidad_value@OData.Community.Display.V1.FormattedValue":
      "OPP-0078401 - proyecto covergente",
    "_osp_oportunidad_value@Microsoft.Dynamics.CRM.associatednavigationproperty":
      "osp_oportunidad",
    "_osp_oportunidad_value@Microsoft.Dynamics.CRM.lookuplogicalname":
      "opportunity",
    _osp_oportunidad_value: "53fac40b-c952-4c3c-a12a-778df2689633",
    "osp_tipificacion@OData.Community.Display.V1.FormattedValue":
      "Documentacion de proyecto y provisi\u00f3n",
    osp_tipificacion: 863920012,
    "osp_proyecto@OData.Community.Display.V1.FormattedValue": "No",
    osp_proyecto: false,
    osp_descripcion: null,
    osp_link:
      "https://ggccorange.sharepoint.com/Dynamics/opportunity/OPP-0078401 - proyecto covergente/CAS-152223-M7P6F0 - Plantilla migracion a CENTREX Maria de Molina/THE RED KIWI B16741944 madrid Plantilla_Provision_Digital_Centrex.xlsx",
    osp_categoria: null,
    _modifiedby: "LAGO RUIZ, JOSE",
    "_modifiedby_value@Microsoft.Dynamics.CRM.lookuplogicalname": "systemuser",
    _modifiedby_value: "039f6c0f-aaba-ee11-a569-6045bd905b10",
  },
  {
    "@odata.etag": 'W/"2752063845"',
    "modifiedon@OData.Community.Display.V1.FormattedValue": "20/03/2025 16:22",
    modifiedon: "2025-03-20T15:22:40Z",
    osp_subcategoria: null,
    osp_documentacionid: "b5f64347-b9e3-ef11-a731-6045bd9cd8c6",
    "osp_validadocontratacion@OData.Community.Display.V1.FormattedValue": "No",
    osp_validadocontratacion: false,
    "createdon@OData.Community.Display.V1.FormattedValue": "05/02/2025 13:03",
    createdon: "2025-02-05T12:03:58Z",
    osp_nombre:
      "THE RED KIWI 4 SEDES Plantilla_Provision_Digital_Centrex_MALAGA Carlos Haya.xlsx",
    _ownerid: "GONZALEZ DIEZ, MIRIAM",
    "_ownerid_value@Microsoft.Dynamics.CRM.associatednavigationproperty":
      "ownerid",
    "_ownerid_value@Microsoft.Dynamics.CRM.lookuplogicalname": "systemuser",
    _ownerid_value: "6f5078c2-a430-eb11-80fa-0050568345f9",
    "osp_validadoordering@OData.Community.Display.V1.FormattedValue": "No",
    osp_validadoordering: false,
    osp_registro:
      "CAS-144148-N1J9J2 - CAS-124742-G6W5D2 -CENTREX MALAGA-Carlos Haya ",
    "_osp_oportunidad_value@OData.Community.Display.V1.FormattedValue":
      "OPP-0078401 - proyecto covergente",
    "_osp_oportunidad_value@Microsoft.Dynamics.CRM.associatednavigationproperty":
      "osp_oportunidad",
    "_osp_oportunidad_value@Microsoft.Dynamics.CRM.lookuplogicalname":
      "opportunity",
    _osp_oportunidad_value: "53fac40b-c952-4c3c-a12a-778df2689633",
    "osp_tipificacion@OData.Community.Display.V1.FormattedValue":
      "Documentacion de proyecto y provisi\u00f3n",
    osp_tipificacion: 863920012,
    "osp_proyecto@OData.Community.Display.V1.FormattedValue": "No",
    osp_proyecto: false,
    osp_descripcion: "Plantilla CENTREX",
    osp_link:
      "https://ggccorange.sharepoint.com/Dynamics/opportunity/OPP-0078401 - proyecto covergente/CAS-144148-N1J9J2 - CAS-124742-G6W5D2 -CENTREX MALAGA-Carlos Haya/THE RED KIWI 4 SEDES Plantilla_Provision_Digital_Centrex_MALAGA Carlos Haya.xlsx",
    "osp_categoria@OData.Community.Display.V1.FormattedValue": "Centrex",
    osp_categoria: 8,
    _modifiedby: "CRM, Admin",
    "_modifiedby_value@Microsoft.Dynamics.CRM.lookuplogicalname": "systemuser",
    _modifiedby_value: "ac79a518-0950-e611-80c1-005056a03d45",
  },
  {
    "@odata.etag": 'W/"3092636960"',
    "modifiedon@OData.Community.Display.V1.FormattedValue": "04/08/2025 14:21",
    modifiedon: "2025-08-04T12:21:47Z",
    osp_subcategoria: null,
    osp_documentacionid: "d73db092-2d71-f011-b4cc-6045bd9cd8c6",
    "osp_validadocontratacion@OData.Community.Display.V1.FormattedValue": "No",
    osp_validadocontratacion: false,
    "createdon@OData.Community.Display.V1.FormattedValue": "04/08/2025 14:21",
    createdon: "2025-08-04T12:21:47Z",
    osp_nombre: "Pedido Portatiles04082025.msg",
    _ownerid: "GONZALEZ DIEZ, MIRIAM",
    "_ownerid_value@Microsoft.Dynamics.CRM.associatednavigationproperty":
      "ownerid",
    "_ownerid_value@Microsoft.Dynamics.CRM.lookuplogicalname": "systemuser",
    _ownerid_value: "6f5078c2-a430-eb11-80fa-0050568345f9",
    "osp_validadoordering@OData.Community.Display.V1.FormattedValue": "No",
    osp_validadoordering: false,
    osp_registro: "CAS-160992-Y4V7D1",
    "_osp_oportunidad_value@OData.Community.Display.V1.FormattedValue":
      "OPP-0078401 - proyecto covergente",
    "_osp_oportunidad_value@Microsoft.Dynamics.CRM.associatednavigationproperty":
      "osp_oportunidad",
    "_osp_oportunidad_value@Microsoft.Dynamics.CRM.lookuplogicalname":
      "opportunity",
    _osp_oportunidad_value: "53fac40b-c952-4c3c-a12a-778df2689633",
    "osp_tipificacion@OData.Community.Display.V1.FormattedValue":
      "Requisitos Clientes",
    osp_tipificacion: 863920000,
    "osp_proyecto@OData.Community.Display.V1.FormattedValue": "No",
    osp_proyecto: false,
    osp_descripcion: "Requisitos cliente",
    osp_link:
      "https://ggccorange.sharepoint.com/Dynamics/opportunity/OPP-0078401 - proyecto covergente/CAS-160992-Y4V7D1/Pedido Portatiles04082025.msg",
    "osp_categoria@OData.Community.Display.V1.FormattedValue":
      "Inventario de requisitos",
    osp_categoria: 18,
    _modifiedby: "GONZALEZ DIEZ, MIRIAM",
    "_modifiedby_value@Microsoft.Dynamics.CRM.lookuplogicalname": "systemuser",
    _modifiedby_value: "6f5078c2-a430-eb11-80fa-0050568345f9",
  },
  {
    "@odata.etag": 'W/"3183282161"',
    "modifiedon@OData.Community.Display.V1.FormattedValue": "08/09/2025 12:10",
    modifiedon: "2025-09-08T10:10:05Z",
    osp_subcategoria: null,
    osp_documentacionid: "be0fcafb-9b8c-f011-b4cc-6045bd9cd8c6",
    "osp_validadocontratacion@OData.Community.Display.V1.FormattedValue": "No",
    osp_validadocontratacion: false,
    "createdon@OData.Community.Display.V1.FormattedValue": "08/09/2025 12:10",
    createdon: "2025-09-08T10:10:05Z",
    osp_nombre:
      "020925 the red kiwi la cukosa badajoz y alcala de guadaira Inventario.xlsx",
    _ownerid: "GONZALEZ DIEZ, MIRIAM",
    "_ownerid_value@Microsoft.Dynamics.CRM.associatednavigationproperty":
      "ownerid",
    "_ownerid_value@Microsoft.Dynamics.CRM.lookuplogicalname": "systemuser",
    _ownerid_value: "6f5078c2-a430-eb11-80fa-0050568345f9",
    "osp_validadoordering@OData.Community.Display.V1.FormattedValue": "No",
    osp_validadoordering: false,
    osp_registro: "CAS-162968-C0J5C2",
    "_osp_oportunidad_value@OData.Community.Display.V1.FormattedValue":
      "OPP-0078401 - proyecto covergente",
    "_osp_oportunidad_value@Microsoft.Dynamics.CRM.associatednavigationproperty":
      "osp_oportunidad",
    "_osp_oportunidad_value@Microsoft.Dynamics.CRM.lookuplogicalname":
      "opportunity",
    _osp_oportunidad_value: "53fac40b-c952-4c3c-a12a-778df2689633",
    "osp_tipificacion@OData.Community.Display.V1.FormattedValue":
      "Documentacion de proyecto y provisi\u00f3n",
    osp_tipificacion: 863920012,
    "osp_proyecto@OData.Community.Display.V1.FormattedValue": "No",
    osp_proyecto: false,
    osp_descripcion: "Inventario movil",
    osp_link:
      "https://ggccorange.sharepoint.com/Dynamics/opportunity/OPP-0078401 - proyecto covergente/CAS-162968-C0J5C2/020925 the red kiwi la cukosa badajoz y alcala de guadaira Inventario.xlsx",
    "osp_categoria@OData.Community.Display.V1.FormattedValue": "Centrex",
    osp_categoria: 8,
    _modifiedby: "GONZALEZ DIEZ, MIRIAM",
    "_modifiedby_value@Microsoft.Dynamics.CRM.lookuplogicalname": "systemuser",
    _modifiedby_value: "6f5078c2-a430-eb11-80fa-0050568345f9",
  },
  {
    "@odata.etag": 'W/"3183295790"',
    "modifiedon@OData.Community.Display.V1.FormattedValue": "08/09/2025 12:15",
    modifiedon: "2025-09-08T10:15:11Z",
    osp_subcategoria: null,
    osp_documentacionid: "86e793b0-9c8c-f011-b4cc-6045bd9cd8c6",
    "osp_validadocontratacion@OData.Community.Display.V1.FormattedValue": "No",
    osp_validadocontratacion: false,
    "createdon@OData.Community.Display.V1.FormattedValue": "08/09/2025 12:15",
    createdon: "2025-09-08T10:15:11Z",
    osp_nombre:
      "020925 the red kiwi la cukosa badajoz y alcala de guadaira Plantilla_Provision_Digital_Centrex.xlsx",
    _ownerid: "GONZALEZ DIEZ, MIRIAM",
    "_ownerid_value@Microsoft.Dynamics.CRM.associatednavigationproperty":
      "ownerid",
    "_ownerid_value@Microsoft.Dynamics.CRM.lookuplogicalname": "systemuser",
    _ownerid_value: "6f5078c2-a430-eb11-80fa-0050568345f9",
    "osp_validadoordering@OData.Community.Display.V1.FormattedValue": "No",
    osp_validadoordering: false,
    osp_registro: "CAS-162968-C0J5C2",
    "_osp_oportunidad_value@OData.Community.Display.V1.FormattedValue":
      "OPP-0078401 - proyecto covergente",
    "_osp_oportunidad_value@Microsoft.Dynamics.CRM.associatednavigationproperty":
      "osp_oportunidad",
    "_osp_oportunidad_value@Microsoft.Dynamics.CRM.lookuplogicalname":
      "opportunity",
    _osp_oportunidad_value: "53fac40b-c952-4c3c-a12a-778df2689633",
    "osp_tipificacion@OData.Community.Display.V1.FormattedValue":
      "Documentacion de proyecto y provisi\u00f3n",
    osp_tipificacion: 863920012,
    "osp_proyecto@OData.Community.Display.V1.FormattedValue": "No",
    osp_proyecto: false,
    osp_descripcion: "Plantilla CENTREX",
    osp_link:
      "https://ggccorange.sharepoint.com/Dynamics/opportunity/OPP-0078401 - proyecto covergente/CAS-162968-C0J5C2/020925 the red kiwi la cukosa badajoz y alcala de guadaira Plantilla_Provision_Digital_Centrex.xlsx",
    "osp_categoria@OData.Community.Display.V1.FormattedValue": "Centrex",
    osp_categoria: 8,
    _modifiedby: "GONZALEZ DIEZ, MIRIAM",
    "_modifiedby_value@Microsoft.Dynamics.CRM.lookuplogicalname": "systemuser",
    _modifiedby_value: "6f5078c2-a430-eb11-80fa-0050568345f9",
  },
  {
    "@odata.etag": 'W/"2962834202"',
    "modifiedon@OData.Community.Display.V1.FormattedValue": "11/06/2025 12:13",
    modifiedon: "2025-06-11T10:13:40Z",
    osp_subcategoria: null,
    osp_documentacionid: "69dfbfdf-a946-f011-877a-6045bd9cdbc4",
    "osp_validadocontratacion@OData.Community.Display.V1.FormattedValue": "No",
    osp_validadocontratacion: false,
    "createdon@OData.Community.Display.V1.FormattedValue": "11/06/2025 11:53",
    createdon: "2025-06-11T09:53:09Z",
    osp_nombre:
      "THE RED KIWI valencia, valencia y salamanca 5 ips Plantilla_Provision_Digital_Centrex.xlsx",
    _ownerid: "LAGO RUIZ, JOSE",
    "_ownerid_value@Microsoft.Dynamics.CRM.associatednavigationproperty":
      "ownerid",
    "_ownerid_value@Microsoft.Dynamics.CRM.lookuplogicalname": "systemuser",
    _ownerid_value: "039f6c0f-aaba-ee11-a569-6045bd905b10",
    "osp_validadoordering@OData.Community.Display.V1.FormattedValue": "No",
    osp_validadoordering: false,
    osp_registro:
      "CAS-156590-G3K1H8 - Plantilla CENTREX Salamanca, Valencia_Jesus y Valencia_Ramon y Cajal",
    "_osp_oportunidad_value@OData.Community.Display.V1.FormattedValue":
      "OPP-0078401 - proyecto covergente",
    "_osp_oportunidad_value@Microsoft.Dynamics.CRM.associatednavigationproperty":
      "osp_oportunidad",
    "_osp_oportunidad_value@Microsoft.Dynamics.CRM.lookuplogicalname":
      "opportunity",
    _osp_oportunidad_value: "53fac40b-c952-4c3c-a12a-778df2689633",
    "osp_tipificacion@OData.Community.Display.V1.FormattedValue":
      "Documentacion de proyecto y provisi\u00f3n",
    osp_tipificacion: 863920012,
    "osp_proyecto@OData.Community.Display.V1.FormattedValue": "No",
    osp_proyecto: false,
    osp_descripcion: null,
    osp_link:
      "https://ggccorange.sharepoint.com/Dynamics/opportunity/OPP-0078401 - proyecto covergente/CAS-156590-G3K1H8 - Plantilla CENTREX Salamanca, Valencia_Jesus y Valencia_Ramon y Cajal/THE RED KIWI valencia, valencia y salamanca 5 ips Plantilla_Provision_Digital_Centrex.xlsx",
    osp_categoria: null,
    _modifiedby: "LAGO RUIZ, JOSE",
    "_modifiedby_value@Microsoft.Dynamics.CRM.lookuplogicalname": "systemuser",
    _modifiedby_value: "039f6c0f-aaba-ee11-a569-6045bd905b10",
  },
  {
    "@odata.etag": 'W/"2870965681"',
    "modifiedon@OData.Community.Display.V1.FormattedValue": "06/05/2025 9:29",
    modifiedon: "2025-05-06T07:29:44Z",
    osp_subcategoria: null,
    osp_documentacionid: "ad7d1edb-4b2a-f011-8c4e-6045bd9cdbc4",
    "osp_validadocontratacion@OData.Community.Display.V1.FormattedValue": "No",
    osp_validadocontratacion: false,
    "createdon@OData.Community.Display.V1.FormattedValue": "06/05/2025 9:29",
    createdon: "2025-05-06T07:29:44Z",
    osp_nombre: "Licencias Dorsia.msg",
    _ownerid: "GONZALEZ DIEZ, MIRIAM",
    "_ownerid_value@Microsoft.Dynamics.CRM.associatednavigationproperty":
      "ownerid",
    "_ownerid_value@Microsoft.Dynamics.CRM.lookuplogicalname": "systemuser",
    _ownerid_value: "6f5078c2-a430-eb11-80fa-0050568345f9",
    "osp_validadoordering@OData.Community.Display.V1.FormattedValue": "No",
    osp_validadoordering: false,
    osp_registro:
      "CAS-152478-W6Q9W8 - CAS-124742-G6W5D2 - Ajuste facturacion licencias",
    "_osp_oportunidad_value@OData.Community.Display.V1.FormattedValue":
      "OPP-0078401 - proyecto covergente",
    "_osp_oportunidad_value@Microsoft.Dynamics.CRM.associatednavigationproperty":
      "osp_oportunidad",
    "_osp_oportunidad_value@Microsoft.Dynamics.CRM.lookuplogicalname":
      "opportunity",
    _osp_oportunidad_value: "53fac40b-c952-4c3c-a12a-778df2689633",
    "osp_tipificacion@OData.Community.Display.V1.FormattedValue":
      "Autorizaciones Internas",
    osp_tipificacion: 863920008,
    "osp_proyecto@OData.Community.Display.V1.FormattedValue": "No",
    osp_proyecto: false,
    osp_descripcion: "Requisitos",
    osp_link:
      "https://ggccorange.sharepoint.com/Dynamics/opportunity/OPP-0078401 - proyecto covergente/CAS-152478-W6Q9W8 - CAS-124742-G6W5D2 - Ajuste facturacion licencias/Licencias Dorsia.msg",
    "osp_categoria@OData.Community.Display.V1.FormattedValue":
      "Autorizaciones internas KAM",
    osp_categoria: 6,
    _modifiedby: "GONZALEZ DIEZ, MIRIAM",
    "_modifiedby_value@Microsoft.Dynamics.CRM.lookuplogicalname": "systemuser",
    _modifiedby_value: "6f5078c2-a430-eb11-80fa-0050568345f9",
  },
  {
    "@odata.etag": 'W/"2871107339"',
    "modifiedon@OData.Community.Display.V1.FormattedValue": "06/05/2025 10:21",
    modifiedon: "2025-05-06T08:21:16Z",
    osp_subcategoria: null,
    osp_documentacionid: "2636c411-532a-f011-8c4e-6045bd9cdbc4",
    "osp_validadocontratacion@OData.Community.Display.V1.FormattedValue": "No",
    osp_validadocontratacion: false,
    "createdon@OData.Community.Display.V1.FormattedValue": "06/05/2025 10:21",
    createdon: "2025-05-06T08:21:16Z",
    osp_nombre: "552025 Nuevo pedido portatiles 05052025.msg",
    _ownerid: "GONZALEZ DIEZ, MIRIAM",
    "_ownerid_value@Microsoft.Dynamics.CRM.associatednavigationproperty":
      "ownerid",
    "_ownerid_value@Microsoft.Dynamics.CRM.lookuplogicalname": "systemuser",
    _ownerid_value: "6f5078c2-a430-eb11-80fa-0050568345f9",
    "osp_validadoordering@OData.Community.Display.V1.FormattedValue": "No",
    osp_validadoordering: false,
    osp_registro:
      "CAS-152496-B5N1V2 - CAS-124742-G6W5D2 - Pedido portatiles 05-05-2025",
    "_osp_oportunidad_value@OData.Community.Display.V1.FormattedValue":
      "OPP-0078401 - proyecto covergente",
    "_osp_oportunidad_value@Microsoft.Dynamics.CRM.associatednavigationproperty":
      "osp_oportunidad",
    "_osp_oportunidad_value@Microsoft.Dynamics.CRM.lookuplogicalname":
      "opportunity",
    _osp_oportunidad_value: "53fac40b-c952-4c3c-a12a-778df2689633",
    "osp_tipificacion@OData.Community.Display.V1.FormattedValue":
      "Requisitos Clientes",
    osp_tipificacion: 863920000,
    "osp_proyecto@OData.Community.Display.V1.FormattedValue": "No",
    osp_proyecto: false,
    osp_descripcion: "Requisitos pedido",
    osp_link:
      "https://ggccorange.sharepoint.com/Dynamics/opportunity/OPP-0078401 - proyecto covergente/CAS-152496-B5N1V2 - CAS-124742-G6W5D2 - Pedido portatiles 05-05-2025/552025 Nuevo pedido portatiles 05052025.msg",
    "osp_categoria@OData.Community.Display.V1.FormattedValue":
      "Inventario de requisitos",
    osp_categoria: 18,
    _modifiedby: "GONZALEZ DIEZ, MIRIAM",
    "_modifiedby_value@Microsoft.Dynamics.CRM.lookuplogicalname": "systemuser",
    _modifiedby_value: "6f5078c2-a430-eb11-80fa-0050568345f9",
  },
  {
    "@odata.etag": 'W/"2888489792"',
    "modifiedon@OData.Community.Display.V1.FormattedValue": "13/05/2025 15:08",
    modifiedon: "2025-05-13T13:08:55Z",
    osp_subcategoria: null,
    osp_documentacionid: "41ab276a-fb2f-f011-8c4e-6045bd9cdbc4",
    "osp_validadocontratacion@OData.Community.Display.V1.FormattedValue": "No",
    osp_validadocontratacion: false,
    "createdon@OData.Community.Display.V1.FormattedValue": "13/05/2025 15:08",
    createdon: "2025-05-13T13:08:55Z",
    osp_nombre: "RV Dorsia - Seguimiento diario - Calle Alcal\u00e1.msg",
    _ownerid: "GONZALEZ DIEZ, MIRIAM",
    "_ownerid_value@Microsoft.Dynamics.CRM.associatednavigationproperty":
      "ownerid",
    "_ownerid_value@Microsoft.Dynamics.CRM.lookuplogicalname": "systemuser",
    _ownerid_value: "6f5078c2-a430-eb11-80fa-0050568345f9",
    "osp_validadoordering@OData.Community.Display.V1.FormattedValue": "No",
    osp_validadoordering: false,
    osp_registro:
      "CAS-153284-R4S9L2 - CAS-124742-G6W5D2 - Segunda visita Madrid-Alcal\u00e1",
    "_osp_oportunidad_value@OData.Community.Display.V1.FormattedValue":
      "OPP-0078401 - proyecto covergente",
    "_osp_oportunidad_value@Microsoft.Dynamics.CRM.associatednavigationproperty":
      "osp_oportunidad",
    "_osp_oportunidad_value@Microsoft.Dynamics.CRM.lookuplogicalname":
      "opportunity",
    _osp_oportunidad_value: "53fac40b-c952-4c3c-a12a-778df2689633",
    "osp_tipificacion@OData.Community.Display.V1.FormattedValue":
      "Autorizaciones Internas",
    osp_tipificacion: 863920008,
    "osp_proyecto@OData.Community.Display.V1.FormattedValue": "No",
    osp_proyecto: false,
    osp_descripcion: "Autorizaci\u00f3n interna",
    osp_link:
      "https://ggccorange.sharepoint.com/Dynamics/opportunity/OPP-0078401 - proyecto covergente/CAS-153284-R4S9L2 - CAS-124742-G6W5D2 - Segunda visita Madrid-Alcal\u00e1/RV Dorsia - Seguimiento diario - Calle Alcal\u00e1.msg",
    "osp_categoria@OData.Community.Display.V1.FormattedValue":
      "Autorizaciones internas KAM",
    osp_categoria: 6,
    _modifiedby: "GONZALEZ DIEZ, MIRIAM",
    "_modifiedby_value@Microsoft.Dynamics.CRM.lookuplogicalname": "systemuser",
    _modifiedby_value: "6f5078c2-a430-eb11-80fa-0050568345f9",
  },
  {
    "@odata.etag": 'W/"2644825046"',
    "modifiedon@OData.Community.Display.V1.FormattedValue": "05/02/2025 14:16",
    modifiedon: "2025-02-05T13:16:29Z",
    osp_subcategoria: null,
    osp_documentacionid: "6ea00867-c3e3-ef11-a731-6045bd9cdbc4",
    "osp_validadocontratacion@OData.Community.Display.V1.FormattedValue": "No",
    osp_validadocontratacion: false,
    "createdon@OData.Community.Display.V1.FormattedValue": "05/02/2025 14:16",
    createdon: "2025-02-05T13:16:29Z",
    osp_nombre: "Oferta Comstor.xls",
    _ownerid: "CRM, Admin",
    "_ownerid_value@Microsoft.Dynamics.CRM.associatednavigationproperty":
      "ownerid",
    "_ownerid_value@Microsoft.Dynamics.CRM.lookuplogicalname": "systemuser",
    _ownerid_value: "ac79a518-0950-e611-80c1-005056a03d45",
    "osp_validadoordering@OData.Community.Display.V1.FormattedValue": "No",
    osp_validadoordering: false,
    osp_registro: "OPP-0078401 - WAOC-0052691 - Proyecto convergente",
    "_osp_oportunidad_value@OData.Community.Display.V1.FormattedValue":
      "OPP-0078401 - proyecto covergente",
    "_osp_oportunidad_value@Microsoft.Dynamics.CRM.associatednavigationproperty":
      "osp_oportunidad",
    "_osp_oportunidad_value@Microsoft.Dynamics.CRM.lookuplogicalname":
      "opportunity",
    _osp_oportunidad_value: "53fac40b-c952-4c3c-a12a-778df2689633",
    "osp_tipificacion@OData.Community.Display.V1.FormattedValue": "PdN",
    osp_tipificacion: 863920001,
    "osp_proyecto@OData.Community.Display.V1.FormattedValue": "No",
    osp_proyecto: false,
    osp_descripcion: null,
    osp_link:
      "https://ggccorange.sharepoint.com/Dynamics/elob_validation/OPP-0078401 - WAOC-0052691 - Proyecto convergente/Oferta%20Comstor.xls",
    osp_categoria: null,
    _modifiedby: "CRM, Admin",
    "_modifiedby_value@Microsoft.Dynamics.CRM.lookuplogicalname": "systemuser",
    _modifiedby_value: "ac79a518-0950-e611-80c1-005056a03d45",
  },
  {
    "@odata.etag": 'W/"3164833811"',
    "modifiedon@OData.Community.Display.V1.FormattedValue": "02/09/2025 8:56",
    modifiedon: "2025-09-02T06:56:17Z",
    osp_subcategoria: null,
    osp_documentacionid: "92fb2ce9-c987-f011-b4cc-6045bd9cdbc4",
    "osp_validadocontratacion@OData.Community.Display.V1.FormattedValue": "No",
    osp_validadocontratacion: false,
    "createdon@OData.Community.Display.V1.FormattedValue": "02/09/2025 8:56",
    createdon: "2025-09-02T06:56:17Z",
    osp_nombre: "Pedido Portatiles 21082025.msg",
    _ownerid: "GONZALEZ DIEZ, MIRIAM",
    "_ownerid_value@Microsoft.Dynamics.CRM.associatednavigationproperty":
      "ownerid",
    "_ownerid_value@Microsoft.Dynamics.CRM.lookuplogicalname": "systemuser",
    _ownerid_value: "6f5078c2-a430-eb11-80fa-0050568345f9",
    "osp_validadoordering@OData.Community.Display.V1.FormattedValue": "No",
    osp_validadoordering: false,
    osp_registro: "CAS-162479-Z8W0Z0",
    "_osp_oportunidad_value@OData.Community.Display.V1.FormattedValue":
      "OPP-0078401 - proyecto covergente",
    "_osp_oportunidad_value@Microsoft.Dynamics.CRM.associatednavigationproperty":
      "osp_oportunidad",
    "_osp_oportunidad_value@Microsoft.Dynamics.CRM.lookuplogicalname":
      "opportunity",
    _osp_oportunidad_value: "53fac40b-c952-4c3c-a12a-778df2689633",
    "osp_tipificacion@OData.Community.Display.V1.FormattedValue":
      "Requisitos Clientes",
    osp_tipificacion: 863920000,
    "osp_proyecto@OData.Community.Display.V1.FormattedValue": "No",
    osp_proyecto: false,
    osp_descripcion: "Pedido KAM",
    osp_link:
      "https://ggccorange.sharepoint.com/Dynamics/opportunity/OPP-0078401 - proyecto covergente/CAS-162479-Z8W0Z0/Pedido Portatiles 21082025.msg",
    "osp_categoria@OData.Community.Display.V1.FormattedValue": "Otros",
    osp_categoria: 24,
    _modifiedby: "GONZALEZ DIEZ, MIRIAM",
    "_modifiedby_value@Microsoft.Dynamics.CRM.lookuplogicalname": "systemuser",
    _modifiedby_value: "6f5078c2-a430-eb11-80fa-0050568345f9",
  },
  {
    "@odata.etag": 'W/"3165094666"',
    "modifiedon@OData.Community.Display.V1.FormattedValue": "02/09/2025 10:40",
    modifiedon: "2025-09-02T08:40:24Z",
    osp_subcategoria: null,
    osp_documentacionid: "312f5a72-d887-f011-b4cc-6045bd9cdbc4",
    "osp_validadocontratacion@OData.Community.Display.V1.FormattedValue": "No",
    osp_validadocontratacion: false,
    "createdon@OData.Community.Display.V1.FormattedValue": "02/09/2025 10:40",
    createdon: "2025-09-02T08:40:24Z",
    osp_nombre: "DORSIA.msg",
    _ownerid: "GONZALEZ DIEZ, MIRIAM",
    "_ownerid_value@Microsoft.Dynamics.CRM.associatednavigationproperty":
      "ownerid",
    "_ownerid_value@Microsoft.Dynamics.CRM.lookuplogicalname": "systemuser",
    _ownerid_value: "6f5078c2-a430-eb11-80fa-0050568345f9",
    "osp_validadoordering@OData.Community.Display.V1.FormattedValue": "No",
    osp_validadoordering: false,
    osp_registro: "CAS-162499-W0V5W4",
    "_osp_oportunidad_value@OData.Community.Display.V1.FormattedValue":
      "OPP-0078401 - proyecto covergente",
    "_osp_oportunidad_value@Microsoft.Dynamics.CRM.associatednavigationproperty":
      "osp_oportunidad",
    "_osp_oportunidad_value@Microsoft.Dynamics.CRM.lookuplogicalname":
      "opportunity",
    _osp_oportunidad_value: "53fac40b-c952-4c3c-a12a-778df2689633",
    "osp_tipificacion@OData.Community.Display.V1.FormattedValue":
      "Requisitos Clientes",
    osp_tipificacion: 863920000,
    "osp_proyecto@OData.Community.Display.V1.FormattedValue": "No",
    osp_proyecto: false,
    osp_descripcion: "Requisitos plantilla",
    osp_link:
      "https://ggccorange.sharepoint.com/Dynamics/opportunity/OPP-0078401 - proyecto covergente/CAS-162499-W0V5W4/DORSIA.msg",
    "osp_categoria@OData.Community.Display.V1.FormattedValue":
      "Inventario de requisitos",
    osp_categoria: 18,
    _modifiedby: "GONZALEZ DIEZ, MIRIAM",
    "_modifiedby_value@Microsoft.Dynamics.CRM.lookuplogicalname": "systemuser",
    _modifiedby_value: "6f5078c2-a430-eb11-80fa-0050568345f9",
  },
  {
    "@odata.etag": 'W/"3165370615"',
    "modifiedon@OData.Community.Display.V1.FormattedValue": "02/09/2025 12:11",
    modifiedon: "2025-09-02T10:11:15Z",
    osp_subcategoria: null,
    osp_documentacionid: "76a82e24-e587-f011-b4cc-6045bd9cdbc4",
    "osp_validadocontratacion@OData.Community.Display.V1.FormattedValue": "No",
    osp_validadocontratacion: false,
    "createdon@OData.Community.Display.V1.FormattedValue": "02/09/2025 12:11",
    createdon: "2025-09-02T10:11:15Z",
    osp_nombre:
      "020925 the red kiwi la cukosa badajoz y alcala de guadaira Inventario.xlsx",
    _ownerid: "GONZALEZ DIEZ, MIRIAM",
    "_ownerid_value@Microsoft.Dynamics.CRM.associatednavigationproperty":
      "ownerid",
    "_ownerid_value@Microsoft.Dynamics.CRM.lookuplogicalname": "systemuser",
    _ownerid_value: "6f5078c2-a430-eb11-80fa-0050568345f9",
    "osp_validadoordering@OData.Community.Display.V1.FormattedValue": "No",
    osp_validadoordering: false,
    osp_registro: "CAS-162526-L8C3M5",
    "_osp_oportunidad_value@OData.Community.Display.V1.FormattedValue":
      "OPP-0078401 - proyecto covergente",
    "_osp_oportunidad_value@Microsoft.Dynamics.CRM.associatednavigationproperty":
      "osp_oportunidad",
    "_osp_oportunidad_value@Microsoft.Dynamics.CRM.lookuplogicalname":
      "opportunity",
    _osp_oportunidad_value: "53fac40b-c952-4c3c-a12a-778df2689633",
    "osp_tipificacion@OData.Community.Display.V1.FormattedValue":
      "Documentacion de proyecto y provisi\u00f3n",
    osp_tipificacion: 863920012,
    "osp_proyecto@OData.Community.Display.V1.FormattedValue": "No",
    osp_proyecto: false,
    osp_descripcion: "Inventario CENTREX",
    osp_link:
      "https://ggccorange.sharepoint.com/Dynamics/opportunity/OPP-0078401 - proyecto covergente/CAS-162526-L8C3M5/020925 the red kiwi la cukosa badajoz y alcala de guadaira Inventario.xlsx",
    "osp_categoria@OData.Community.Display.V1.FormattedValue": "Centrex",
    osp_categoria: 8,
    _modifiedby: "GONZALEZ DIEZ, MIRIAM",
    "_modifiedby_value@Microsoft.Dynamics.CRM.lookuplogicalname": "systemuser",
    _modifiedby_value: "6f5078c2-a430-eb11-80fa-0050568345f9",
  },
  {
    "@odata.etag": 'W/"3165372062"',
    "modifiedon@OData.Community.Display.V1.FormattedValue": "02/09/2025 12:11",
    modifiedon: "2025-09-02T10:11:46Z",
    osp_subcategoria: null,
    osp_documentacionid: "59116436-e587-f011-b4cc-6045bd9cdbc4",
    "osp_validadocontratacion@OData.Community.Display.V1.FormattedValue": "No",
    osp_validadocontratacion: false,
    "createdon@OData.Community.Display.V1.FormattedValue": "02/09/2025 12:11",
    createdon: "2025-09-02T10:11:46Z",
    osp_nombre:
      "020925 the red kiwi la cukosa badajoz y alcala de guadaira Plantilla_Provision_Digital_Centrex.xlsx",
    _ownerid: "GONZALEZ DIEZ, MIRIAM",
    "_ownerid_value@Microsoft.Dynamics.CRM.associatednavigationproperty":
      "ownerid",
    "_ownerid_value@Microsoft.Dynamics.CRM.lookuplogicalname": "systemuser",
    _ownerid_value: "6f5078c2-a430-eb11-80fa-0050568345f9",
    "osp_validadoordering@OData.Community.Display.V1.FormattedValue": "No",
    osp_validadoordering: false,
    osp_registro: "CAS-162526-L8C3M5",
    "_osp_oportunidad_value@OData.Community.Display.V1.FormattedValue":
      "OPP-0078401 - proyecto covergente",
    "_osp_oportunidad_value@Microsoft.Dynamics.CRM.associatednavigationproperty":
      "osp_oportunidad",
    "_osp_oportunidad_value@Microsoft.Dynamics.CRM.lookuplogicalname":
      "opportunity",
    _osp_oportunidad_value: "53fac40b-c952-4c3c-a12a-778df2689633",
    "osp_tipificacion@OData.Community.Display.V1.FormattedValue":
      "Documentacion de proyecto y provisi\u00f3n",
    osp_tipificacion: 863920012,
    "osp_proyecto@OData.Community.Display.V1.FormattedValue": "No",
    osp_proyecto: false,
    osp_descripcion: "Plantilla CENTREX",
    osp_link:
      "https://ggccorange.sharepoint.com/Dynamics/opportunity/OPP-0078401 - proyecto covergente/CAS-162526-L8C3M5/020925 the red kiwi la cukosa badajoz y alcala de guadaira Plantilla_Provision_Digital_Centrex.xlsx",
    "osp_categoria@OData.Community.Display.V1.FormattedValue": "Centrex",
    osp_categoria: 8,
    _modifiedby: "GONZALEZ DIEZ, MIRIAM",
    "_modifiedby_value@Microsoft.Dynamics.CRM.lookuplogicalname": "systemuser",
    _modifiedby_value: "6f5078c2-a430-eb11-80fa-0050568345f9",
  },
  {
    "@odata.etag": 'W/"2752089768"',
    "modifiedon@OData.Community.Display.V1.FormattedValue": "20/03/2025 16:33",
    modifiedon: "2025-03-20T15:33:46Z",
    osp_subcategoria: null,
    osp_documentacionid: "e67636b8-2ef4-ef11-be20-6045bd9cdbc4",
    "osp_validadocontratacion@OData.Community.Display.V1.FormattedValue": "No",
    osp_validadocontratacion: false,
    "createdon@OData.Community.Display.V1.FormattedValue": "26/02/2025 11:45",
    createdon: "2025-02-26T10:45:00Z",
    osp_nombre: "RV_ Licencias Microsoft 365 F3.msg",
    _ownerid: "ORTEGA MOCHON, ANA",
    "_ownerid_value@Microsoft.Dynamics.CRM.associatednavigationproperty":
      "ownerid",
    "_ownerid_value@Microsoft.Dynamics.CRM.lookuplogicalname": "systemuser",
    _ownerid_value: "370d2a1e-9ca5-e611-80c7-005056b95048",
    "osp_validadoordering@OData.Community.Display.V1.FormattedValue": "No",
    osp_validadoordering: false,
    osp_registro: "CAS-146067-S5Y7Z4 - cambio de facturacion licencia",
    "_osp_oportunidad_value@OData.Community.Display.V1.FormattedValue":
      "OPP-0078401 - proyecto covergente",
    "_osp_oportunidad_value@Microsoft.Dynamics.CRM.associatednavigationproperty":
      "osp_oportunidad",
    "_osp_oportunidad_value@Microsoft.Dynamics.CRM.lookuplogicalname":
      "opportunity",
    _osp_oportunidad_value: "53fac40b-c952-4c3c-a12a-778df2689633",
    "osp_tipificacion@OData.Community.Display.V1.FormattedValue":
      "Anexos y envios de cliente",
    osp_tipificacion: 863920004,
    "osp_proyecto@OData.Community.Display.V1.FormattedValue": "No",
    osp_proyecto: false,
    osp_descripcion: "peticion autorizado",
    osp_link:
      "https://ggccorange.sharepoint.com/Dynamics/opportunity/OPP-0078401 - proyecto covergente/CAS-146067-S5Y7Z4 - cambio de facturacion licencia/RV_ Licencias Microsoft 365 F3.msg",
    "osp_categoria@OData.Community.Display.V1.FormattedValue":
      "Autorizaciones cliente",
    osp_categoria: 4,
    _modifiedby: "CRM, Admin",
    "_modifiedby_value@Microsoft.Dynamics.CRM.lookuplogicalname": "systemuser",
    _modifiedby_value: "ac79a518-0950-e611-80c1-005056a03d45",
  },
  {
    "@odata.etag": 'W/"2872047486"',
    "modifiedon@OData.Community.Display.V1.FormattedValue": "06/05/2025 15:58",
    modifiedon: "2025-05-06T13:58:24Z",
    osp_subcategoria: null,
    osp_documentacionid: "74235a27-822a-f011-8c4d-6045bd9f3071",
    "osp_validadocontratacion@OData.Community.Display.V1.FormattedValue": "No",
    osp_validadocontratacion: false,
    "createdon@OData.Community.Display.V1.FormattedValue": "06/05/2025 15:58",
    createdon: "2025-05-06T13:58:24Z",
    osp_nombre: "Re Apertura nueva cl\u00ednica Huelva  INTERNO.msg",
    _ownerid: "GONZALEZ DIEZ, MIRIAM",
    "_ownerid_value@Microsoft.Dynamics.CRM.associatednavigationproperty":
      "ownerid",
    "_ownerid_value@Microsoft.Dynamics.CRM.lookuplogicalname": "systemuser",
    _ownerid_value: "6f5078c2-a430-eb11-80fa-0050568345f9",
    "osp_validadoordering@OData.Community.Display.V1.FormattedValue": "No",
    osp_validadoordering: false,
    osp_registro:
      "CAS-152592-M3Y0Z3 - CAS-124742-G6W5D2 - Segunda visita Huelva",
    "_osp_oportunidad_value@OData.Community.Display.V1.FormattedValue":
      "OPP-0078401 - proyecto covergente",
    "_osp_oportunidad_value@Microsoft.Dynamics.CRM.associatednavigationproperty":
      "osp_oportunidad",
    "_osp_oportunidad_value@Microsoft.Dynamics.CRM.lookuplogicalname":
      "opportunity",
    _osp_oportunidad_value: "53fac40b-c952-4c3c-a12a-778df2689633",
    "osp_tipificacion@OData.Community.Display.V1.FormattedValue":
      "Autorizaciones Internas",
    osp_tipificacion: 863920008,
    "osp_proyecto@OData.Community.Display.V1.FormattedValue": "No",
    osp_proyecto: false,
    osp_descripcion: "Autorizacion ",
    osp_link:
      "https://ggccorange.sharepoint.com/Dynamics/opportunity/OPP-0078401 - proyecto covergente/CAS-152592-M3Y0Z3 - CAS-124742-G6W5D2 - Segunda visita Huelva/Re Apertura nueva cl\u00ednica Huelva  INTERNO.msg",
    "osp_categoria@OData.Community.Display.V1.FormattedValue":
      "Autorizaciones internas KAM",
    osp_categoria: 6,
    _modifiedby: "GONZALEZ DIEZ, MIRIAM",
    "_modifiedby_value@Microsoft.Dynamics.CRM.lookuplogicalname": "systemuser",
    _modifiedby_value: "6f5078c2-a430-eb11-80fa-0050568345f9",
  },
  {
    "@odata.etag": 'W/"2890821308"',
    "modifiedon@OData.Community.Display.V1.FormattedValue": "14/05/2025 15:19",
    modifiedon: "2025-05-14T13:19:06Z",
    osp_subcategoria: null,
    osp_documentacionid: "cf9a3a01-c630-f011-8c4d-6045bd9f3071",
    "osp_validadocontratacion@OData.Community.Display.V1.FormattedValue": "No",
    osp_validadocontratacion: false,
    "createdon@OData.Community.Display.V1.FormattedValue": "14/05/2025 15:19",
    createdon: "2025-05-14T13:19:06Z",
    osp_nombre:
      "THE RED KIWI valladolid, oviedo, lerida 5 ips Plantilla_Provision_Digital_Centrex.xlsx",
    _ownerid: "GONZALEZ DIEZ, MIRIAM",
    "_ownerid_value@Microsoft.Dynamics.CRM.associatednavigationproperty":
      "ownerid",
    "_ownerid_value@Microsoft.Dynamics.CRM.lookuplogicalname": "systemuser",
    _ownerid_value: "6f5078c2-a430-eb11-80fa-0050568345f9",
    "osp_validadoordering@OData.Community.Display.V1.FormattedValue": "No",
    osp_validadoordering: false,
    osp_registro:
      "CAS-153449-S9Z9C9 - CAS-124742-G6W5D2 - CENTREX Oviedo, Lerida y Valladolid-",
    "_osp_oportunidad_value@OData.Community.Display.V1.FormattedValue":
      "OPP-0078401 - proyecto covergente",
    "_osp_oportunidad_value@Microsoft.Dynamics.CRM.associatednavigationproperty":
      "osp_oportunidad",
    "_osp_oportunidad_value@Microsoft.Dynamics.CRM.lookuplogicalname":
      "opportunity",
    _osp_oportunidad_value: "53fac40b-c952-4c3c-a12a-778df2689633",
    "osp_tipificacion@OData.Community.Display.V1.FormattedValue":
      "Documentacion de proyecto y provisi\u00f3n",
    osp_tipificacion: 863920012,
    "osp_proyecto@OData.Community.Display.V1.FormattedValue": "No",
    osp_proyecto: false,
    osp_descripcion: "Plantilla CENTREX",
    osp_link:
      "https://ggccorange.sharepoint.com/Dynamics/opportunity/OPP-0078401 - proyecto covergente/CAS-153449-S9Z9C9 - CAS-124742-G6W5D2 - CENTREX Oviedo, Lerida y Valladolid-/THE RED KIWI valladolid, oviedo, lerida 5 ips Plantilla_Provision_Digital_Centrex.xlsx",
    "osp_categoria@OData.Community.Display.V1.FormattedValue": "Centrex",
    osp_categoria: 8,
    _modifiedby: "GONZALEZ DIEZ, MIRIAM",
    "_modifiedby_value@Microsoft.Dynamics.CRM.lookuplogicalname": "systemuser",
    _modifiedby_value: "6f5078c2-a430-eb11-80fa-0050568345f9",
  },
  {
    "@odata.etag": 'W/"2752094301"',
    "modifiedon@OData.Community.Display.V1.FormattedValue": "20/03/2025 16:36",
    modifiedon: "2025-03-20T15:36:24Z",
    osp_subcategoria: null,
    osp_documentacionid: "e7f0a202-b8fd-ef11-bae3-6045bd9f3071",
    "osp_validadocontratacion@OData.Community.Display.V1.FormattedValue": "No",
    osp_validadocontratacion: false,
    "createdon@OData.Community.Display.V1.FormattedValue": "10/03/2025 15:00",
    createdon: "2025-03-10T14:00:29Z",
    osp_nombre: "ELENAS financiera.xlsx",
    _ownerid: "GONZALEZ DIEZ, MIRIAM",
    "_ownerid_value@Microsoft.Dynamics.CRM.associatednavigationproperty":
      "ownerid",
    "_ownerid_value@Microsoft.Dynamics.CRM.lookuplogicalname": "systemuser",
    _ownerid_value: "6f5078c2-a430-eb11-80fa-0050568345f9",
    "osp_validadoordering@OData.Community.Display.V1.FormattedValue": "No",
    osp_validadoordering: false,
    osp_registro:
      "CAS-147457-M9F6Q6 - CAS-124742-G6W5D2 - Financiacion equipos Orange 18 sedes",
    "_osp_oportunidad_value@OData.Community.Display.V1.FormattedValue":
      "OPP-0078401 - proyecto covergente",
    "_osp_oportunidad_value@Microsoft.Dynamics.CRM.associatednavigationproperty":
      "osp_oportunidad",
    "_osp_oportunidad_value@Microsoft.Dynamics.CRM.lookuplogicalname":
      "opportunity",
    _osp_oportunidad_value: "53fac40b-c952-4c3c-a12a-778df2689633",
    "osp_tipificacion@OData.Community.Display.V1.FormattedValue":
      "Documentacion de proyecto y provisi\u00f3n",
    osp_tipificacion: 863920012,
    "osp_proyecto@OData.Community.Display.V1.FormattedValue": "No",
    osp_proyecto: false,
    osp_descripcion: "fichero sedes",
    osp_link:
      "https://ggccorange.sharepoint.com/Dynamics/opportunity/OPP-0078401 - proyecto covergente/CAS-147457-M9F6Q6 - CAS-124742-G6W5D2 - Financiacion equipos Orange 18 sedes/ELENAS financiera.xlsx",
    "osp_categoria@OData.Community.Display.V1.FormattedValue":
      "lantilla Datos administrativos",
    osp_categoria: 19,
    _modifiedby: "CRM, Admin",
    "_modifiedby_value@Microsoft.Dynamics.CRM.lookuplogicalname": "systemuser",
    _modifiedby_value: "ac79a518-0950-e611-80c1-005056a03d45",
  },
  {
    "@odata.etag": 'W/"2780708426"',
    "modifiedon@OData.Community.Display.V1.FormattedValue": "27/03/2025 12:31",
    modifiedon: "2025-03-27T11:31:49Z",
    osp_subcategoria: null,
    osp_documentacionid: "54726510-ff0a-f011-bae3-6045bd9f3071",
    "osp_validadocontratacion@OData.Community.Display.V1.FormattedValue": "No",
    osp_validadocontratacion: false,
    "createdon@OData.Community.Display.V1.FormattedValue": "27/03/2025 12:31",
    createdon: "2025-03-27T11:31:49Z",
    osp_nombre: "ELENAS financiera.xlsx",
    _ownerid: "GONZALEZ DIEZ, MIRIAM",
    "_ownerid_value@Microsoft.Dynamics.CRM.associatednavigationproperty":
      "ownerid",
    "_ownerid_value@Microsoft.Dynamics.CRM.lookuplogicalname": "systemuser",
    _ownerid_value: "6f5078c2-a430-eb11-80fa-0050568345f9",
    "osp_validadoordering@OData.Community.Display.V1.FormattedValue": "No",
    osp_validadoordering: false,
    osp_registro:
      "CAS-149189-M2N9C1 - CAS-124742-G6W5D2 - Financiacion equipso Orange 13 sedes",
    "_osp_oportunidad_value@OData.Community.Display.V1.FormattedValue":
      "OPP-0078401 - proyecto covergente",
    "_osp_oportunidad_value@Microsoft.Dynamics.CRM.associatednavigationproperty":
      "osp_oportunidad",
    "_osp_oportunidad_value@Microsoft.Dynamics.CRM.lookuplogicalname":
      "opportunity",
    _osp_oportunidad_value: "53fac40b-c952-4c3c-a12a-778df2689633",
    "osp_tipificacion@OData.Community.Display.V1.FormattedValue":
      "Documentacion de proyecto y provisi\u00f3n",
    osp_tipificacion: 863920012,
    "osp_proyecto@OData.Community.Display.V1.FormattedValue": "No",
    osp_proyecto: false,
    osp_descripcion: "Excel sedes",
    osp_link:
      "https://ggccorange.sharepoint.com/Dynamics/opportunity/OPP-0078401 - proyecto covergente/CAS-149189-M2N9C1 - CAS-124742-G6W5D2 - Financiacion equipso Orange 13 sedes/ELENAS financiera.xlsx",
    "osp_categoria@OData.Community.Display.V1.FormattedValue":
      "lantilla Datos administrativos",
    osp_categoria: 19,
    _modifiedby: "GONZALEZ DIEZ, MIRIAM",
    "_modifiedby_value@Microsoft.Dynamics.CRM.lookuplogicalname": "systemuser",
    _modifiedby_value: "6f5078c2-a430-eb11-80fa-0050568345f9",
  },
  {
    "@odata.etag": 'W/"2781498818"',
    "modifiedon@OData.Community.Display.V1.FormattedValue": "27/03/2025 17:49",
    modifiedon: "2025-03-27T16:49:55Z",
    osp_subcategoria: null,
    osp_documentacionid: "9d16e37d-2b0b-f011-bae3-6045bd9f3071",
    "osp_validadocontratacion@OData.Community.Display.V1.FormattedValue": "No",
    osp_validadocontratacion: false,
    "createdon@OData.Community.Display.V1.FormattedValue": "27/03/2025 17:49",
    createdon: "2025-03-27T16:49:55Z",
    osp_nombre: "RV Licencias Microsoft 365 F3.msg",
    _ownerid: "GONZALEZ DIEZ, MIRIAM",
    "_ownerid_value@Microsoft.Dynamics.CRM.associatednavigationproperty":
      "ownerid",
    "_ownerid_value@Microsoft.Dynamics.CRM.lookuplogicalname": "systemuser",
    _ownerid_value: "6f5078c2-a430-eb11-80fa-0050568345f9",
    "osp_validadoordering@OData.Community.Display.V1.FormattedValue": "No",
    osp_validadoordering: false,
    osp_registro:
      "CAS-149245-F4P9W2 - CAS-124742-G6W5D2 - Licencias Microsoft 365 F3",
    "_osp_oportunidad_value@OData.Community.Display.V1.FormattedValue":
      "OPP-0078401 - proyecto covergente",
    "_osp_oportunidad_value@Microsoft.Dynamics.CRM.associatednavigationproperty":
      "osp_oportunidad",
    "_osp_oportunidad_value@Microsoft.Dynamics.CRM.lookuplogicalname":
      "opportunity",
    _osp_oportunidad_value: "53fac40b-c952-4c3c-a12a-778df2689633",
    "osp_tipificacion@OData.Community.Display.V1.FormattedValue":
      "Autorizaciones Internas",
    osp_tipificacion: 863920008,
    "osp_proyecto@OData.Community.Display.V1.FormattedValue": "No",
    osp_proyecto: false,
    osp_descripcion: "Solicitud KAM",
    osp_link:
      "https://ggccorange.sharepoint.com/Dynamics/opportunity/OPP-0078401 - proyecto covergente/CAS-149245-F4P9W2 - CAS-124742-G6W5D2 - Licencias Microsoft 365 F3/RV Licencias Microsoft 365 F3.msg",
    "osp_categoria@OData.Community.Display.V1.FormattedValue":
      "Autorizaciones internas KAM",
    osp_categoria: 6,
    _modifiedby: "GONZALEZ DIEZ, MIRIAM",
    "_modifiedby_value@Microsoft.Dynamics.CRM.lookuplogicalname": "systemuser",
    _modifiedby_value: "6f5078c2-a430-eb11-80fa-0050568345f9",
  },
  {
    "@odata.etag": 'W/"2890797365"',
    "modifiedon@OData.Community.Display.V1.FormattedValue": "14/05/2025 15:01",
    modifiedon: "2025-05-14T13:01:58Z",
    osp_subcategoria: null,
    osp_documentacionid: "9cdc899a-c330-f011-8c4d-6045bd9fce2c",
    "osp_validadocontratacion@OData.Community.Display.V1.FormattedValue": "No",
    osp_validadocontratacion: false,
    "createdon@OData.Community.Display.V1.FormattedValue": "14/05/2025 15:01",
    createdon: "2025-05-14T13:01:58Z",
    osp_nombre:
      "THE RED KIWI valladolid, oviedo, lerida 5 ips Plantilla_Provision_Digital_Centrex.xlsx",
    _ownerid: "LAGO RUIZ, JOSE",
    "_ownerid_value@Microsoft.Dynamics.CRM.associatednavigationproperty":
      "ownerid",
    "_ownerid_value@Microsoft.Dynamics.CRM.lookuplogicalname": "systemuser",
    _ownerid_value: "039f6c0f-aaba-ee11-a569-6045bd905b10",
    "osp_validadoordering@OData.Community.Display.V1.FormattedValue": "No",
    osp_validadoordering: false,
    osp_registro:
      "CAS-153433-R4W6P6 - Plantilla CENTREX Oviedo, Lerida y Valladolid",
    "_osp_oportunidad_value@OData.Community.Display.V1.FormattedValue":
      "OPP-0078401 - proyecto covergente",
    "_osp_oportunidad_value@Microsoft.Dynamics.CRM.associatednavigationproperty":
      "osp_oportunidad",
    "_osp_oportunidad_value@Microsoft.Dynamics.CRM.lookuplogicalname":
      "opportunity",
    _osp_oportunidad_value: "53fac40b-c952-4c3c-a12a-778df2689633",
    "osp_tipificacion@OData.Community.Display.V1.FormattedValue":
      "Documentacion de proyecto y provisi\u00f3n",
    osp_tipificacion: 863920012,
    "osp_proyecto@OData.Community.Display.V1.FormattedValue": "No",
    osp_proyecto: false,
    osp_descripcion: null,
    osp_link:
      "https://ggccorange.sharepoint.com/Dynamics/opportunity/OPP-0078401 - proyecto covergente/CAS-153433-R4W6P6 - Plantilla CENTREX Oviedo, Lerida y Valladolid/THE RED KIWI valladolid, oviedo, lerida 5 ips Plantilla_Provision_Digital_Centrex.xlsx",
    osp_categoria: null,
    _modifiedby: "LAGO RUIZ, JOSE",
    "_modifiedby_value@Microsoft.Dynamics.CRM.lookuplogicalname": "systemuser",
    _modifiedby_value: "039f6c0f-aaba-ee11-a569-6045bd905b10",
  },
  {
    "@odata.etag": 'W/"3241440848"',
    "modifiedon@OData.Community.Display.V1.FormattedValue": "29/09/2025 13:31",
    modifiedon: "2025-09-29T11:31:53Z",
    osp_subcategoria: null,
    osp_documentacionid: "fa0d8be4-279d-f011-b41b-6045bda25a5e",
    "osp_validadocontratacion@OData.Community.Display.V1.FormattedValue": "No",
    osp_validadocontratacion: false,
    "createdon@OData.Community.Display.V1.FormattedValue": "29/09/2025 13:31",
    createdon: "2025-09-29T11:31:53Z",
    osp_nombre: "Centralita Clinicasseptiembre25.xlsx",
    _ownerid: "GONZALEZ DIEZ, MIRIAM",
    "_ownerid_value@Microsoft.Dynamics.CRM.associatednavigationproperty":
      "ownerid",
    "_ownerid_value@Microsoft.Dynamics.CRM.lookuplogicalname": "systemuser",
    _ownerid_value: "6f5078c2-a430-eb11-80fa-0050568345f9",
    "osp_validadoordering@OData.Community.Display.V1.FormattedValue": "No",
    osp_validadoordering: false,
    osp_registro: "CAS-164833-H4S2L1",
    "_osp_oportunidad_value@OData.Community.Display.V1.FormattedValue":
      "OPP-0078401 - proyecto covergente",
    "_osp_oportunidad_value@Microsoft.Dynamics.CRM.associatednavigationproperty":
      "osp_oportunidad",
    "_osp_oportunidad_value@Microsoft.Dynamics.CRM.lookuplogicalname":
      "opportunity",
    _osp_oportunidad_value: "53fac40b-c952-4c3c-a12a-778df2689633",
    "osp_tipificacion@OData.Community.Display.V1.FormattedValue":
      "Requisitos Clientes",
    osp_tipificacion: 863920000,
    "osp_proyecto@OData.Community.Display.V1.FormattedValue": "No",
    osp_proyecto: false,
    osp_descripcion: "Requisitos cliente",
    osp_link:
      "https://ggccorange.sharepoint.com/Dynamics/opportunity/OPP-0078401 - proyecto covergente/CAS-164833-H4S2L1/Centralita Clinicasseptiembre25.xlsx",
    "osp_categoria@OData.Community.Display.V1.FormattedValue":
      "Inventario de requisitos",
    osp_categoria: 18,
    _modifiedby: "GONZALEZ DIEZ, MIRIAM",
    "_modifiedby_value@Microsoft.Dynamics.CRM.lookuplogicalname": "systemuser",
    _modifiedby_value: "6f5078c2-a430-eb11-80fa-0050568345f9",
  },
  {
    "@odata.etag": 'W/"3242565488"',
    "modifiedon@OData.Community.Display.V1.FormattedValue": "29/09/2025 19:35",
    modifiedon: "2025-09-29T17:35:53Z",
    osp_subcategoria: null,
    osp_documentacionid: "4cb32cb9-5a9d-f011-b41b-6045bda25a5e",
    "osp_validadocontratacion@OData.Community.Display.V1.FormattedValue": "No",
    osp_validadocontratacion: false,
    "createdon@OData.Community.Display.V1.FormattedValue": "29/09/2025 19:35",
    createdon: "2025-09-29T17:35:53Z",
    osp_nombre: "THE RED KIWI 2 sedes INVENTARIO ORANGE.xlsm",
    _ownerid: "GONZALEZ DIEZ, MIRIAM",
    "_ownerid_value@Microsoft.Dynamics.CRM.associatednavigationproperty":
      "ownerid",
    "_ownerid_value@Microsoft.Dynamics.CRM.lookuplogicalname": "systemuser",
    _ownerid_value: "6f5078c2-a430-eb11-80fa-0050568345f9",
    "osp_validadoordering@OData.Community.Display.V1.FormattedValue": "No",
    osp_validadoordering: false,
    osp_registro: "CAS-164905-Z9H1Q1",
    "_osp_oportunidad_value@OData.Community.Display.V1.FormattedValue":
      "OPP-0078401 - proyecto covergente",
    "_osp_oportunidad_value@Microsoft.Dynamics.CRM.associatednavigationproperty":
      "osp_oportunidad",
    "_osp_oportunidad_value@Microsoft.Dynamics.CRM.lookuplogicalname":
      "opportunity",
    _osp_oportunidad_value: "53fac40b-c952-4c3c-a12a-778df2689633",
    "osp_tipificacion@OData.Community.Display.V1.FormattedValue":
      "Documentacion de proyecto y provisi\u00f3n",
    osp_tipificacion: 863920012,
    "osp_proyecto@OData.Community.Display.V1.FormattedValue": "No",
    osp_proyecto: false,
    osp_descripcion: "Inventario CENTREX",
    osp_link:
      "https://ggccorange.sharepoint.com/Dynamics/opportunity/OPP-0078401 - proyecto covergente/CAS-164905-Z9H1Q1/THE RED KIWI 2 sedes INVENTARIO ORANGE.xlsm",
    "osp_categoria@OData.Community.Display.V1.FormattedValue": "Centrex",
    osp_categoria: 8,
    _modifiedby: "GONZALEZ DIEZ, MIRIAM",
    "_modifiedby_value@Microsoft.Dynamics.CRM.lookuplogicalname": "systemuser",
    _modifiedby_value: "6f5078c2-a430-eb11-80fa-0050568345f9",
  },
  {
    "@odata.etag": 'W/"3242567540"',
    "modifiedon@OData.Community.Display.V1.FormattedValue": "29/09/2025 19:36",
    modifiedon: "2025-09-29T17:36:45Z",
    osp_subcategoria: null,
    osp_documentacionid: "bb1a61dd-5a9d-f011-b41b-6045bda25a5e",
    "osp_validadocontratacion@OData.Community.Display.V1.FormattedValue": "No",
    osp_validadocontratacion: false,
    "createdon@OData.Community.Display.V1.FormattedValue": "29/09/2025 19:36",
    createdon: "2025-09-29T17:36:45Z",
    osp_nombre: "THE RED KIWI 2 sedes Plantilla_Provision_Digital_Centrex.xlsx",
    _ownerid: "GONZALEZ DIEZ, MIRIAM",
    "_ownerid_value@Microsoft.Dynamics.CRM.associatednavigationproperty":
      "ownerid",
    "_ownerid_value@Microsoft.Dynamics.CRM.lookuplogicalname": "systemuser",
    _ownerid_value: "6f5078c2-a430-eb11-80fa-0050568345f9",
    "osp_validadoordering@OData.Community.Display.V1.FormattedValue": "No",
    osp_validadoordering: false,
    osp_registro: "CAS-164905-Z9H1Q1",
    "_osp_oportunidad_value@OData.Community.Display.V1.FormattedValue":
      "OPP-0078401 - proyecto covergente",
    "_osp_oportunidad_value@Microsoft.Dynamics.CRM.associatednavigationproperty":
      "osp_oportunidad",
    "_osp_oportunidad_value@Microsoft.Dynamics.CRM.lookuplogicalname":
      "opportunity",
    _osp_oportunidad_value: "53fac40b-c952-4c3c-a12a-778df2689633",
    "osp_tipificacion@OData.Community.Display.V1.FormattedValue":
      "Documentacion de proyecto y provisi\u00f3n",
    osp_tipificacion: 863920012,
    "osp_proyecto@OData.Community.Display.V1.FormattedValue": "No",
    osp_proyecto: false,
    osp_descripcion: "Plantilla CENTREX",
    osp_link:
      "https://ggccorange.sharepoint.com/Dynamics/opportunity/OPP-0078401 - proyecto covergente/CAS-164905-Z9H1Q1/THE RED KIWI 2 sedes Plantilla_Provision_Digital_Centrex.xlsx",
    "osp_categoria@OData.Community.Display.V1.FormattedValue": "Centrex",
    osp_categoria: 8,
    _modifiedby: "GONZALEZ DIEZ, MIRIAM",
    "_modifiedby_value@Microsoft.Dynamics.CRM.lookuplogicalname": "systemuser",
    _modifiedby_value: "6f5078c2-a430-eb11-80fa-0050568345f9",
  },
  {
    "@odata.etag": 'W/"2974071897"',
    "modifiedon@OData.Community.Display.V1.FormattedValue": "16/06/2025 16:21",
    modifiedon: "2025-06-16T14:21:45Z",
    osp_subcategoria: null,
    osp_documentacionid: "e5af93dc-bb4a-f011-8779-7c1e52278f98",
    "osp_validadocontratacion@OData.Community.Display.V1.FormattedValue": "No",
    osp_validadocontratacion: false,
    "createdon@OData.Community.Display.V1.FormattedValue": "16/06/2025 16:12",
    createdon: "2025-06-16T14:12:04Z",
    osp_nombre:
      "THE RED KIWI 3 clinicas alicante Plantilla_Provision_Digital_Centrex.xlsx",
    _ownerid: "LAGO RUIZ, JOSE",
    "_ownerid_value@Microsoft.Dynamics.CRM.associatednavigationproperty":
      "ownerid",
    "_ownerid_value@Microsoft.Dynamics.CRM.lookuplogicalname": "systemuser",
    _ownerid_value: "039f6c0f-aaba-ee11-a569-6045bd905b10",
    "osp_validadoordering@OData.Community.Display.V1.FormattedValue": "No",
    osp_validadoordering: false,
    osp_registro: "CAS-157174-Q2S1H4",
    "_osp_oportunidad_value@OData.Community.Display.V1.FormattedValue":
      "OPP-0078401 - proyecto covergente",
    "_osp_oportunidad_value@Microsoft.Dynamics.CRM.associatednavigationproperty":
      "osp_oportunidad",
    "_osp_oportunidad_value@Microsoft.Dynamics.CRM.lookuplogicalname":
      "opportunity",
    _osp_oportunidad_value: "53fac40b-c952-4c3c-a12a-778df2689633",
    "osp_tipificacion@OData.Community.Display.V1.FormattedValue":
      "Documentacion de proyecto y provisi\u00f3n",
    osp_tipificacion: 863920012,
    "osp_proyecto@OData.Community.Display.V1.FormattedValue": "No",
    osp_proyecto: false,
    osp_descripcion: null,
    osp_link:
      "https://ggccorange.sharepoint.com/Dynamics/opportunity/OPP-0078401 - proyecto covergente/CAS-157174-Q2S1H4/THE RED KIWI 3 clinicas alicante Plantilla_Provision_Digital_Centrex.xlsx",
    osp_categoria: null,
    _modifiedby: "LAGO RUIZ, JOSE",
    "_modifiedby_value@Microsoft.Dynamics.CRM.lookuplogicalname": "systemuser",
    _modifiedby_value: "039f6c0f-aaba-ee11-a569-6045bd905b10",
  },
  {
    "@odata.etag": 'W/"2974047707"',
    "modifiedon@OData.Community.Display.V1.FormattedValue": "16/06/2025 16:12",
    modifiedon: "2025-06-16T14:12:15Z",
    osp_subcategoria: null,
    osp_documentacionid: "9b928ee2-bb4a-f011-8779-7c1e52278f98",
    "osp_validadocontratacion@OData.Community.Display.V1.FormattedValue": "No",
    osp_validadocontratacion: false,
    "createdon@OData.Community.Display.V1.FormattedValue": "16/06/2025 16:12",
    createdon: "2025-06-16T14:12:15Z",
    osp_nombre: "Centralita ClinicasJulio25.xlsx",
    _ownerid: "LAGO RUIZ, JOSE",
    "_ownerid_value@Microsoft.Dynamics.CRM.associatednavigationproperty":
      "ownerid",
    "_ownerid_value@Microsoft.Dynamics.CRM.lookuplogicalname": "systemuser",
    _ownerid_value: "039f6c0f-aaba-ee11-a569-6045bd905b10",
    "osp_validadoordering@OData.Community.Display.V1.FormattedValue": "No",
    osp_validadoordering: false,
    osp_registro: "CAS-157174-Q2S1H4",
    "_osp_oportunidad_value@OData.Community.Display.V1.FormattedValue":
      "OPP-0078401 - proyecto covergente",
    "_osp_oportunidad_value@Microsoft.Dynamics.CRM.associatednavigationproperty":
      "osp_oportunidad",
    "_osp_oportunidad_value@Microsoft.Dynamics.CRM.lookuplogicalname":
      "opportunity",
    _osp_oportunidad_value: "53fac40b-c952-4c3c-a12a-778df2689633",
    "osp_tipificacion@OData.Community.Display.V1.FormattedValue":
      "Documentacion de proyecto y provisi\u00f3n",
    osp_tipificacion: 863920012,
    "osp_proyecto@OData.Community.Display.V1.FormattedValue": "No",
    osp_proyecto: false,
    osp_descripcion: null,
    osp_link:
      "https://ggccorange.sharepoint.com/Dynamics/opportunity/OPP-0078401 - proyecto covergente/CAS-157174-Q2S1H4/Centralita ClinicasJulio25.xlsx",
    osp_categoria: null,
    _modifiedby: "LAGO RUIZ, JOSE",
    "_modifiedby_value@Microsoft.Dynamics.CRM.lookuplogicalname": "systemuser",
    _modifiedby_value: "039f6c0f-aaba-ee11-a569-6045bd905b10",
  },
  {
    "@odata.etag": 'W/"2974048147"',
    "modifiedon@OData.Community.Display.V1.FormattedValue": "16/06/2025 16:12",
    modifiedon: "2025-06-16T14:12:30Z",
    osp_subcategoria: null,
    osp_documentacionid: "8c3bc9ee-bb4a-f011-8779-7c1e52278f98",
    "osp_validadocontratacion@OData.Community.Display.V1.FormattedValue": "No",
    osp_validadocontratacion: false,
    "createdon@OData.Community.Display.V1.FormattedValue": "16/06/2025 16:12",
    createdon: "2025-06-16T14:12:30Z",
    osp_nombre: "THE RED KIWI  3 sede alicante INVENTARIO ORANGE.xlsx",
    _ownerid: "LAGO RUIZ, JOSE",
    "_ownerid_value@Microsoft.Dynamics.CRM.associatednavigationproperty":
      "ownerid",
    "_ownerid_value@Microsoft.Dynamics.CRM.lookuplogicalname": "systemuser",
    _ownerid_value: "039f6c0f-aaba-ee11-a569-6045bd905b10",
    "osp_validadoordering@OData.Community.Display.V1.FormattedValue": "No",
    osp_validadoordering: false,
    osp_registro: "CAS-157174-Q2S1H4",
    "_osp_oportunidad_value@OData.Community.Display.V1.FormattedValue":
      "OPP-0078401 - proyecto covergente",
    "_osp_oportunidad_value@Microsoft.Dynamics.CRM.associatednavigationproperty":
      "osp_oportunidad",
    "_osp_oportunidad_value@Microsoft.Dynamics.CRM.lookuplogicalname":
      "opportunity",
    _osp_oportunidad_value: "53fac40b-c952-4c3c-a12a-778df2689633",
    "osp_tipificacion@OData.Community.Display.V1.FormattedValue":
      "Documentacion de proyecto y provisi\u00f3n",
    osp_tipificacion: 863920012,
    "osp_proyecto@OData.Community.Display.V1.FormattedValue": "No",
    osp_proyecto: false,
    osp_descripcion: null,
    osp_link:
      "https://ggccorange.sharepoint.com/Dynamics/opportunity/OPP-0078401 - proyecto covergente/CAS-157174-Q2S1H4/THE RED KIWI  3 sede alicante INVENTARIO ORANGE.xlsx",
    osp_categoria: null,
    _modifiedby: "LAGO RUIZ, JOSE",
    "_modifiedby_value@Microsoft.Dynamics.CRM.lookuplogicalname": "systemuser",
    _modifiedby_value: "039f6c0f-aaba-ee11-a569-6045bd905b10",
  },
  {
    "@odata.etag": 'W/"2752100775"',
    "modifiedon@OData.Community.Display.V1.FormattedValue": "20/03/2025 16:40",
    modifiedon: "2025-03-20T15:40:14Z",
    osp_subcategoria: null,
    osp_documentacionid: "ba32867a-f7ed-ef11-be1f-7c1e524e53d7",
    "osp_validadocontratacion@OData.Community.Display.V1.FormattedValue": "No",
    osp_validadocontratacion: false,
    "createdon@OData.Community.Display.V1.FormattedValue": "18/02/2025 13:54",
    createdon: "2025-02-18T12:54:30Z",
    osp_nombre: "5  PEDIDO PORTATILES DORSIA 18022025.msg",
    _ownerid: "GONZALEZ DIEZ, MIRIAM",
    "_ownerid_value@Microsoft.Dynamics.CRM.associatednavigationproperty":
      "ownerid",
    "_ownerid_value@Microsoft.Dynamics.CRM.lookuplogicalname": "systemuser",
    _ownerid_value: "6f5078c2-a430-eb11-80fa-0050568345f9",
    "osp_validadoordering@OData.Community.Display.V1.FormattedValue": "No",
    osp_validadoordering: false,
    osp_registro:
      "CAS-145255-G6S8R8 - CAS-124742-G6W5D2 - 6\u00ba pedido portatiles",
    "_osp_oportunidad_value@OData.Community.Display.V1.FormattedValue":
      "OPP-0078401 - proyecto covergente",
    "_osp_oportunidad_value@Microsoft.Dynamics.CRM.associatednavigationproperty":
      "osp_oportunidad",
    "_osp_oportunidad_value@Microsoft.Dynamics.CRM.lookuplogicalname":
      "opportunity",
    _osp_oportunidad_value: "53fac40b-c952-4c3c-a12a-778df2689633",
    "osp_tipificacion@OData.Community.Display.V1.FormattedValue":
      "Autorizaciones Internas",
    osp_tipificacion: 863920008,
    "osp_proyecto@OData.Community.Display.V1.FormattedValue": "No",
    osp_proyecto: false,
    osp_descripcion: "Solicitud pedido KAM",
    osp_link:
      "https://ggccorange.sharepoint.com/Dynamics/opportunity/OPP-0078401 - proyecto covergente/CAS-145255-G6S8R8 - CAS-124742-G6W5D2 - 6\u00ba pedido portatiles/5  PEDIDO PORTATILES DORSIA 18022025.msg",
    "osp_categoria@OData.Community.Display.V1.FormattedValue":
      "Autorizaciones internas KAM",
    osp_categoria: 6,
    _modifiedby: "CRM, Admin",
    "_modifiedby_value@Microsoft.Dynamics.CRM.lookuplogicalname": "systemuser",
    _modifiedby_value: "ac79a518-0950-e611-80c1-005056a03d45",
  },
  {
    "@odata.etag": 'W/"2644825066"',
    "modifiedon@OData.Community.Display.V1.FormattedValue": "05/02/2025 14:16",
    modifiedon: "2025-02-05T13:16:29Z",
    osp_subcategoria: null,
    osp_documentacionid: "fb1a4a63-c3e3-ef11-be20-7c1e525f86cf",
    "osp_validadocontratacion@OData.Community.Display.V1.FormattedValue": "No",
    osp_validadocontratacion: false,
    "createdon@OData.Community.Display.V1.FormattedValue": "05/02/2025 14:16",
    createdon: "2025-02-05T13:16:29Z",
    osp_nombre: "RV_ ESCALADO DE PRECIO_ CLINICAS DORSIA.msg",
    _ownerid: "CRM, Admin",
    "_ownerid_value@Microsoft.Dynamics.CRM.associatednavigationproperty":
      "ownerid",
    "_ownerid_value@Microsoft.Dynamics.CRM.lookuplogicalname": "systemuser",
    _ownerid_value: "ac79a518-0950-e611-80c1-005056a03d45",
    "osp_validadoordering@OData.Community.Display.V1.FormattedValue": "No",
    osp_validadoordering: false,
    osp_registro: "OPP-0078401 - WAOC-0052691 - Proyecto convergente",
    "_osp_oportunidad_value@OData.Community.Display.V1.FormattedValue":
      "OPP-0078401 - proyecto covergente",
    "_osp_oportunidad_value@Microsoft.Dynamics.CRM.associatednavigationproperty":
      "osp_oportunidad",
    "_osp_oportunidad_value@Microsoft.Dynamics.CRM.lookuplogicalname":
      "opportunity",
    _osp_oportunidad_value: "53fac40b-c952-4c3c-a12a-778df2689633",
    "osp_tipificacion@OData.Community.Display.V1.FormattedValue": "PdN",
    osp_tipificacion: 863920001,
    "osp_proyecto@OData.Community.Display.V1.FormattedValue": "No",
    osp_proyecto: false,
    osp_descripcion: null,
    osp_link:
      "https://ggccorange.sharepoint.com/Dynamics/elob_validation/OPP-0078401 - WAOC-0052691 - Proyecto convergente/RV_%20ESCALADO%20DE%20PRECIO_%20CLINICAS%20DORSIA.msg",
    osp_categoria: null,
    _modifiedby: "CRM, Admin",
    "_modifiedby_value@Microsoft.Dynamics.CRM.lookuplogicalname": "systemuser",
    _modifiedby_value: "ac79a518-0950-e611-80c1-005056a03d45",
  },
  {
    "@odata.etag": 'W/"2961155776"',
    "modifiedon@OData.Community.Display.V1.FormattedValue": "10/06/2025 17:41",
    modifiedon: "2025-06-10T15:41:53Z",
    osp_subcategoria: null,
    osp_documentacionid: "7de2e06d-1146-f011-8779-7c1e5260776b",
    "osp_validadocontratacion@OData.Community.Display.V1.FormattedValue": "No",
    osp_validadocontratacion: false,
    "createdon@OData.Community.Display.V1.FormattedValue": "10/06/2025 17:41",
    createdon: "2025-06-10T15:41:53Z",
    osp_nombre: "3 clinicas nuevas DORSIA.msg",
    _ownerid: "GONZALEZ DIEZ, MIRIAM",
    "_ownerid_value@Microsoft.Dynamics.CRM.associatednavigationproperty":
      "ownerid",
    "_ownerid_value@Microsoft.Dynamics.CRM.lookuplogicalname": "systemuser",
    _ownerid_value: "6f5078c2-a430-eb11-80fa-0050568345f9",
    "osp_validadoordering@OData.Community.Display.V1.FormattedValue": "No",
    osp_validadoordering: false,
    osp_registro:
      "CAS-156590-G3K1H8 - Plantilla CENTREX Slamanca, Valncia_Jesus y Valencia_Ramon y Cajal",
    "_osp_oportunidad_value@OData.Community.Display.V1.FormattedValue":
      "OPP-0078401 - proyecto covergente",
    "_osp_oportunidad_value@Microsoft.Dynamics.CRM.associatednavigationproperty":
      "osp_oportunidad",
    "_osp_oportunidad_value@Microsoft.Dynamics.CRM.lookuplogicalname":
      "opportunity",
    _osp_oportunidad_value: "53fac40b-c952-4c3c-a12a-778df2689633",
    "osp_tipificacion@OData.Community.Display.V1.FormattedValue":
      "Requisitos Clientes",
    osp_tipificacion: 863920000,
    "osp_proyecto@OData.Community.Display.V1.FormattedValue": "No",
    osp_proyecto: false,
    osp_descripcion: "Datos plantilla",
    osp_link:
      "https://ggccorange.sharepoint.com/Dynamics/opportunity/OPP-0078401 - proyecto covergente/CAS-156590-G3K1H8 - Plantilla CENTREX Slamanca, Valncia_Jesus y Valencia_Ramon y Cajal/3 clinicas nuevas DORSIA.msg",
    "osp_categoria@OData.Community.Display.V1.FormattedValue":
      "Inventario de requisitos",
    osp_categoria: 18,
    _modifiedby: "GONZALEZ DIEZ, MIRIAM",
    "_modifiedby_value@Microsoft.Dynamics.CRM.lookuplogicalname": "systemuser",
    _modifiedby_value: "6f5078c2-a430-eb11-80fa-0050568345f9",
  },
  {
    "@odata.etag": 'W/"3622545032"',
    "modifiedon@OData.Community.Display.V1.FormattedValue": "13/01/2026 20:22",
    modifiedon: "2026-01-13T19:22:25Z",
    osp_subcategoria: null,
    osp_documentacionid: "a352482d-b5f0-f011-8406-7c1e52608141",
    "osp_validadocontratacion@OData.Community.Display.V1.FormattedValue": "No",
    osp_validadocontratacion: false,
    "createdon@OData.Community.Display.V1.FormattedValue": "13/01/2026 20:22",
    createdon: "2026-01-13T19:22:25Z",
    osp_nombre: "Oferta Orange-Dorsia 14\u00aa ENTREGA v2 (50 udades).xlsx",
    _ownerid: "GONZALEZ DIEZ, MIRIAM",
    "_ownerid_value@Microsoft.Dynamics.CRM.associatednavigationproperty":
      "ownerid",
    "_ownerid_value@Microsoft.Dynamics.CRM.lookuplogicalname": "systemuser",
    _ownerid_value: "6f5078c2-a430-eb11-80fa-0050568345f9",
    "osp_validadoordering@OData.Community.Display.V1.FormattedValue": "No",
    osp_validadoordering: false,
    osp_registro: "CAS-173876-Y1K0D3",
    "_osp_oportunidad_value@OData.Community.Display.V1.FormattedValue":
      "OPP-0078401 - proyecto covergente",
    "_osp_oportunidad_value@Microsoft.Dynamics.CRM.associatednavigationproperty":
      "osp_oportunidad",
    "_osp_oportunidad_value@Microsoft.Dynamics.CRM.lookuplogicalname":
      "opportunity",
    _osp_oportunidad_value: "53fac40b-c952-4c3c-a12a-778df2689633",
    "osp_tipificacion@OData.Community.Display.V1.FormattedValue":
      "Ofertas de terceros",
    osp_tipificacion: 863920007,
    "osp_proyecto@OData.Community.Display.V1.FormattedValue": "No",
    osp_proyecto: false,
    osp_descripcion: "Oferta proveedor",
    osp_link:
      "https://ggccorange.sharepoint.com/Dynamics/opportunity/OPP-0078401 - proyecto covergente/CAS-173876-Y1K0D3/Oferta Orange-Dorsia 14\u00aa ENTREGA v2 (50 udades).xlsx",
    "osp_categoria@OData.Community.Display.V1.FormattedValue":
      "Oferta de proveedores",
    osp_categoria: 20,
    _modifiedby: "GONZALEZ DIEZ, MIRIAM",
    "_modifiedby_value@Microsoft.Dynamics.CRM.lookuplogicalname": "systemuser",
    _modifiedby_value: "6f5078c2-a430-eb11-80fa-0050568345f9",
  },
  {
    "@odata.etag": 'W/"2962791358"',
    "modifiedon@OData.Community.Display.V1.FormattedValue": "11/06/2025 12:02",
    modifiedon: "2025-06-11T10:02:19Z",
    osp_subcategoria: null,
    osp_documentacionid: "327fcb27-ab46-f011-877a-7c1e52705ac3",
    "osp_validadocontratacion@OData.Community.Display.V1.FormattedValue": "No",
    osp_validadocontratacion: false,
    "createdon@OData.Community.Display.V1.FormattedValue": "11/06/2025 12:02",
    createdon: "2025-06-11T10:02:19Z",
    osp_nombre:
      "THE RED KIWI valencia, valencia y salamanca 5 ips Plantilla_Provision_Digital_Centrex.xlsx",
    _ownerid: "GONZALEZ DIEZ, MIRIAM",
    "_ownerid_value@Microsoft.Dynamics.CRM.associatednavigationproperty":
      "ownerid",
    "_ownerid_value@Microsoft.Dynamics.CRM.lookuplogicalname": "systemuser",
    _ownerid_value: "6f5078c2-a430-eb11-80fa-0050568345f9",
    "osp_validadoordering@OData.Community.Display.V1.FormattedValue": "No",
    osp_validadoordering: false,
    osp_registro:
      "CAS-156669-W4T4S2 - CAS-124742-G6W5D2 - Salamanca, Valencia_Jesus y Valencia_Ramon y Cajal",
    "_osp_oportunidad_value@OData.Community.Display.V1.FormattedValue":
      "OPP-0078401 - proyecto covergente",
    "_osp_oportunidad_value@Microsoft.Dynamics.CRM.associatednavigationproperty":
      "osp_oportunidad",
    "_osp_oportunidad_value@Microsoft.Dynamics.CRM.lookuplogicalname":
      "opportunity",
    _osp_oportunidad_value: "53fac40b-c952-4c3c-a12a-778df2689633",
    "osp_tipificacion@OData.Community.Display.V1.FormattedValue":
      "Documentacion de proyecto y provisi\u00f3n",
    osp_tipificacion: 863920012,
    "osp_proyecto@OData.Community.Display.V1.FormattedValue": "No",
    osp_proyecto: false,
    osp_descripcion: "Plantilla CENTREX",
    osp_link:
      "https://ggccorange.sharepoint.com/Dynamics/opportunity/OPP-0078401 - proyecto covergente/CAS-156669-W4T4S2 - CAS-124742-G6W5D2 - Salamanca, Valencia_Jesus y Valencia_Ramon y Cajal/THE RED KIWI valencia, valencia y salamanca 5 ips Plantilla_Provision_Digital_Centrex.xlsx",
    "osp_categoria@OData.Community.Display.V1.FormattedValue": "Centrex",
    osp_categoria: 8,
    _modifiedby: "GONZALEZ DIEZ, MIRIAM",
    "_modifiedby_value@Microsoft.Dynamics.CRM.lookuplogicalname": "systemuser",
    _modifiedby_value: "6f5078c2-a430-eb11-80fa-0050568345f9",
  },
  {
    "@odata.etag": 'W/"2819109185"',
    "modifiedon@OData.Community.Display.V1.FormattedValue": "10/04/2025 12:24",
    modifiedon: "2025-04-10T10:24:27Z",
    osp_subcategoria: null,
    osp_documentacionid: "fe093af5-f515-f011-998a-7c1e52705ac3",
    "osp_validadocontratacion@OData.Community.Display.V1.FormattedValue": "No",
    osp_validadocontratacion: false,
    "createdon@OData.Community.Display.V1.FormattedValue": "10/04/2025 12:24",
    createdon: "2025-04-10T10:24:27Z",
    osp_nombre: "Migraci\u00f3n cl\u00ednica Rubi.msg",
    _ownerid: "GONZALEZ DIEZ, MIRIAM",
    "_ownerid_value@Microsoft.Dynamics.CRM.associatednavigationproperty":
      "ownerid",
    "_ownerid_value@Microsoft.Dynamics.CRM.lookuplogicalname": "systemuser",
    _ownerid_value: "6f5078c2-a430-eb11-80fa-0050568345f9",
    "osp_validadoordering@OData.Community.Display.V1.FormattedValue": "No",
    osp_validadoordering: false,
    osp_registro: "CAS-150739-V2W2Q1 - CAS-124742-G6W5D2 - Sede Rubi",
    "_osp_oportunidad_value@OData.Community.Display.V1.FormattedValue":
      "OPP-0078401 - proyecto covergente",
    "_osp_oportunidad_value@Microsoft.Dynamics.CRM.associatednavigationproperty":
      "osp_oportunidad",
    "_osp_oportunidad_value@Microsoft.Dynamics.CRM.lookuplogicalname":
      "opportunity",
    _osp_oportunidad_value: "53fac40b-c952-4c3c-a12a-778df2689633",
    "osp_tipificacion@OData.Community.Display.V1.FormattedValue":
      "Requisitos Clientes",
    osp_tipificacion: 863920000,
    "osp_proyecto@OData.Community.Display.V1.FormattedValue": "No",
    osp_proyecto: false,
    osp_descripcion: "Solicitud cliente",
    osp_link:
      "https://ggccorange.sharepoint.com/Dynamics/opportunity/OPP-0078401 - proyecto covergente/CAS-150739-V2W2Q1 - CAS-124742-G6W5D2 - Sede Rubi/Migraci\u00f3n cl\u00ednica Rubi.msg",
    "osp_categoria@OData.Community.Display.V1.FormattedValue":
      "Inventario de requisitos",
    osp_categoria: 18,
    _modifiedby: "GONZALEZ DIEZ, MIRIAM",
    "_modifiedby_value@Microsoft.Dynamics.CRM.lookuplogicalname": "systemuser",
    _modifiedby_value: "6f5078c2-a430-eb11-80fa-0050568345f9",
  },
  {
    "@odata.etag": 'W/"2819145169"',
    "modifiedon@OData.Community.Display.V1.FormattedValue": "10/04/2025 12:34",
    modifiedon: "2025-04-10T10:34:16Z",
    osp_subcategoria: null,
    osp_documentacionid: "16d8ca54-f715-f011-998a-7c1e52705ac3",
    "osp_validadocontratacion@OData.Community.Display.V1.FormattedValue": "No",
    osp_validadocontratacion: false,
    "createdon@OData.Community.Display.V1.FormattedValue": "10/04/2025 12:34",
    createdon: "2025-04-10T10:34:16Z",
    osp_nombre: "Centralita ClinicasAbril25.xlsx",
    _ownerid: "GONZALEZ DIEZ, MIRIAM",
    "_ownerid_value@Microsoft.Dynamics.CRM.associatednavigationproperty":
      "ownerid",
    "_ownerid_value@Microsoft.Dynamics.CRM.lookuplogicalname": "systemuser",
    _ownerid_value: "6f5078c2-a430-eb11-80fa-0050568345f9",
    "osp_validadoordering@OData.Community.Display.V1.FormattedValue": "No",
    osp_validadoordering: false,
    osp_registro: "CAS-150745-H7H6C2 - Plantilla CENTREX Rubi",
    "_osp_oportunidad_value@OData.Community.Display.V1.FormattedValue":
      "OPP-0078401 - proyecto covergente",
    "_osp_oportunidad_value@Microsoft.Dynamics.CRM.associatednavigationproperty":
      "osp_oportunidad",
    "_osp_oportunidad_value@Microsoft.Dynamics.CRM.lookuplogicalname":
      "opportunity",
    _osp_oportunidad_value: "53fac40b-c952-4c3c-a12a-778df2689633",
    "osp_tipificacion@OData.Community.Display.V1.FormattedValue":
      "Requisitos Clientes",
    osp_tipificacion: 863920000,
    "osp_proyecto@OData.Community.Display.V1.FormattedValue": "No",
    osp_proyecto: false,
    osp_descripcion: "Datos plantilla",
    osp_link:
      "https://ggccorange.sharepoint.com/Dynamics/opportunity/OPP-0078401 - proyecto covergente/CAS-150745-H7H6C2 - Plantilla CENTREX Rubi/Centralita ClinicasAbril25.xlsx",
    "osp_categoria@OData.Community.Display.V1.FormattedValue":
      "Inventario de requisitos",
    osp_categoria: 18,
    _modifiedby: "GONZALEZ DIEZ, MIRIAM",
    "_modifiedby_value@Microsoft.Dynamics.CRM.lookuplogicalname": "systemuser",
    _modifiedby_value: "6f5078c2-a430-eb11-80fa-0050568345f9",
  },
  {
    "@odata.etag": 'W/"2835263734"',
    "modifiedon@OData.Community.Display.V1.FormattedValue": "14/04/2025 15:05",
    modifiedon: "2025-04-14T13:05:19Z",
    osp_subcategoria: null,
    osp_documentacionid: "aa675f19-3119-f011-998a-7c1e52705ac3",
    "osp_validadocontratacion@OData.Community.Display.V1.FormattedValue": "No",
    osp_validadocontratacion: false,
    "createdon@OData.Community.Display.V1.FormattedValue": "14/04/2025 15:05",
    createdon: "2025-04-14T13:05:19Z",
    osp_nombre:
      "THE RED KIWI LA CUCOSKA Plantilla_Provision_Digital_Centrex.xlsx",
    _ownerid: "GONZALEZ DIEZ, MIRIAM",
    "_ownerid_value@Microsoft.Dynamics.CRM.associatednavigationproperty":
      "ownerid",
    "_ownerid_value@Microsoft.Dynamics.CRM.lookuplogicalname": "systemuser",
    _ownerid_value: "6f5078c2-a430-eb11-80fa-0050568345f9",
    "osp_validadoordering@OData.Community.Display.V1.FormattedValue": "No",
    osp_validadoordering: false,
    osp_registro: "CAS-151055-C0B0Q8 - CAS-124742-G6W5D2 - CENTREX Rubi",
    "_osp_oportunidad_value@OData.Community.Display.V1.FormattedValue":
      "OPP-0078401 - proyecto covergente",
    "_osp_oportunidad_value@Microsoft.Dynamics.CRM.associatednavigationproperty":
      "osp_oportunidad",
    "_osp_oportunidad_value@Microsoft.Dynamics.CRM.lookuplogicalname":
      "opportunity",
    _osp_oportunidad_value: "53fac40b-c952-4c3c-a12a-778df2689633",
    "osp_tipificacion@OData.Community.Display.V1.FormattedValue":
      "Documentacion de proyecto y provisi\u00f3n",
    osp_tipificacion: 863920012,
    "osp_proyecto@OData.Community.Display.V1.FormattedValue": "No",
    osp_proyecto: false,
    osp_descripcion: "Plantilla CENTREX",
    osp_link:
      "https://ggccorange.sharepoint.com/Dynamics/opportunity/OPP-0078401 - proyecto covergente/CAS-151055-C0B0Q8 - CAS-124742-G6W5D2 - CENTREX Rubi/THE RED KIWI LA CUCOSKA Plantilla_Provision_Digital_Centrex.xlsx",
    "osp_categoria@OData.Community.Display.V1.FormattedValue": "Centrex",
    osp_categoria: 8,
    _modifiedby: "GONZALEZ DIEZ, MIRIAM",
    "_modifiedby_value@Microsoft.Dynamics.CRM.lookuplogicalname": "systemuser",
    _modifiedby_value: "6f5078c2-a430-eb11-80fa-0050568345f9",
  },
  {
    "@odata.etag": 'W/"3143731207"',
    "modifiedon@OData.Community.Display.V1.FormattedValue": "25/08/2025 9:47",
    modifiedon: "2025-08-25T07:47:41Z",
    osp_subcategoria: null,
    osp_documentacionid: "418e6ac4-8781-f011-b4cc-7c1e52705ac3",
    "osp_validadocontratacion@OData.Community.Display.V1.FormattedValue": "No",
    osp_validadocontratacion: false,
    "createdon@OData.Community.Display.V1.FormattedValue": "25/08/2025 9:47",
    createdon: "2025-08-25T07:47:41Z",
    osp_nombre:
      "12082025 THE RED KIWI nueva sede B10884294 INVENTARIO ORANGE.xlsx",
    _ownerid: "TORTOLERO DEL RIO, VICTOR MANUEL",
    "_ownerid_value@Microsoft.Dynamics.CRM.associatednavigationproperty":
      "ownerid",
    "_ownerid_value@Microsoft.Dynamics.CRM.lookuplogicalname": "systemuser",
    _ownerid_value: "6ecf7151-c453-ee11-be6d-6045bd905b10",
    "osp_validadoordering@OData.Community.Display.V1.FormattedValue": "No",
    osp_validadoordering: false,
    osp_registro: "CAS-162010-K6D4S0",
    "_osp_oportunidad_value@OData.Community.Display.V1.FormattedValue":
      "OPP-0078401 - proyecto covergente",
    "_osp_oportunidad_value@Microsoft.Dynamics.CRM.associatednavigationproperty":
      "osp_oportunidad",
    "_osp_oportunidad_value@Microsoft.Dynamics.CRM.lookuplogicalname":
      "opportunity",
    _osp_oportunidad_value: "53fac40b-c952-4c3c-a12a-778df2689633",
    "osp_tipificacion@OData.Community.Display.V1.FormattedValue":
      "Documentacion de proyecto y provisi\u00f3n",
    osp_tipificacion: 863920012,
    "osp_proyecto@OData.Community.Display.V1.FormattedValue": "No",
    osp_proyecto: false,
    osp_descripcion: "Plantilla Inventario m\u00f3vil",
    osp_link:
      "https://ggccorange.sharepoint.com/Dynamics/opportunity/OPP-0078401 - proyecto covergente/CAS-162010-K6D4S0/12082025 THE RED KIWI nueva sede B10884294 INVENTARIO ORANGE.xlsx",
    "osp_categoria@OData.Community.Display.V1.FormattedValue": "Centrex",
    osp_categoria: 8,
    _modifiedby: "TORTOLERO DEL RIO, VICTOR MANUEL",
    "_modifiedby_value@Microsoft.Dynamics.CRM.lookuplogicalname": "systemuser",
    _modifiedby_value: "6ecf7151-c453-ee11-be6d-6045bd905b10",
  },
  {
    "@odata.etag": 'W/"3143731773"',
    "modifiedon@OData.Community.Display.V1.FormattedValue": "25/08/2025 9:48",
    modifiedon: "2025-08-25T07:48:08Z",
    osp_subcategoria: null,
    osp_documentacionid: "99ab6bd6-8781-f011-b4cc-7c1e52705ac3",
    "osp_validadocontratacion@OData.Community.Display.V1.FormattedValue": "No",
    osp_validadocontratacion: false,
    "createdon@OData.Community.Display.V1.FormattedValue": "25/08/2025 9:48",
    createdon: "2025-08-25T07:48:08Z",
    osp_nombre:
      "12082025 THE RED KIWI nueva sede B10884294Plantilla_Provision_Digital_Centrex.xlsx",
    _ownerid: "TORTOLERO DEL RIO, VICTOR MANUEL",
    "_ownerid_value@Microsoft.Dynamics.CRM.associatednavigationproperty":
      "ownerid",
    "_ownerid_value@Microsoft.Dynamics.CRM.lookuplogicalname": "systemuser",
    _ownerid_value: "6ecf7151-c453-ee11-be6d-6045bd905b10",
    "osp_validadoordering@OData.Community.Display.V1.FormattedValue": "No",
    osp_validadoordering: false,
    osp_registro: "CAS-162010-K6D4S0",
    "_osp_oportunidad_value@OData.Community.Display.V1.FormattedValue":
      "OPP-0078401 - proyecto covergente",
    "_osp_oportunidad_value@Microsoft.Dynamics.CRM.associatednavigationproperty":
      "osp_oportunidad",
    "_osp_oportunidad_value@Microsoft.Dynamics.CRM.lookuplogicalname":
      "opportunity",
    _osp_oportunidad_value: "53fac40b-c952-4c3c-a12a-778df2689633",
    "osp_tipificacion@OData.Community.Display.V1.FormattedValue":
      "Documentacion de proyecto y provisi\u00f3n",
    osp_tipificacion: 863920012,
    "osp_proyecto@OData.Community.Display.V1.FormattedValue": "No",
    osp_proyecto: false,
    osp_descripcion: "Plantilla DC",
    osp_link:
      "https://ggccorange.sharepoint.com/Dynamics/opportunity/OPP-0078401 - proyecto covergente/CAS-162010-K6D4S0/12082025 THE RED KIWI nueva sede B10884294Plantilla_Provision_Digital_Centrex.xlsx",
    "osp_categoria@OData.Community.Display.V1.FormattedValue": "Centrex",
    osp_categoria: 8,
    _modifiedby: "TORTOLERO DEL RIO, VICTOR MANUEL",
    "_modifiedby_value@Microsoft.Dynamics.CRM.lookuplogicalname": "systemuser",
    _modifiedby_value: "6ecf7151-c453-ee11-be6d-6045bd905b10",
  },
  {
    "@odata.etag": 'W/"2752115038"',
    "modifiedon@OData.Community.Display.V1.FormattedValue": "20/03/2025 16:45",
    modifiedon: "2025-03-20T15:45:52Z",
    osp_subcategoria: null,
    osp_documentacionid: "d9a48010-43f4-ef11-be1f-7c1e52705ac3",
    "osp_validadocontratacion@OData.Community.Display.V1.FormattedValue": "No",
    osp_validadocontratacion: false,
    "createdon@OData.Community.Display.V1.FormattedValue": "26/02/2025 14:10",
    createdon: "2025-02-26T13:10:40Z",
    osp_nombre:
      "THE RED KIWI SOCIEDAD LIMITADA LOMA LINDA, S.L Plantilla_Provision_Digital_Centrex.xlsx",
    _ownerid: "LAGO RUIZ, JOSE",
    "_ownerid_value@Microsoft.Dynamics.CRM.associatednavigationproperty":
      "ownerid",
    "_ownerid_value@Microsoft.Dynamics.CRM.lookuplogicalname": "systemuser",
    _ownerid_value: "039f6c0f-aaba-ee11-a569-6045bd905b10",
    "osp_validadoordering@OData.Community.Display.V1.FormattedValue": "No",
    osp_validadoordering: false,
    osp_registro:
      "CAS-146052-R1T6G5 - Plantilla CENTREX - Huelva y Madrid-Alcal\u00e1 LOMA LINDA",
    "_osp_oportunidad_value@OData.Community.Display.V1.FormattedValue":
      "OPP-0078401 - proyecto covergente",
    "_osp_oportunidad_value@Microsoft.Dynamics.CRM.associatednavigationproperty":
      "osp_oportunidad",
    "_osp_oportunidad_value@Microsoft.Dynamics.CRM.lookuplogicalname":
      "opportunity",
    _osp_oportunidad_value: "53fac40b-c952-4c3c-a12a-778df2689633",
    "osp_tipificacion@OData.Community.Display.V1.FormattedValue":
      "Documentacion de proyecto y provisi\u00f3n",
    osp_tipificacion: 863920012,
    "osp_proyecto@OData.Community.Display.V1.FormattedValue": "No",
    osp_proyecto: false,
    osp_descripcion: "plantilla centrex",
    osp_link:
      "https://ggccorange.sharepoint.com/Dynamics/opportunity/OPP-0078401 - proyecto covergente/CAS-146052-R1T6G5 - Plantilla CENTREX - Huelva y Madrid-Alcal\u00e1 LOMA LINDA/THE RED KIWI SOCIEDAD LIMITADA LOMA LINDA, S.L Plantilla_Provision_Digital_Centrex.xlsx",
    "osp_categoria@OData.Community.Display.V1.FormattedValue": "Centrex",
    osp_categoria: 8,
    _modifiedby: "CRM, Admin",
    "_modifiedby_value@Microsoft.Dynamics.CRM.lookuplogicalname": "systemuser",
    _modifiedby_value: "ac79a518-0950-e611-80c1-005056a03d45",
  },
  {
    "@odata.etag": 'W/"3020062266"',
    "modifiedon@OData.Community.Display.V1.FormattedValue": "07/07/2025 16:39",
    modifiedon: "2025-07-07T14:39:37Z",
    osp_subcategoria: null,
    osp_documentacionid: "38f3cb31-405b-f011-bec2-7c1e52705ac3",
    "osp_validadocontratacion@OData.Community.Display.V1.FormattedValue": "No",
    osp_validadocontratacion: false,
    "createdon@OData.Community.Display.V1.FormattedValue": "07/07/2025 16:39",
    createdon: "2025-07-07T14:39:37Z",
    osp_nombre:
      "THE RED KIWI San Sebastian de los Reyes INVENTARIO ORANGE.xlsx",
    _ownerid: "GONZALEZ DIEZ, MIRIAM",
    "_ownerid_value@Microsoft.Dynamics.CRM.associatednavigationproperty":
      "ownerid",
    "_ownerid_value@Microsoft.Dynamics.CRM.lookuplogicalname": "systemuser",
    _ownerid_value: "6f5078c2-a430-eb11-80fa-0050568345f9",
    "osp_validadoordering@OData.Community.Display.V1.FormattedValue": "No",
    osp_validadoordering: false,
    osp_registro: "CAS-158941-P2S1Q0",
    "_osp_oportunidad_value@OData.Community.Display.V1.FormattedValue":
      "OPP-0078401 - proyecto covergente",
    "_osp_oportunidad_value@Microsoft.Dynamics.CRM.associatednavigationproperty":
      "osp_oportunidad",
    "_osp_oportunidad_value@Microsoft.Dynamics.CRM.lookuplogicalname":
      "opportunity",
    _osp_oportunidad_value: "53fac40b-c952-4c3c-a12a-778df2689633",
    "osp_tipificacion@OData.Community.Display.V1.FormattedValue":
      "Documentacion de proyecto y provisi\u00f3n",
    osp_tipificacion: 863920012,
    "osp_proyecto@OData.Community.Display.V1.FormattedValue": "No",
    osp_proyecto: false,
    osp_descripcion: "Inventario",
    osp_link:
      "https://ggccorange.sharepoint.com/Dynamics/opportunity/OPP-0078401 - proyecto covergente/CAS-158941-P2S1Q0/THE RED KIWI San Sebastian de los Reyes INVENTARIO ORANGE.xlsx",
    "osp_categoria@OData.Community.Display.V1.FormattedValue": "Centrex",
    osp_categoria: 8,
    _modifiedby: "GONZALEZ DIEZ, MIRIAM",
    "_modifiedby_value@Microsoft.Dynamics.CRM.lookuplogicalname": "systemuser",
    _modifiedby_value: "6f5078c2-a430-eb11-80fa-0050568345f9",
  },
  {
    "@odata.etag": 'W/"3020063530"',
    "modifiedon@OData.Community.Display.V1.FormattedValue": "07/07/2025 16:40",
    modifiedon: "2025-07-07T14:40:10Z",
    osp_subcategoria: null,
    osp_documentacionid: "3a5ec143-405b-f011-bec2-7c1e52705ac3",
    "osp_validadocontratacion@OData.Community.Display.V1.FormattedValue": "No",
    osp_validadocontratacion: false,
    "createdon@OData.Community.Display.V1.FormattedValue": "07/07/2025 16:40",
    createdon: "2025-07-07T14:40:10Z",
    osp_nombre:
      "THE RED KIWI San Sebastian de los Reyes Plantilla_Provision_Digital_Cen.xlsx",
    _ownerid: "GONZALEZ DIEZ, MIRIAM",
    "_ownerid_value@Microsoft.Dynamics.CRM.associatednavigationproperty":
      "ownerid",
    "_ownerid_value@Microsoft.Dynamics.CRM.lookuplogicalname": "systemuser",
    _ownerid_value: "6f5078c2-a430-eb11-80fa-0050568345f9",
    "osp_validadoordering@OData.Community.Display.V1.FormattedValue": "No",
    osp_validadoordering: false,
    osp_registro: "CAS-158941-P2S1Q0",
    "_osp_oportunidad_value@OData.Community.Display.V1.FormattedValue":
      "OPP-0078401 - proyecto covergente",
    "_osp_oportunidad_value@Microsoft.Dynamics.CRM.associatednavigationproperty":
      "osp_oportunidad",
    "_osp_oportunidad_value@Microsoft.Dynamics.CRM.lookuplogicalname":
      "opportunity",
    _osp_oportunidad_value: "53fac40b-c952-4c3c-a12a-778df2689633",
    "osp_tipificacion@OData.Community.Display.V1.FormattedValue":
      "Documentacion de proyecto y provisi\u00f3n",
    osp_tipificacion: 863920012,
    "osp_proyecto@OData.Community.Display.V1.FormattedValue": "No",
    osp_proyecto: false,
    osp_descripcion: "PLantilla",
    osp_link:
      "https://ggccorange.sharepoint.com/Dynamics/opportunity/OPP-0078401 - proyecto covergente/CAS-158941-P2S1Q0/THE RED KIWI San Sebastian de los Reyes Plantilla_Provision_Digital_Cen.xlsx",
    "osp_categoria@OData.Community.Display.V1.FormattedValue": "Centrex",
    osp_categoria: 8,
    _modifiedby: "GONZALEZ DIEZ, MIRIAM",
    "_modifiedby_value@Microsoft.Dynamics.CRM.lookuplogicalname": "systemuser",
    _modifiedby_value: "6f5078c2-a430-eb11-80fa-0050568345f9",
  },
  {
    "@odata.etag": 'W/"2644825055"',
    "modifiedon@OData.Community.Display.V1.FormattedValue": "05/02/2025 14:16",
    modifiedon: "2025-02-05T13:16:29Z",
    osp_subcategoria: null,
    osp_documentacionid: "f1085665-c3e3-ef11-a731-7c1e5270b733",
    "osp_validadocontratacion@OData.Community.Display.V1.FormattedValue": "No",
    osp_validadocontratacion: false,
    "createdon@OData.Community.Display.V1.FormattedValue": "05/02/2025 14:16",
    createdon: "2025-02-05T13:16:29Z",
    osp_nombre: "Oferta Orange WMClinics v3.pdf",
    _ownerid: "CRM, Admin",
    "_ownerid_value@Microsoft.Dynamics.CRM.associatednavigationproperty":
      "ownerid",
    "_ownerid_value@Microsoft.Dynamics.CRM.lookuplogicalname": "systemuser",
    _ownerid_value: "ac79a518-0950-e611-80c1-005056a03d45",
    "osp_validadoordering@OData.Community.Display.V1.FormattedValue": "No",
    osp_validadoordering: false,
    osp_registro: "OPP-0078401 - WAOC-0052691 - Proyecto convergente",
    "_osp_oportunidad_value@OData.Community.Display.V1.FormattedValue":
      "OPP-0078401 - proyecto covergente",
    "_osp_oportunidad_value@Microsoft.Dynamics.CRM.associatednavigationproperty":
      "osp_oportunidad",
    "_osp_oportunidad_value@Microsoft.Dynamics.CRM.lookuplogicalname":
      "opportunity",
    _osp_oportunidad_value: "53fac40b-c952-4c3c-a12a-778df2689633",
    "osp_tipificacion@OData.Community.Display.V1.FormattedValue": "PdN",
    osp_tipificacion: 863920001,
    "osp_proyecto@OData.Community.Display.V1.FormattedValue": "No",
    osp_proyecto: false,
    osp_descripcion: null,
    osp_link:
      "https://ggccorange.sharepoint.com/Dynamics/elob_validation/OPP-0078401 - WAOC-0052691 - Proyecto convergente/Oferta%20Orange%20WMClinics%20v3.pdf",
    osp_categoria: null,
    _modifiedby: "CRM, Admin",
    "_modifiedby_value@Microsoft.Dynamics.CRM.lookuplogicalname": "systemuser",
    _modifiedby_value: "ac79a518-0950-e611-80c1-005056a03d45",
  },
  {
    "@odata.etag": 'W/"3226163791"',
    "modifiedon@OData.Community.Display.V1.FormattedValue": "24/09/2025 9:46",
    modifiedon: "2025-09-24T07:46:05Z",
    osp_subcategoria: null,
    osp_documentacionid: "eabc0f81-1a99-f011-b4cb-7c1e52712018",
    "osp_validadocontratacion@OData.Community.Display.V1.FormattedValue": "No",
    osp_validadocontratacion: false,
    "createdon@OData.Community.Display.V1.FormattedValue": "24/09/2025 9:46",
    createdon: "2025-09-24T07:46:05Z",
    osp_nombre: "Oferta Orange-Dorsia 10\u00aa ENTREGA.xlsx",
    _ownerid: "GONZALEZ DIEZ, MIRIAM",
    "_ownerid_value@Microsoft.Dynamics.CRM.associatednavigationproperty":
      "ownerid",
    "_ownerid_value@Microsoft.Dynamics.CRM.lookuplogicalname": "systemuser",
    _ownerid_value: "6f5078c2-a430-eb11-80fa-0050568345f9",
    "osp_validadoordering@OData.Community.Display.V1.FormattedValue": "No",
    osp_validadoordering: false,
    osp_registro: "CAS-164421-N7F2J5",
    "_osp_oportunidad_value@OData.Community.Display.V1.FormattedValue":
      "OPP-0078401 - proyecto covergente",
    "_osp_oportunidad_value@Microsoft.Dynamics.CRM.associatednavigationproperty":
      "osp_oportunidad",
    "_osp_oportunidad_value@Microsoft.Dynamics.CRM.lookuplogicalname":
      "opportunity",
    _osp_oportunidad_value: "53fac40b-c952-4c3c-a12a-778df2689633",
    "osp_tipificacion@OData.Community.Display.V1.FormattedValue":
      "Ofertas de terceros",
    osp_tipificacion: 863920007,
    "osp_proyecto@OData.Community.Display.V1.FormattedValue": "No",
    osp_proyecto: false,
    osp_descripcion: "Oferta proveedor",
    osp_link:
      "https://ggccorange.sharepoint.com/Dynamics/opportunity/OPP-0078401 - proyecto covergente/CAS-164421-N7F2J5/Oferta Orange-Dorsia 10\u00aa ENTREGA.xlsx",
    "osp_categoria@OData.Community.Display.V1.FormattedValue":
      "Oferta de proveedores",
    osp_categoria: 20,
    _modifiedby: "GONZALEZ DIEZ, MIRIAM",
    "_modifiedby_value@Microsoft.Dynamics.CRM.lookuplogicalname": "systemuser",
    _modifiedby_value: "6f5078c2-a430-eb11-80fa-0050568345f9",
  },
  {
    "@odata.etag": 'W/"3226193068"',
    "modifiedon@OData.Community.Display.V1.FormattedValue": "24/09/2025 10:00",
    modifiedon: "2025-09-24T08:00:10Z",
    osp_subcategoria: null,
    osp_documentacionid: "28a76478-1c99-f011-b4cb-7c1e52712018",
    "osp_validadocontratacion@OData.Community.Display.V1.FormattedValue": "No",
    osp_validadocontratacion: false,
    "createdon@OData.Community.Display.V1.FormattedValue": "24/09/2025 10:00",
    createdon: "2025-09-24T08:00:10Z",
    osp_nombre: "Pedido Portatiles 23092025.msg",
    _ownerid: "GONZALEZ DIEZ, MIRIAM",
    "_ownerid_value@Microsoft.Dynamics.CRM.associatednavigationproperty":
      "ownerid",
    "_ownerid_value@Microsoft.Dynamics.CRM.lookuplogicalname": "systemuser",
    _ownerid_value: "6f5078c2-a430-eb11-80fa-0050568345f9",
    "osp_validadoordering@OData.Community.Display.V1.FormattedValue": "No",
    osp_validadoordering: false,
    osp_registro: "CAS-164423-C0X1L6",
    "_osp_oportunidad_value@OData.Community.Display.V1.FormattedValue":
      "OPP-0078401 - proyecto covergente",
    "_osp_oportunidad_value@Microsoft.Dynamics.CRM.associatednavigationproperty":
      "osp_oportunidad",
    "_osp_oportunidad_value@Microsoft.Dynamics.CRM.lookuplogicalname":
      "opportunity",
    _osp_oportunidad_value: "53fac40b-c952-4c3c-a12a-778df2689633",
    "osp_tipificacion@OData.Community.Display.V1.FormattedValue":
      "Requisitos Clientes",
    osp_tipificacion: 863920000,
    "osp_proyecto@OData.Community.Display.V1.FormattedValue": "No",
    osp_proyecto: false,
    osp_descripcion: "Requisitos cliente",
    osp_link:
      "https://ggccorange.sharepoint.com/Dynamics/opportunity/OPP-0078401 - proyecto covergente/CAS-164423-C0X1L6/Pedido Portatiles 23092025.msg",
    "osp_categoria@OData.Community.Display.V1.FormattedValue":
      "Inventario de requisitos",
    osp_categoria: 18,
    _modifiedby: "GONZALEZ DIEZ, MIRIAM",
    "_modifiedby_value@Microsoft.Dynamics.CRM.lookuplogicalname": "systemuser",
    _modifiedby_value: "6f5078c2-a430-eb11-80fa-0050568345f9",
  },
  {
    "@odata.etag": 'W/"3271156383"',
    "modifiedon@OData.Community.Display.V1.FormattedValue": "06/10/2025 9:39",
    modifiedon: "2025-10-06T07:39:04Z",
    osp_subcategoria: null,
    osp_documentacionid: "1caeaa86-87a2-f011-bbd3-7c1e5272831d",
    "osp_validadocontratacion@OData.Community.Display.V1.FormattedValue": "No",
    osp_validadocontratacion: false,
    "createdon@OData.Community.Display.V1.FormattedValue": "06/10/2025 9:39",
    createdon: "2025-10-06T07:39:04Z",
    osp_nombre: "Pedido Portatiles 03102025.msg",
    _ownerid: "GONZALEZ DIEZ, MIRIAM",
    "_ownerid_value@Microsoft.Dynamics.CRM.associatednavigationproperty":
      "ownerid",
    "_ownerid_value@Microsoft.Dynamics.CRM.lookuplogicalname": "systemuser",
    _ownerid_value: "6f5078c2-a430-eb11-80fa-0050568345f9",
    "osp_validadoordering@OData.Community.Display.V1.FormattedValue": "No",
    osp_validadoordering: false,
    osp_registro: "CAS-165478-Q7F5Z5",
    "_osp_oportunidad_value@OData.Community.Display.V1.FormattedValue":
      "OPP-0078401 - proyecto covergente",
    "_osp_oportunidad_value@Microsoft.Dynamics.CRM.associatednavigationproperty":
      "osp_oportunidad",
    "_osp_oportunidad_value@Microsoft.Dynamics.CRM.lookuplogicalname":
      "opportunity",
    _osp_oportunidad_value: "53fac40b-c952-4c3c-a12a-778df2689633",
    "osp_tipificacion@OData.Community.Display.V1.FormattedValue":
      "Requisitos Clientes",
    osp_tipificacion: 863920000,
    "osp_proyecto@OData.Community.Display.V1.FormattedValue": "No",
    osp_proyecto: false,
    osp_descripcion: "Requisitos cliente",
    osp_link:
      "https://ggccorange.sharepoint.com/Dynamics/opportunity/OPP-0078401 - proyecto covergente/CAS-165478-Q7F5Z5/Pedido Portatiles 03102025.msg",
    "osp_categoria@OData.Community.Display.V1.FormattedValue":
      "Inventario de requisitos",
    osp_categoria: 18,
    _modifiedby: "GONZALEZ DIEZ, MIRIAM",
    "_modifiedby_value@Microsoft.Dynamics.CRM.lookuplogicalname": "systemuser",
    _modifiedby_value: "6f5078c2-a430-eb11-80fa-0050568345f9",
  },
  {
    "@odata.etag": 'W/"3028238487"',
    "modifiedon@OData.Community.Display.V1.FormattedValue": "11/07/2025 16:33",
    modifiedon: "2025-07-11T14:33:09Z",
    osp_subcategoria: null,
    osp_documentacionid: "5ce27df1-635e-f011-bec1-7c1e5273a511",
    "osp_validadocontratacion@OData.Community.Display.V1.FormattedValue": "No",
    osp_validadocontratacion: false,
    "createdon@OData.Community.Display.V1.FormattedValue": "11/07/2025 16:33",
    createdon: "2025-07-11T14:33:09Z",
    osp_nombre: "THE RED KIWI LA CUCOSKA   INVENTARIO ORANGE.xlsx",
    _ownerid: "LAGO RUIZ, JOSE",
    "_ownerid_value@Microsoft.Dynamics.CRM.associatednavigationproperty":
      "ownerid",
    "_ownerid_value@Microsoft.Dynamics.CRM.lookuplogicalname": "systemuser",
    _ownerid_value: "039f6c0f-aaba-ee11-a569-6045bd905b10",
    "osp_validadoordering@OData.Community.Display.V1.FormattedValue": "No",
    osp_validadoordering: false,
    osp_registro: "CAS-159347-H9W7X1",
    "_osp_oportunidad_value@OData.Community.Display.V1.FormattedValue":
      "OPP-0078401 - proyecto covergente",
    "_osp_oportunidad_value@Microsoft.Dynamics.CRM.associatednavigationproperty":
      "osp_oportunidad",
    "_osp_oportunidad_value@Microsoft.Dynamics.CRM.lookuplogicalname":
      "opportunity",
    _osp_oportunidad_value: "53fac40b-c952-4c3c-a12a-778df2689633",
    "osp_tipificacion@OData.Community.Display.V1.FormattedValue":
      "Documentacion de proyecto y provisi\u00f3n",
    osp_tipificacion: 863920012,
    "osp_proyecto@OData.Community.Display.V1.FormattedValue": "No",
    osp_proyecto: false,
    osp_descripcion: null,
    osp_link:
      "https://ggccorange.sharepoint.com/Dynamics/opportunity/OPP-0078401 - proyecto covergente/CAS-159347-H9W7X1/THE RED KIWI LA CUCOSKA   INVENTARIO ORANGE.xlsx",
    osp_categoria: null,
    _modifiedby: "LAGO RUIZ, JOSE",
    "_modifiedby_value@Microsoft.Dynamics.CRM.lookuplogicalname": "systemuser",
    _modifiedby_value: "039f6c0f-aaba-ee11-a569-6045bd905b10",
  },
  {
    "@odata.etag": 'W/"3028238981"',
    "modifiedon@OData.Community.Display.V1.FormattedValue": "11/07/2025 16:33",
    modifiedon: "2025-07-11T14:33:42Z",
    osp_subcategoria: null,
    osp_documentacionid: "8c34a409-645e-f011-bec1-7c1e5273a511",
    "osp_validadocontratacion@OData.Community.Display.V1.FormattedValue": "No",
    osp_validadocontratacion: false,
    "createdon@OData.Community.Display.V1.FormattedValue": "11/07/2025 16:33",
    createdon: "2025-07-11T14:33:42Z",
    osp_nombre:
      "THE RED KIWI LA CUCOSKA  Plantilla_Provision_Digital_Centrex.xlsx",
    _ownerid: "LAGO RUIZ, JOSE",
    "_ownerid_value@Microsoft.Dynamics.CRM.associatednavigationproperty":
      "ownerid",
    "_ownerid_value@Microsoft.Dynamics.CRM.lookuplogicalname": "systemuser",
    _ownerid_value: "039f6c0f-aaba-ee11-a569-6045bd905b10",
    "osp_validadoordering@OData.Community.Display.V1.FormattedValue": "No",
    osp_validadoordering: false,
    osp_registro: "CAS-159347-H9W7X1",
    "_osp_oportunidad_value@OData.Community.Display.V1.FormattedValue":
      "OPP-0078401 - proyecto covergente",
    "_osp_oportunidad_value@Microsoft.Dynamics.CRM.associatednavigationproperty":
      "osp_oportunidad",
    "_osp_oportunidad_value@Microsoft.Dynamics.CRM.lookuplogicalname":
      "opportunity",
    _osp_oportunidad_value: "53fac40b-c952-4c3c-a12a-778df2689633",
    "osp_tipificacion@OData.Community.Display.V1.FormattedValue":
      "Documentacion de proyecto y provisi\u00f3n",
    osp_tipificacion: 863920012,
    "osp_proyecto@OData.Community.Display.V1.FormattedValue": "No",
    osp_proyecto: false,
    osp_descripcion: null,
    osp_link:
      "https://ggccorange.sharepoint.com/Dynamics/opportunity/OPP-0078401 - proyecto covergente/CAS-159347-H9W7X1/THE RED KIWI LA CUCOSKA  Plantilla_Provision_Digital_Centrex.xlsx",
    osp_categoria: null,
    _modifiedby: "LAGO RUIZ, JOSE",
    "_modifiedby_value@Microsoft.Dynamics.CRM.lookuplogicalname": "systemuser",
    _modifiedby_value: "039f6c0f-aaba-ee11-a569-6045bd905b10",
  },
  {
    "@odata.etag": 'W/"3619570299"',
    "modifiedon@OData.Community.Display.V1.FormattedValue": "12/01/2026 14:00",
    modifiedon: "2026-01-12T13:00:02Z",
    osp_subcategoria: null,
    osp_documentacionid: "d5e99995-b6ef-f011-8406-7c1e5273f697",
    "osp_validadocontratacion@OData.Community.Display.V1.FormattedValue": "No",
    osp_validadocontratacion: false,
    "createdon@OData.Community.Display.V1.FormattedValue": "12/01/2026 14:00",
    createdon: "2026-01-12T13:00:02Z",
    osp_nombre:
      "08012026_Mur_Gra_Alb_Ori_THE RED KIWI_Plantilla_Provision_Digital_Centrex.xlsm",
    _ownerid: "GONZALEZ DIEZ, MIRIAM",
    "_ownerid_value@Microsoft.Dynamics.CRM.associatednavigationproperty":
      "ownerid",
    "_ownerid_value@Microsoft.Dynamics.CRM.lookuplogicalname": "systemuser",
    _ownerid_value: "6f5078c2-a430-eb11-80fa-0050568345f9",
    "osp_validadoordering@OData.Community.Display.V1.FormattedValue": "No",
    osp_validadoordering: false,
    osp_registro: "CAS-173206-W8C3Y2",
    "_osp_oportunidad_value@OData.Community.Display.V1.FormattedValue":
      "OPP-0078401 - proyecto covergente",
    "_osp_oportunidad_value@Microsoft.Dynamics.CRM.associatednavigationproperty":
      "osp_oportunidad",
    "_osp_oportunidad_value@Microsoft.Dynamics.CRM.lookuplogicalname":
      "opportunity",
    _osp_oportunidad_value: "53fac40b-c952-4c3c-a12a-778df2689633",
    "osp_tipificacion@OData.Community.Display.V1.FormattedValue":
      "Documentacion de proyecto y provisi\u00f3n",
    osp_tipificacion: 863920012,
    "osp_proyecto@OData.Community.Display.V1.FormattedValue": "No",
    osp_proyecto: false,
    osp_descripcion: "Plantilla",
    osp_link:
      "https://ggccorange.sharepoint.com/Dynamics/opportunity/OPP-0078401 - proyecto covergente/CAS-173206-W8C3Y2/08012026_Mur_Gra_Alb_Ori_THE RED KIWI_Plantilla_Provision_Digital_Centrex.xlsm",
    "osp_categoria@OData.Community.Display.V1.FormattedValue": "Centrex",
    osp_categoria: 8,
    _modifiedby: "GONZALEZ DIEZ, MIRIAM",
    "_modifiedby_value@Microsoft.Dynamics.CRM.lookuplogicalname": "systemuser",
    _modifiedby_value: "6f5078c2-a430-eb11-80fa-0050568345f9",
  },
  {
    "@odata.etag": 'W/"3619571641"',
    "modifiedon@OData.Community.Display.V1.FormattedValue": "12/01/2026 14:00",
    modifiedon: "2026-01-12T13:00:35Z",
    osp_subcategoria: null,
    osp_documentacionid: "d53e31ae-b6ef-f011-8406-7c1e5273f697",
    "osp_validadocontratacion@OData.Community.Display.V1.FormattedValue": "No",
    osp_validadocontratacion: false,
    "createdon@OData.Community.Display.V1.FormattedValue": "12/01/2026 14:00",
    createdon: "2026-01-12T13:00:35Z",
    osp_nombre: "08012026_Mur_Gra_Alb_Ori_THE RED KIWI_INVENTARIO.xlsm",
    _ownerid: "GONZALEZ DIEZ, MIRIAM",
    "_ownerid_value@Microsoft.Dynamics.CRM.associatednavigationproperty":
      "ownerid",
    "_ownerid_value@Microsoft.Dynamics.CRM.lookuplogicalname": "systemuser",
    _ownerid_value: "6f5078c2-a430-eb11-80fa-0050568345f9",
    "osp_validadoordering@OData.Community.Display.V1.FormattedValue": "No",
    osp_validadoordering: false,
    osp_registro: "CAS-173206-W8C3Y2",
    "_osp_oportunidad_value@OData.Community.Display.V1.FormattedValue":
      "OPP-0078401 - proyecto covergente",
    "_osp_oportunidad_value@Microsoft.Dynamics.CRM.associatednavigationproperty":
      "osp_oportunidad",
    "_osp_oportunidad_value@Microsoft.Dynamics.CRM.lookuplogicalname":
      "opportunity",
    _osp_oportunidad_value: "53fac40b-c952-4c3c-a12a-778df2689633",
    "osp_tipificacion@OData.Community.Display.V1.FormattedValue":
      "Documentacion de proyecto y provisi\u00f3n",
    osp_tipificacion: 863920012,
    "osp_proyecto@OData.Community.Display.V1.FormattedValue": "No",
    osp_proyecto: false,
    osp_descripcion: "Inventario movil",
    osp_link:
      "https://ggccorange.sharepoint.com/Dynamics/opportunity/OPP-0078401 - proyecto covergente/CAS-173206-W8C3Y2/08012026_Mur_Gra_Alb_Ori_THE RED KIWI_INVENTARIO.xlsm",
    "osp_categoria@OData.Community.Display.V1.FormattedValue": "Centrex",
    osp_categoria: 8,
    _modifiedby: "GONZALEZ DIEZ, MIRIAM",
    "_modifiedby_value@Microsoft.Dynamics.CRM.lookuplogicalname": "systemuser",
    _modifiedby_value: "6f5078c2-a430-eb11-80fa-0050568345f9",
  },
];
    return rawData;
}